No.     Time           Source                Destination           Protocol Length Info
   3189 9.557620       host                  2.10.1                USB      277    URB_BULK out

Frame 3189: Packet, 277 bytes on wire (2216 bits), 277 bytes captured (2216 bits) on interface \\.\USBPcap2, id 0
USB URB
    [Source: host]
    [Destination: 2.10.1]
    USBPcap pseudoheader length: 27
    IRP ID: 0xffffb50bc6c0a010
    IRP USBD_STATUS: USBD_STATUS_SUCCESS (0x00000000)
    URB Function: URB_FUNCTION_BULK_OR_INTERRUPT_TRANSFER (0x0009)
    IRP information: 0x00, Direction: FDO -> PDO
    URB bus id: 2
    Device address: 10
    Endpoint: 0x01, Direction: OUT
    URB transfer type: URB_BULK (0x03)
    Packet Data Length: 250
    [Response in: 3190]
    [bInterfaceClass: Unknown (0xffff)]
Leftover Capture Data […]: 01ef6900000001000000c5d3000000000000000000000000000000000000000000000000000000000000000000000000000000000000000000000000000000000000000000000000000000000000000000000000000000000000000000000000000000000000000000

No.     Time           Source                Destination           Protocol Length Info
   3190 9.557710       2.10.1                host                  USB      27     URB_BULK out

Frame 3190: Packet, 27 bytes on wire (216 bits), 27 bytes captured (216 bits) on interface \\.\USBPcap2, id 0
USB URB
    [Source: 2.10.1]
    [Destination: host]
    USBPcap pseudoheader length: 27
    IRP ID: 0xffffb50bc6c0a010
    IRP USBD_STATUS: USBD_STATUS_CANCELED (0xc0010000)
    URB Function: URB_FUNCTION_BULK_OR_INTERRUPT_TRANSFER (0x0009)
    IRP information: 0x01, Direction: PDO -> FDO
    URB bus id: 2
    Device address: 10
    Endpoint: 0x01, Direction: OUT
    URB transfer type: URB_BULK (0x03)
    Packet Data Length: 0
    [Request in: 3189]
    [Time from request: 90.000 microseconds]
    [bInterfaceClass: Unknown (0xffff)]

No.     Time           Source                Destination           Protocol Length Info
   3197 9.569146       host                  2.10.0                USB      36     URB_CONTROL out

Frame 3197: Packet, 36 bytes on wire (288 bits), 36 bytes captured (288 bits) on interface \\.\USBPcap2, id 0
USB URB
    [Source: host]
    [Destination: 2.10.0]
    USBPcap pseudoheader length: 28
    IRP ID: 0xffffb50bc42ec010
    IRP USBD_STATUS: USBD_STATUS_SUCCESS (0x00000000)
    URB Function: URB_FUNCTION_CONTROL_TRANSFER (0x0008)
    IRP information: 0x00, Direction: FDO -> PDO
    URB bus id: 2
    Device address: 10
    Endpoint: 0x00, Direction: OUT
    URB transfer type: URB_CONTROL (0x02)
    Packet Data Length: 8
    [Response in: 3198]
    Control transfer stage: Setup (0)
    [bInterfaceClass: Unknown (0xffff)]
Setup Data

No.     Time           Source                Destination           Protocol Length Info
   3198 9.569305       2.10.0                host                  USB      28     URB_CONTROL out

Frame 3198: Packet, 28 bytes on wire (224 bits), 28 bytes captured (224 bits) on interface \\.\USBPcap2, id 0
USB URB
    [Source: 2.10.0]
    [Destination: host]
    USBPcap pseudoheader length: 28
    IRP ID: 0xffffb50bc42ec010
    IRP USBD_STATUS: USBD_STATUS_SUCCESS (0x00000000)
    URB Function: URB_FUNCTION_CONTROL_TRANSFER (0x0008)
    IRP information: 0x01, Direction: PDO -> FDO
    URB bus id: 2
    Device address: 10
    Endpoint: 0x00, Direction: OUT
    URB transfer type: URB_CONTROL (0x02)
    Packet Data Length: 0
    [Request in: 3197]
    [Time from request: 159.000 microseconds]
    Control transfer stage: Complete (3)
    [bInterfaceClass: Unknown (0xffff)]

No.     Time           Source                Destination           Protocol Length Info
   3201 9.569526       host                  2.10.0                USB      36     URB_CONTROL in

Frame 3201: Packet, 36 bytes on wire (288 bits), 36 bytes captured (288 bits) on interface \\.\USBPcap2, id 0
USB URB
    [Source: host]
    [Destination: 2.10.0]
    USBPcap pseudoheader length: 28
    IRP ID: 0xffffb50bc42ec010
    IRP USBD_STATUS: USBD_STATUS_SUCCESS (0x00000000)
    URB Function: URB_FUNCTION_CONTROL_TRANSFER (0x0008)
    IRP information: 0x00, Direction: FDO -> PDO
    URB bus id: 2
    Device address: 10
    Endpoint: 0x80, Direction: IN
    URB transfer type: URB_CONTROL (0x02)
    Packet Data Length: 8
    [Response in: 3202]
    Control transfer stage: Setup (0)
    [bInterfaceClass: Unknown (0xffff)]
Setup Data

No.     Time           Source                Destination           Protocol Length Info
   3202 9.569649       2.10.0                host                  USB      35     URB_CONTROL in

Frame 3202: Packet, 35 bytes on wire (280 bits), 35 bytes captured (280 bits) on interface \\.\USBPcap2, id 0
USB URB
    [Source: 2.10.0]
    [Destination: host]
    USBPcap pseudoheader length: 28
    IRP ID: 0xffffb50bc42ec010
    IRP USBD_STATUS: USBD_STATUS_SUCCESS (0x00000000)
    URB Function: URB_FUNCTION_CONTROL_TRANSFER (0x0008)
    IRP information: 0x01, Direction: PDO -> FDO
    URB bus id: 2
    Device address: 10
    Endpoint: 0x80, Direction: IN
    URB transfer type: URB_CONTROL (0x02)
    Packet Data Length: 7
    [Request in: 3201]
    [Time from request: 123.000 microseconds]
    Control transfer stage: Complete (3)
    [bInterfaceClass: Unknown (0xffff)]
CONTROL response data: 00c20100000008

No.     Time           Source                Destination           Protocol Length Info
   3203 9.569666       host                  2.10.0                USB      36     URB_CONTROL in

Frame 3203: Packet, 36 bytes on wire (288 bits), 36 bytes captured (288 bits) on interface \\.\USBPcap2, id 0
USB URB
    [Source: host]
    [Destination: 2.10.0]
    USBPcap pseudoheader length: 28
    IRP ID: 0xffffb50bc42ec010
    IRP USBD_STATUS: USBD_STATUS_SUCCESS (0x00000000)
    URB Function: URB_FUNCTION_CONTROL_TRANSFER (0x0008)
    IRP information: 0x00, Direction: FDO -> PDO
    URB bus id: 2
    Device address: 10
    Endpoint: 0x80, Direction: IN
    URB transfer type: URB_CONTROL (0x02)
    Packet Data Length: 8
    [Response in: 3204]
    Control transfer stage: Setup (0)
    [bInterfaceClass: Unknown (0xffff)]
Setup Data

No.     Time           Source                Destination           Protocol Length Info
   3204 9.569724       2.10.0                host                  USB      35     URB_CONTROL in

Frame 3204: Packet, 35 bytes on wire (280 bits), 35 bytes captured (280 bits) on interface \\.\USBPcap2, id 0
USB URB
    [Source: 2.10.0]
    [Destination: host]
    USBPcap pseudoheader length: 28
    IRP ID: 0xffffb50bc42ec010
    IRP USBD_STATUS: USBD_STATUS_SUCCESS (0x00000000)
    URB Function: URB_FUNCTION_CONTROL_TRANSFER (0x0008)
    IRP information: 0x01, Direction: PDO -> FDO
    URB bus id: 2
    Device address: 10
    Endpoint: 0x80, Direction: IN
    URB transfer type: URB_CONTROL (0x02)
    Packet Data Length: 7
    [Request in: 3203]
    [Time from request: 58.000 microseconds]
    Control transfer stage: Complete (3)
    [bInterfaceClass: Unknown (0xffff)]
CONTROL response data: 00c20100000008

No.     Time           Source                Destination           Protocol Length Info
   3205 9.569741       host                  2.10.0                USB      43     URB_CONTROL out

Frame 3205: Packet, 43 bytes on wire (344 bits), 43 bytes captured (344 bits) on interface \\.\USBPcap2, id 0
USB URB
    [Source: host]
    [Destination: 2.10.0]
    USBPcap pseudoheader length: 28
    IRP ID: 0xffffb50bc42ec010
    IRP USBD_STATUS: USBD_STATUS_SUCCESS (0x00000000)
    URB Function: URB_FUNCTION_CONTROL_TRANSFER (0x0008)
    IRP information: 0x00, Direction: FDO -> PDO
    URB bus id: 2
    Device address: 10
    Endpoint: 0x00, Direction: OUT
    URB transfer type: URB_CONTROL (0x02)
    Packet Data Length: 15
    [Response in: 3206]
    Control transfer stage: Setup (0)
    [bInterfaceClass: Unknown (0xffff)]
Setup Data

No.     Time           Source                Destination           Protocol Length Info
   3206 9.569849       2.10.0                host                  USB      28     URB_CONTROL out

Frame 3206: Packet, 28 bytes on wire (224 bits), 28 bytes captured (224 bits) on interface \\.\USBPcap2, id 0
USB URB
    [Source: 2.10.0]
    [Destination: host]
    USBPcap pseudoheader length: 28
    IRP ID: 0xffffb50bc42ec010
    IRP USBD_STATUS: USBD_STATUS_SUCCESS (0x00000000)
    URB Function: URB_FUNCTION_CONTROL_TRANSFER (0x0008)
    IRP information: 0x01, Direction: PDO -> FDO
    URB bus id: 2
    Device address: 10
    Endpoint: 0x00, Direction: OUT
    URB transfer type: URB_CONTROL (0x02)
    Packet Data Length: 0
    [Request in: 3205]
    [Time from request: 108.000 microseconds]
    Control transfer stage: Complete (3)
    [bInterfaceClass: Unknown (0xffff)]

No.     Time           Source                Destination           Protocol Length Info
   3207 9.569860       host                  2.10.0                USB      36     URB_CONTROL in

Frame 3207: Packet, 36 bytes on wire (288 bits), 36 bytes captured (288 bits) on interface \\.\USBPcap2, id 0
USB URB
    [Source: host]
    [Destination: 2.10.0]
    USBPcap pseudoheader length: 28
    IRP ID: 0xffffb50bc42ec010
    IRP USBD_STATUS: USBD_STATUS_SUCCESS (0x00000000)
    URB Function: URB_FUNCTION_CONTROL_TRANSFER (0x0008)
    IRP information: 0x00, Direction: FDO -> PDO
    URB bus id: 2
    Device address: 10
    Endpoint: 0x80, Direction: IN
    URB transfer type: URB_CONTROL (0x02)
    Packet Data Length: 8
    [Response in: 3208]
    Control transfer stage: Setup (0)
    [bInterfaceClass: Unknown (0xffff)]
Setup Data

No.     Time           Source                Destination           Protocol Length Info
   3208 9.569896       2.10.0                host                  USB      35     URB_CONTROL in

Frame 3208: Packet, 35 bytes on wire (280 bits), 35 bytes captured (280 bits) on interface \\.\USBPcap2, id 0
USB URB
    [Source: 2.10.0]
    [Destination: host]
    USBPcap pseudoheader length: 28
    IRP ID: 0xffffb50bc42ec010
    IRP USBD_STATUS: USBD_STATUS_SUCCESS (0x00000000)
    URB Function: URB_FUNCTION_CONTROL_TRANSFER (0x0008)
    IRP information: 0x01, Direction: PDO -> FDO
    URB bus id: 2
    Device address: 10
    Endpoint: 0x80, Direction: IN
    URB transfer type: URB_CONTROL (0x02)
    Packet Data Length: 7
    [Request in: 3207]
    [Time from request: 36.000 microseconds]
    Control transfer stage: Complete (3)
    [bInterfaceClass: Unknown (0xffff)]
CONTROL response data: 00c20100000008

No.     Time           Source                Destination           Protocol Length Info
   3209 9.569905       host                  2.10.0                USB      36     URB_CONTROL out

Frame 3209: Packet, 36 bytes on wire (288 bits), 36 bytes captured (288 bits) on interface \\.\USBPcap2, id 0
USB URB
    [Source: host]
    [Destination: 2.10.0]
    USBPcap pseudoheader length: 28
    IRP ID: 0xffffb50bc42ec010
    IRP USBD_STATUS: USBD_STATUS_SUCCESS (0x00000000)
    URB Function: URB_FUNCTION_CONTROL_TRANSFER (0x0008)
    IRP information: 0x00, Direction: FDO -> PDO
    URB bus id: 2
    Device address: 10
    Endpoint: 0x00, Direction: OUT
    URB transfer type: URB_CONTROL (0x02)
    Packet Data Length: 8
    [Response in: 3210]
    Control transfer stage: Setup (0)
    [bInterfaceClass: Unknown (0xffff)]
Setup Data

No.     Time           Source                Destination           Protocol Length Info
   3210 9.569946       2.10.0                host                  USB      28     URB_CONTROL out

Frame 3210: Packet, 28 bytes on wire (224 bits), 28 bytes captured (224 bits) on interface \\.\USBPcap2, id 0
USB URB
    [Source: 2.10.0]
    [Destination: host]
    USBPcap pseudoheader length: 28
    IRP ID: 0xffffb50bc42ec010
    IRP USBD_STATUS: USBD_STATUS_SUCCESS (0x00000000)
    URB Function: URB_FUNCTION_CONTROL_TRANSFER (0x0008)
    IRP information: 0x01, Direction: PDO -> FDO
    URB bus id: 2
    Device address: 10
    Endpoint: 0x00, Direction: OUT
    URB transfer type: URB_CONTROL (0x02)
    Packet Data Length: 0
    [Request in: 3209]
    [Time from request: 41.000 microseconds]
    Control transfer stage: Complete (3)
    [bInterfaceClass: Unknown (0xffff)]

No.     Time           Source                Destination           Protocol Length Info
   3211 9.569957       host                  2.10.0                USB      43     URB_CONTROL out

Frame 3211: Packet, 43 bytes on wire (344 bits), 43 bytes captured (344 bits) on interface \\.\USBPcap2, id 0
USB URB
    [Source: host]
    [Destination: 2.10.0]
    USBPcap pseudoheader length: 28
    IRP ID: 0xffffb50bc42ec010
    IRP USBD_STATUS: USBD_STATUS_SUCCESS (0x00000000)
    URB Function: URB_FUNCTION_CONTROL_TRANSFER (0x0008)
    IRP information: 0x00, Direction: FDO -> PDO
    URB bus id: 2
    Device address: 10
    Endpoint: 0x00, Direction: OUT
    URB transfer type: URB_CONTROL (0x02)
    Packet Data Length: 15
    [Response in: 3212]
    Control transfer stage: Setup (0)
    [bInterfaceClass: Unknown (0xffff)]
Setup Data

No.     Time           Source                Destination           Protocol Length Info
   3212 9.570082       2.10.0                host                  USB      28     URB_CONTROL out

Frame 3212: Packet, 28 bytes on wire (224 bits), 28 bytes captured (224 bits) on interface \\.\USBPcap2, id 0
USB URB
    [Source: 2.10.0]
    [Destination: host]
    USBPcap pseudoheader length: 28
    IRP ID: 0xffffb50bc42ec010
    IRP USBD_STATUS: USBD_STATUS_SUCCESS (0x00000000)
    URB Function: URB_FUNCTION_CONTROL_TRANSFER (0x0008)
    IRP information: 0x01, Direction: PDO -> FDO
    URB bus id: 2
    Device address: 10
    Endpoint: 0x00, Direction: OUT
    URB transfer type: URB_CONTROL (0x02)
    Packet Data Length: 0
    [Request in: 3211]
    [Time from request: 125.000 microseconds]
    Control transfer stage: Complete (3)
    [bInterfaceClass: Unknown (0xffff)]

No.     Time           Source                Destination           Protocol Length Info
   3213 9.570093       host                  2.10.0                USB      36     URB_CONTROL in

Frame 3213: Packet, 36 bytes on wire (288 bits), 36 bytes captured (288 bits) on interface \\.\USBPcap2, id 0
USB URB
    [Source: host]
    [Destination: 2.10.0]
    USBPcap pseudoheader length: 28
    IRP ID: 0xffffb50bc42ec010
    IRP USBD_STATUS: USBD_STATUS_SUCCESS (0x00000000)
    URB Function: URB_FUNCTION_CONTROL_TRANSFER (0x0008)
    IRP information: 0x00, Direction: FDO -> PDO
    URB bus id: 2
    Device address: 10
    Endpoint: 0x80, Direction: IN
    URB transfer type: URB_CONTROL (0x02)
    Packet Data Length: 8
    [Response in: 3214]
    Control transfer stage: Setup (0)
    [bInterfaceClass: Unknown (0xffff)]
Setup Data

No.     Time           Source                Destination           Protocol Length Info
   3214 9.570128       2.10.0                host                  USB      35     URB_CONTROL in

Frame 3214: Packet, 35 bytes on wire (280 bits), 35 bytes captured (280 bits) on interface \\.\USBPcap2, id 0
USB URB
    [Source: 2.10.0]
    [Destination: host]
    USBPcap pseudoheader length: 28
    IRP ID: 0xffffb50bc42ec010
    IRP USBD_STATUS: USBD_STATUS_SUCCESS (0x00000000)
    URB Function: URB_FUNCTION_CONTROL_TRANSFER (0x0008)
    IRP information: 0x01, Direction: PDO -> FDO
    URB bus id: 2
    Device address: 10
    Endpoint: 0x80, Direction: IN
    URB transfer type: URB_CONTROL (0x02)
    Packet Data Length: 7
    [Request in: 3213]
    [Time from request: 35.000 microseconds]
    Control transfer stage: Complete (3)
    [bInterfaceClass: Unknown (0xffff)]
CONTROL response data: 00c20100000008

No.     Time           Source                Destination           Protocol Length Info
   3215 9.570141       host                  2.10.0                USB      36     URB_CONTROL out

Frame 3215: Packet, 36 bytes on wire (288 bits), 36 bytes captured (288 bits) on interface \\.\USBPcap2, id 0
USB URB
    [Source: host]
    [Destination: 2.10.0]
    USBPcap pseudoheader length: 28
    IRP ID: 0xffffb50bc42ec010
    IRP USBD_STATUS: USBD_STATUS_SUCCESS (0x00000000)
    URB Function: URB_FUNCTION_CONTROL_TRANSFER (0x0008)
    IRP information: 0x00, Direction: FDO -> PDO
    URB bus id: 2
    Device address: 10
    Endpoint: 0x00, Direction: OUT
    URB transfer type: URB_CONTROL (0x02)
    Packet Data Length: 8
    [Response in: 3216]
    Control transfer stage: Setup (0)
    [bInterfaceClass: Unknown (0xffff)]
Setup Data

No.     Time           Source                Destination           Protocol Length Info
   3216 9.570183       2.10.0                host                  USB      28     URB_CONTROL out

Frame 3216: Packet, 28 bytes on wire (224 bits), 28 bytes captured (224 bits) on interface \\.\USBPcap2, id 0
USB URB
    [Source: 2.10.0]
    [Destination: host]
    USBPcap pseudoheader length: 28
    IRP ID: 0xffffb50bc42ec010
    IRP USBD_STATUS: USBD_STATUS_SUCCESS (0x00000000)
    URB Function: URB_FUNCTION_CONTROL_TRANSFER (0x0008)
    IRP information: 0x01, Direction: PDO -> FDO
    URB bus id: 2
    Device address: 10
    Endpoint: 0x00, Direction: OUT
    URB transfer type: URB_CONTROL (0x02)
    Packet Data Length: 0
    [Request in: 3215]
    [Time from request: 42.000 microseconds]
    Control transfer stage: Complete (3)
    [bInterfaceClass: Unknown (0xffff)]

No.     Time           Source                Destination           Protocol Length Info
   3217 9.570195       host                  2.10.0                USB      36     URB_CONTROL in

Frame 3217: Packet, 36 bytes on wire (288 bits), 36 bytes captured (288 bits) on interface \\.\USBPcap2, id 0
USB URB
    [Source: host]
    [Destination: 2.10.0]
    USBPcap pseudoheader length: 28
    IRP ID: 0xffffb50bc42ec010
    IRP USBD_STATUS: USBD_STATUS_SUCCESS (0x00000000)
    URB Function: URB_FUNCTION_CONTROL_TRANSFER (0x0008)
    IRP information: 0x00, Direction: FDO -> PDO
    URB bus id: 2
    Device address: 10
    Endpoint: 0x80, Direction: IN
    URB transfer type: URB_CONTROL (0x02)
    Packet Data Length: 8
    [Response in: 3218]
    Control transfer stage: Setup (0)
    [bInterfaceClass: Unknown (0xffff)]
Setup Data

No.     Time           Source                Destination           Protocol Length Info
   3218 9.570285       2.10.0                host                  USB      35     URB_CONTROL in

Frame 3218: Packet, 35 bytes on wire (280 bits), 35 bytes captured (280 bits) on interface \\.\USBPcap2, id 0
USB URB
    [Source: 2.10.0]
    [Destination: host]
    USBPcap pseudoheader length: 28
    IRP ID: 0xffffb50bc42ec010
    IRP USBD_STATUS: USBD_STATUS_SUCCESS (0x00000000)
    URB Function: URB_FUNCTION_CONTROL_TRANSFER (0x0008)
    IRP information: 0x01, Direction: PDO -> FDO
    URB bus id: 2
    Device address: 10
    Endpoint: 0x80, Direction: IN
    URB transfer type: URB_CONTROL (0x02)
    Packet Data Length: 7
    [Request in: 3217]
    [Time from request: 90.000 microseconds]
    Control transfer stage: Complete (3)
    [bInterfaceClass: Unknown (0xffff)]
CONTROL response data: 00c20100000008

No.     Time           Source                Destination           Protocol Length Info
   3219 9.570299       host                  2.10.0                USB      36     URB_CONTROL in

Frame 3219: Packet, 36 bytes on wire (288 bits), 36 bytes captured (288 bits) on interface \\.\USBPcap2, id 0
USB URB
    [Source: host]
    [Destination: 2.10.0]
    USBPcap pseudoheader length: 28
    IRP ID: 0xffffb50bc42ec010
    IRP USBD_STATUS: USBD_STATUS_SUCCESS (0x00000000)
    URB Function: URB_FUNCTION_CONTROL_TRANSFER (0x0008)
    IRP information: 0x00, Direction: FDO -> PDO
    URB bus id: 2
    Device address: 10
    Endpoint: 0x80, Direction: IN
    URB transfer type: URB_CONTROL (0x02)
    Packet Data Length: 8
    [Response in: 3220]
    Control transfer stage: Setup (0)
    [bInterfaceClass: Unknown (0xffff)]
Setup Data

No.     Time           Source                Destination           Protocol Length Info
   3220 9.570352       2.10.0                host                  USB      35     URB_CONTROL in

Frame 3220: Packet, 35 bytes on wire (280 bits), 35 bytes captured (280 bits) on interface \\.\USBPcap2, id 0
USB URB
    [Source: 2.10.0]
    [Destination: host]
    USBPcap pseudoheader length: 28
    IRP ID: 0xffffb50bc42ec010
    IRP USBD_STATUS: USBD_STATUS_SUCCESS (0x00000000)
    URB Function: URB_FUNCTION_CONTROL_TRANSFER (0x0008)
    IRP information: 0x01, Direction: PDO -> FDO
    URB bus id: 2
    Device address: 10
    Endpoint: 0x80, Direction: IN
    URB transfer type: URB_CONTROL (0x02)
    Packet Data Length: 7
    [Request in: 3219]
    [Time from request: 53.000 microseconds]
    Control transfer stage: Complete (3)
    [bInterfaceClass: Unknown (0xffff)]
CONTROL response data: 00c20100000008

No.     Time           Source                Destination           Protocol Length Info
   3221 9.570564       host                  2.10.1                USB      277    URB_BULK out

Frame 3221: Packet, 277 bytes on wire (2216 bits), 277 bytes captured (2216 bits) on interface \\.\USBPcap2, id 0
USB URB
    [Source: host]
    [Destination: 2.10.1]
    USBPcap pseudoheader length: 27
    IRP ID: 0xffffb50bc6bdc010
    IRP USBD_STATUS: USBD_STATUS_SUCCESS (0x00000000)
    URB Function: URB_FUNCTION_BULK_OR_INTERRUPT_TRANSFER (0x0009)
    IRP information: 0x00, Direction: FDO -> PDO
    URB bus id: 2
    Device address: 10
    Endpoint: 0x01, Direction: OUT
    URB transfer type: URB_BULK (0x03)
    Packet Data Length: 250
    [Response in: 3222]
    [bInterfaceClass: Unknown (0xffff)]
Leftover Capture Data […]: 01ef6900000001000000c5d3000000000000000000000000000000000000000000000000000000000000000000000000000000000000000000000000000000000000000000000000000000000000000000000000000000000000000000000000000000000000000000

No.     Time           Source                Destination           Protocol Length Info
   3222 9.570606       2.10.1                host                  USB      27     URB_BULK out

Frame 3222: Packet, 27 bytes on wire (216 bits), 27 bytes captured (216 bits) on interface \\.\USBPcap2, id 0
USB URB
    [Source: 2.10.1]
    [Destination: host]
    USBPcap pseudoheader length: 27
    IRP ID: 0xffffb50bc6bdc010
    IRP USBD_STATUS: USBD_STATUS_SUCCESS (0x00000000)
    URB Function: URB_FUNCTION_BULK_OR_INTERRUPT_TRANSFER (0x0009)
    IRP information: 0x01, Direction: PDO -> FDO
    URB bus id: 2
    Device address: 10
    Endpoint: 0x01, Direction: OUT
    URB transfer type: URB_BULK (0x03)
    Packet Data Length: 0
    [Request in: 3221]
    [Time from request: 42.000 microseconds]
    [bInterfaceClass: Unknown (0xffff)]

No.     Time           Source                Destination           Protocol Length Info
   3237 9.614928       host                  2.10.1                USB      277    URB_BULK out

Frame 3237: Packet, 277 bytes on wire (2216 bits), 277 bytes captured (2216 bits) on interface \\.\USBPcap2, id 0
USB URB
    [Source: host]
    [Destination: 2.10.1]
    USBPcap pseudoheader length: 27
    IRP ID: 0xffffb50bc6c08010
    IRP USBD_STATUS: USBD_STATUS_SUCCESS (0x00000000)
    URB Function: URB_FUNCTION_BULK_OR_INTERRUPT_TRANSFER (0x0009)
    IRP information: 0x00, Direction: FDO -> PDO
    URB bus id: 2
    Device address: 10
    Endpoint: 0x01, Direction: OUT
    URB transfer type: URB_BULK (0x03)
    Packet Data Length: 250
    [Response in: 3238]
    [bInterfaceClass: Unknown (0xffff)]
Leftover Capture Data […]: 79ef69000000010000000000000000000000000000000000000000000000000000000000000000000000000000000000000000000000000000000000000000000000000000000000000000000000000000000000000000000000000000000000000000000000000000

No.     Time           Source                Destination           Protocol Length Info
   3238 9.614995       2.10.1                host                  USB      27     URB_BULK out

Frame 3238: Packet, 27 bytes on wire (216 bits), 27 bytes captured (216 bits) on interface \\.\USBPcap2, id 0
USB URB
    [Source: 2.10.1]
    [Destination: host]
    USBPcap pseudoheader length: 27
    IRP ID: 0xffffb50bc6c08010
    IRP USBD_STATUS: USBD_STATUS_SUCCESS (0x00000000)
    URB Function: URB_FUNCTION_BULK_OR_INTERRUPT_TRANSFER (0x0009)
    IRP information: 0x01, Direction: PDO -> FDO
    URB bus id: 2
    Device address: 10
    Endpoint: 0x01, Direction: OUT
    URB transfer type: URB_BULK (0x03)
    Packet Data Length: 0
    [Request in: 3237]
    [Time from request: 67.000 microseconds]
    [bInterfaceClass: Unknown (0xffff)]

No.     Time           Source                Destination           Protocol Length Info
   3307 9.815708       host                  2.10.1                USB      277    URB_BULK out

Frame 3307: Packet, 277 bytes on wire (2216 bits), 277 bytes captured (2216 bits) on interface \\.\USBPcap2, id 0
USB URB
    [Source: host]
    [Destination: 2.10.1]
    USBPcap pseudoheader length: 27
    IRP ID: 0xffffb50bc6c08010
    IRP USBD_STATUS: USBD_STATUS_SUCCESS (0x00000000)
    URB Function: URB_FUNCTION_BULK_OR_INTERRUPT_TRANSFER (0x0009)
    IRP information: 0x00, Direction: FDO -> PDO
    URB bus id: 2
    Device address: 10
    Endpoint: 0x01, Direction: OUT
    URB transfer type: URB_BULK (0x03)
    Packet Data Length: 250
    [Response in: 3308]
    [bInterfaceClass: Unknown (0xffff)]
Leftover Capture Data […]: 96ef69000000010000000000000000000000000000000000000000000000000000000000000000000000000000000000000000000000000000000000000000000000000000000000000000000000000000000000000000000000000000000000000000000000000000

No.     Time           Source                Destination           Protocol Length Info
   3308 9.815769       2.10.1                host                  USB      27     URB_BULK out

Frame 3308: Packet, 27 bytes on wire (216 bits), 27 bytes captured (216 bits) on interface \\.\USBPcap2, id 0
USB URB
    [Source: 2.10.1]
    [Destination: host]
    USBPcap pseudoheader length: 27
    IRP ID: 0xffffb50bc6c08010
    IRP USBD_STATUS: USBD_STATUS_SUCCESS (0x00000000)
    URB Function: URB_FUNCTION_BULK_OR_INTERRUPT_TRANSFER (0x0009)
    IRP information: 0x01, Direction: PDO -> FDO
    URB bus id: 2
    Device address: 10
    Endpoint: 0x01, Direction: OUT
    URB transfer type: URB_BULK (0x03)
    Packet Data Length: 0
    [Request in: 3307]
    [Time from request: 61.000 microseconds]
    [bInterfaceClass: Unknown (0xffff)]

No.     Time           Source                Destination           Protocol Length Info
   3419 10.140791      host                  2.10.1                USB      277    URB_BULK out

Frame 3419: Packet, 277 bytes on wire (2216 bits), 277 bytes captured (2216 bits) on interface \\.\USBPcap2, id 0
USB URB
    [Source: host]
    [Destination: 2.10.1]
    USBPcap pseudoheader length: 27
    IRP ID: 0xffffb50bc6bdc010
    IRP USBD_STATUS: USBD_STATUS_SUCCESS (0x00000000)
    URB Function: URB_FUNCTION_BULK_OR_INTERRUPT_TRANSFER (0x0009)
    IRP information: 0x00, Direction: FDO -> PDO
    URB bus id: 2
    Device address: 10
    Endpoint: 0x01, Direction: OUT
    URB transfer type: URB_BULK (0x03)
    Packet Data Length: 250
    [Response in: 3420]
    [bInterfaceClass: Unknown (0xffff)]
Leftover Capture Data […]: 7bef69000000010000008000000000000000000000000000000000000000000000000000000000000000000000000000000000000000000000000000000000000000000000000000000000000000000000000000000000000000000000000000000000000000000000

No.     Time           Source                Destination           Protocol Length Info
   3420 10.140858      2.10.1                host                  USB      27     URB_BULK out

Frame 3420: Packet, 27 bytes on wire (216 bits), 27 bytes captured (216 bits) on interface \\.\USBPcap2, id 0
USB URB
    [Source: 2.10.1]
    [Destination: host]
    USBPcap pseudoheader length: 27
    IRP ID: 0xffffb50bc6bdc010
    IRP USBD_STATUS: USBD_STATUS_SUCCESS (0x00000000)
    URB Function: URB_FUNCTION_BULK_OR_INTERRUPT_TRANSFER (0x0009)
    IRP information: 0x01, Direction: PDO -> FDO
    URB bus id: 2
    Device address: 10
    Endpoint: 0x01, Direction: OUT
    URB transfer type: URB_BULK (0x03)
    Packet Data Length: 0
    [Request in: 3419]
    [Time from request: 67.000 microseconds]
    [bInterfaceClass: Unknown (0xffff)]

No.     Time           Source                Destination           Protocol Length Info
   3441 10.203911      host                  2.10.1                USB      277    URB_BULK out

Frame 3441: Packet, 277 bytes on wire (2216 bits), 277 bytes captured (2216 bits) on interface \\.\USBPcap2, id 0
USB URB
    [Source: host]
    [Destination: 2.10.1]
    USBPcap pseudoheader length: 27
    IRP ID: 0xffffb50bc6bdc010
    IRP USBD_STATUS: USBD_STATUS_SUCCESS (0x00000000)
    URB Function: URB_FUNCTION_BULK_OR_INTERRUPT_TRANSFER (0x0009)
    IRP information: 0x00, Direction: FDO -> PDO
    URB bus id: 2
    Device address: 10
    Endpoint: 0x01, Direction: OUT
    URB transfer type: URB_BULK (0x03)
    Packet Data Length: 250
    [Response in: 3442]
    [bInterfaceClass: Unknown (0xffff)]
Leftover Capture Data […]: 7def69000000050000008000000000000000000000000000000000000000000000000000000000000000000000000000000000000000000000000000000000000000000000000000000000000000000000000000000000000000000000000000000000000000000000

No.     Time           Source                Destination           Protocol Length Info
   3442 10.203961      2.10.1                host                  USB      27     URB_BULK out

Frame 3442: Packet, 27 bytes on wire (216 bits), 27 bytes captured (216 bits) on interface \\.\USBPcap2, id 0
USB URB
    [Source: 2.10.1]
    [Destination: host]
    USBPcap pseudoheader length: 27
    IRP ID: 0xffffb50bc6bdc010
    IRP USBD_STATUS: USBD_STATUS_SUCCESS (0x00000000)
    URB Function: URB_FUNCTION_BULK_OR_INTERRUPT_TRANSFER (0x0009)
    IRP information: 0x01, Direction: PDO -> FDO
    URB bus id: 2
    Device address: 10
    Endpoint: 0x01, Direction: OUT
    URB transfer type: URB_BULK (0x03)
    Packet Data Length: 0
    [Request in: 3441]
    [Time from request: 50.000 microseconds]
    [bInterfaceClass: Unknown (0xffff)]

No.     Time           Source                Destination           Protocol Length Info
   3451 10.225788      host                  2.10.1                USB      277    URB_BULK out

Frame 3451: Packet, 277 bytes on wire (2216 bits), 277 bytes captured (2216 bits) on interface \\.\USBPcap2, id 0
USB URB
    [Source: host]
    [Destination: 2.10.1]
    USBPcap pseudoheader length: 27
    IRP ID: 0xffffb50bc6c0a010
    IRP USBD_STATUS: USBD_STATUS_SUCCESS (0x00000000)
    URB Function: URB_FUNCTION_BULK_OR_INTERRUPT_TRANSFER (0x0009)
    IRP information: 0x00, Direction: FDO -> PDO
    URB bus id: 2
    Device address: 10
    Endpoint: 0x01, Direction: OUT
    URB transfer type: URB_BULK (0x03)
    Packet Data Length: 250
    [Response in: 3452]
    [bInterfaceClass: Unknown (0xffff)]
Leftover Capture Data […]: 64ef69000000010000000000000000000000000000000000000000000000000000000000000000000000000000000000000000000000000000000000000000000000000000000000000000000000000000000000000000000000000000000000000000000000000000

No.     Time           Source                Destination           Protocol Length Info
   3452 10.225858      2.10.1                host                  USB      27     URB_BULK out

Frame 3452: Packet, 27 bytes on wire (216 bits), 27 bytes captured (216 bits) on interface \\.\USBPcap2, id 0
USB URB
    [Source: 2.10.1]
    [Destination: host]
    USBPcap pseudoheader length: 27
    IRP ID: 0xffffb50bc6c0a010
    IRP USBD_STATUS: USBD_STATUS_SUCCESS (0x00000000)
    URB Function: URB_FUNCTION_BULK_OR_INTERRUPT_TRANSFER (0x0009)
    IRP information: 0x01, Direction: PDO -> FDO
    URB bus id: 2
    Device address: 10
    Endpoint: 0x01, Direction: OUT
    URB transfer type: URB_BULK (0x03)
    Packet Data Length: 0
    [Request in: 3451]
    [Time from request: 70.000 microseconds]
    [bInterfaceClass: Unknown (0xffff)]

No.     Time           Source                Destination           Protocol Length Info
   3499 10.359933      host                  2.10.1                USB      277    URB_BULK out

Frame 3499: Packet, 277 bytes on wire (2216 bits), 277 bytes captured (2216 bits) on interface \\.\USBPcap2, id 0
USB URB
    [Source: host]
    [Destination: 2.10.1]
    USBPcap pseudoheader length: 27
    IRP ID: 0xffffb50bc6bdc010
    IRP USBD_STATUS: USBD_STATUS_SUCCESS (0x00000000)
    URB Function: URB_FUNCTION_BULK_OR_INTERRUPT_TRANSFER (0x0009)
    IRP information: 0x00, Direction: FDO -> PDO
    URB bus id: 2
    Device address: 10
    Endpoint: 0x01, Direction: OUT
    URB transfer type: URB_BULK (0x03)
    Packet Data Length: 250
    [Response in: 3501]
    [bInterfaceClass: Unknown (0xffff)]
Leftover Capture Data […]: 6eef69000000130000002f746d702f766964656f2f415331352e6d703400000000000000000000000000000000000000000000000000000000000000000000000000000000000000000000000000000000000000000000000000000000000000000000000000000000

No.     Time           Source                Destination           Protocol Length Info
   3501 10.360040      2.10.1                host                  USB      27     URB_BULK out

Frame 3501: Packet, 27 bytes on wire (216 bits), 27 bytes captured (216 bits) on interface \\.\USBPcap2, id 0
USB URB
    [Source: 2.10.1]
    [Destination: host]
    USBPcap pseudoheader length: 27
    IRP ID: 0xffffb50bc6bdc010
    IRP USBD_STATUS: USBD_STATUS_SUCCESS (0x00000000)
    URB Function: URB_FUNCTION_BULK_OR_INTERRUPT_TRANSFER (0x0009)
    IRP information: 0x01, Direction: PDO -> FDO
    URB bus id: 2
    Device address: 10
    Endpoint: 0x01, Direction: OUT
    URB transfer type: URB_BULK (0x03)
    Packet Data Length: 0
    [Request in: 3499]
    [Time from request: 107.000 microseconds]
    [bInterfaceClass: Unknown (0xffff)]

No.     Time           Source                Destination           Protocol Length Info
   3511 10.372872      host                  2.10.1                USB      277    URB_BULK out

Frame 3511: Packet, 277 bytes on wire (2216 bits), 277 bytes captured (2216 bits) on interface \\.\USBPcap2, id 0
USB URB
    [Source: host]
    [Destination: 2.10.1]
    USBPcap pseudoheader length: 27
    IRP ID: 0xffffb50bc6c08010
    IRP USBD_STATUS: USBD_STATUS_SUCCESS (0x00000000)
    URB Function: URB_FUNCTION_BULK_OR_INTERRUPT_TRANSFER (0x0009)
    IRP information: 0x00, Direction: FDO -> PDO
    URB bus id: 2
    Device address: 10
    Endpoint: 0x01, Direction: OUT
    URB transfer type: URB_BULK (0x03)
    Packet Data Length: 250
    [Response in: 3512]
    [bInterfaceClass: Unknown (0xffff)]
Leftover Capture Data […]: 6eef69000000140000002f726f6f742f766964656f2f415331352e6d7034000000000000000000000000000000000000000000000000000000000000000000000000000000000000000000000000000000000000000000000000000000000000000000000000000000

No.     Time           Source                Destination           Protocol Length Info
   3512 10.372909      2.10.1                host                  USB      27     URB_BULK out

Frame 3512: Packet, 27 bytes on wire (216 bits), 27 bytes captured (216 bits) on interface \\.\USBPcap2, id 0
USB URB
    [Source: 2.10.1]
    [Destination: host]
    USBPcap pseudoheader length: 27
    IRP ID: 0xffffb50bc6c08010
    IRP USBD_STATUS: USBD_STATUS_SUCCESS (0x00000000)
    URB Function: URB_FUNCTION_BULK_OR_INTERRUPT_TRANSFER (0x0009)
    IRP information: 0x01, Direction: PDO -> FDO
    URB bus id: 2
    Device address: 10
    Endpoint: 0x01, Direction: OUT
    URB transfer type: URB_BULK (0x03)
    Packet Data Length: 0
    [Request in: 3511]
    [Time from request: 37.000 microseconds]
    [bInterfaceClass: Unknown (0xffff)]

No.     Time           Source                Destination           Protocol Length Info
   3515 10.383822      host                  2.10.1                USB      277    URB_BULK out

Frame 3515: Packet, 277 bytes on wire (2216 bits), 277 bytes captured (2216 bits) on interface \\.\USBPcap2, id 0
USB URB
    [Source: host]
    [Destination: 2.10.1]
    USBPcap pseudoheader length: 27
    IRP ID: 0xffffb50bc6bdc010
    IRP USBD_STATUS: USBD_STATUS_SUCCESS (0x00000000)
    URB Function: URB_FUNCTION_BULK_OR_INTERRUPT_TRANSFER (0x0009)
    IRP information: 0x00, Direction: FDO -> PDO
    URB bus id: 2
    Device address: 10
    Endpoint: 0x01, Direction: OUT
    URB transfer type: URB_BULK (0x03)
    Packet Data Length: 250
    [Response in: 3516]
    [bInterfaceClass: Unknown (0xffff)]
Leftover Capture Data […]: 6eef690000001a0000002f6d6e742f5344434152442f766964656f2f415331352e6d7034000000000000000000000000000000000000000000000000000000000000000000000000000000000000000000000000000000000000000000000000000000000000000000

No.     Time           Source                Destination           Protocol Length Info
   3516 10.383871      2.10.1                host                  USB      27     URB_BULK out

Frame 3516: Packet, 27 bytes on wire (216 bits), 27 bytes captured (216 bits) on interface \\.\USBPcap2, id 0
USB URB
    [Source: 2.10.1]
    [Destination: host]
    USBPcap pseudoheader length: 27
    IRP ID: 0xffffb50bc6bdc010
    IRP USBD_STATUS: USBD_STATUS_SUCCESS (0x00000000)
    URB Function: URB_FUNCTION_BULK_OR_INTERRUPT_TRANSFER (0x0009)
    IRP information: 0x01, Direction: PDO -> FDO
    URB bus id: 2
    Device address: 10
    Endpoint: 0x01, Direction: OUT
    URB transfer type: URB_BULK (0x03)
    Packet Data Length: 0
    [Request in: 3515]
    [Time from request: 49.000 microseconds]
    [bInterfaceClass: Unknown (0xffff)]

No.     Time           Source                Destination           Protocol Length Info
   3523 10.394906      host                  2.10.1                USB      277    URB_BULK out

Frame 3523: Packet, 277 bytes on wire (2216 bits), 277 bytes captured (2216 bits) on interface \\.\USBPcap2, id 0
USB URB
    [Source: host]
    [Destination: 2.10.1]
    USBPcap pseudoheader length: 27
    IRP ID: 0xffffb50bc6c08010
    IRP USBD_STATUS: USBD_STATUS_SUCCESS (0x00000000)
    URB Function: URB_FUNCTION_BULK_OR_INTERRUPT_TRANSFER (0x0009)
    IRP information: 0x00, Direction: FDO -> PDO
    URB bus id: 2
    Device address: 10
    Endpoint: 0x01, Direction: OUT
    URB transfer type: URB_BULK (0x03)
    Packet Data Length: 250
    [Response in: 3524]
    [bInterfaceClass: Unknown (0xffff)]
Leftover Capture Data […]: 82ef69000000010000000000000000000000000000000000000000000000000000000000000000000000000000000000000000000000000000000000000000000000000000000000000000000000000000000000000000000000000000000000000000000000000000

No.     Time           Source                Destination           Protocol Length Info
   3524 10.394958      2.10.1                host                  USB      27     URB_BULK out

Frame 3524: Packet, 27 bytes on wire (216 bits), 27 bytes captured (216 bits) on interface \\.\USBPcap2, id 0
USB URB
    [Source: 2.10.1]
    [Destination: host]
    USBPcap pseudoheader length: 27
    IRP ID: 0xffffb50bc6c08010
    IRP USBD_STATUS: USBD_STATUS_SUCCESS (0x00000000)
    URB Function: URB_FUNCTION_BULK_OR_INTERRUPT_TRANSFER (0x0009)
    IRP information: 0x01, Direction: PDO -> FDO
    URB bus id: 2
    Device address: 10
    Endpoint: 0x01, Direction: OUT
    URB transfer type: URB_BULK (0x03)
    Packet Data Length: 0
    [Request in: 3523]
    [Time from request: 52.000 microseconds]
    [bInterfaceClass: Unknown (0xffff)]

No.     Time           Source                Destination           Protocol Length Info
   4193 12.395996      host                  2.10.1                USB      277    URB_BULK out

Frame 4193: Packet, 277 bytes on wire (2216 bits), 277 bytes captured (2216 bits) on interface \\.\USBPcap2, id 0
USB URB
    [Source: host]
    [Destination: 2.10.1]
    USBPcap pseudoheader length: 27
    IRP ID: 0xffffb50bc6c0a010
    IRP USBD_STATUS: USBD_STATUS_SUCCESS (0x00000000)
    URB Function: URB_FUNCTION_BULK_OR_INTERRUPT_TRANSFER (0x0009)
    IRP information: 0x00, Direction: FDO -> PDO
    URB bus id: 2
    Device address: 10
    Endpoint: 0x01, Direction: OUT
    URB transfer type: URB_BULK (0x03)
    Packet Data Length: 250
    [Response in: 4194]
    [bInterfaceClass: Unknown (0xffff)]
Leftover Capture Data […]: 01ef6900000001000000c5d3000000000000000000000000000000000000000000000000000000000000000000000000000000000000000000000000000000000000000000000000000000000000000000000000000000000000000000000000000000000000000000

No.     Time           Source                Destination           Protocol Length Info
   4194 12.396052      2.10.1                host                  USB      27     URB_BULK out

Frame 4194: Packet, 27 bytes on wire (216 bits), 27 bytes captured (216 bits) on interface \\.\USBPcap2, id 0
USB URB
    [Source: 2.10.1]
    [Destination: host]
    USBPcap pseudoheader length: 27
    IRP ID: 0xffffb50bc6c0a010
    IRP USBD_STATUS: USBD_STATUS_SUCCESS (0x00000000)
    URB Function: URB_FUNCTION_BULK_OR_INTERRUPT_TRANSFER (0x0009)
    IRP information: 0x01, Direction: PDO -> FDO
    URB bus id: 2
    Device address: 10
    Endpoint: 0x01, Direction: OUT
    URB transfer type: URB_BULK (0x03)
    Packet Data Length: 0
    [Request in: 4193]
    [Time from request: 56.000 microseconds]
    [bInterfaceClass: Unknown (0xffff)]

No.     Time           Source                Destination           Protocol Length Info
   4537 13.413426      host                  2.10.0                USB      36     URB_CONTROL out

Frame 4537: Packet, 36 bytes on wire (288 bits), 36 bytes captured (288 bits) on interface \\.\USBPcap2, id 0
USB URB
    [Source: host]
    [Destination: 2.10.0]
    USBPcap pseudoheader length: 28
    IRP ID: 0xffffb50bca92d560
    IRP USBD_STATUS: USBD_STATUS_SUCCESS (0x00000000)
    URB Function: URB_FUNCTION_CONTROL_TRANSFER (0x0008)
    IRP information: 0x00, Direction: FDO -> PDO
    URB bus id: 2
    Device address: 10
    Endpoint: 0x00, Direction: OUT
    URB transfer type: URB_CONTROL (0x02)
    Packet Data Length: 8
    [Response in: 4538]
    Control transfer stage: Setup (0)
    [bInterfaceClass: Unknown (0xffff)]
Setup Data

No.     Time           Source                Destination           Protocol Length Info
   4538 13.413467      2.10.0                host                  USB      28     URB_CONTROL out

Frame 4538: Packet, 28 bytes on wire (224 bits), 28 bytes captured (224 bits) on interface \\.\USBPcap2, id 0
USB URB
    [Source: 2.10.0]
    [Destination: host]
    USBPcap pseudoheader length: 28
    IRP ID: 0xffffb50bca92d560
    IRP USBD_STATUS: USBD_STATUS_SUCCESS (0x00000000)
    URB Function: URB_FUNCTION_CONTROL_TRANSFER (0x0008)
    IRP information: 0x01, Direction: PDO -> FDO
    URB bus id: 2
    Device address: 10
    Endpoint: 0x00, Direction: OUT
    URB transfer type: URB_CONTROL (0x02)
    Packet Data Length: 0
    [Request in: 4537]
    [Time from request: 41.000 microseconds]
    Control transfer stage: Complete (3)
    [bInterfaceClass: Unknown (0xffff)]

No.     Time           Source                Destination           Protocol Length Info
   4541 13.413544      host                  2.10.0                USB      36     URB_CONTROL in

Frame 4541: Packet, 36 bytes on wire (288 bits), 36 bytes captured (288 bits) on interface \\.\USBPcap2, id 0
USB URB
    [Source: host]
    [Destination: 2.10.0]
    USBPcap pseudoheader length: 28
    IRP ID: 0xffffb50bca92d560
    IRP USBD_STATUS: USBD_STATUS_SUCCESS (0x00000000)
    URB Function: URB_FUNCTION_CONTROL_TRANSFER (0x0008)
    IRP information: 0x00, Direction: FDO -> PDO
    URB bus id: 2
    Device address: 10
    Endpoint: 0x80, Direction: IN
    URB transfer type: URB_CONTROL (0x02)
    Packet Data Length: 8
    [Response in: 4542]
    Control transfer stage: Setup (0)
    [bInterfaceClass: Unknown (0xffff)]
Setup Data

No.     Time           Source                Destination           Protocol Length Info
   4542 13.413621      2.10.0                host                  USB      35     URB_CONTROL in

Frame 4542: Packet, 35 bytes on wire (280 bits), 35 bytes captured (280 bits) on interface \\.\USBPcap2, id 0
USB URB
    [Source: 2.10.0]
    [Destination: host]
    USBPcap pseudoheader length: 28
    IRP ID: 0xffffb50bca92d560
    IRP USBD_STATUS: USBD_STATUS_SUCCESS (0x00000000)
    URB Function: URB_FUNCTION_CONTROL_TRANSFER (0x0008)
    IRP information: 0x01, Direction: PDO -> FDO
    URB bus id: 2
    Device address: 10
    Endpoint: 0x80, Direction: IN
    URB transfer type: URB_CONTROL (0x02)
    Packet Data Length: 7
    [Request in: 4541]
    [Time from request: 77.000 microseconds]
    Control transfer stage: Complete (3)
    [bInterfaceClass: Unknown (0xffff)]
CONTROL response data: 00c20100000008

No.     Time           Source                Destination           Protocol Length Info
   4543 13.413629      host                  2.10.0                USB      36     URB_CONTROL in

Frame 4543: Packet, 36 bytes on wire (288 bits), 36 bytes captured (288 bits) on interface \\.\USBPcap2, id 0
USB URB
    [Source: host]
    [Destination: 2.10.0]
    USBPcap pseudoheader length: 28
    IRP ID: 0xffffb50bca92d560
    IRP USBD_STATUS: USBD_STATUS_SUCCESS (0x00000000)
    URB Function: URB_FUNCTION_CONTROL_TRANSFER (0x0008)
    IRP information: 0x00, Direction: FDO -> PDO
    URB bus id: 2
    Device address: 10
    Endpoint: 0x80, Direction: IN
    URB transfer type: URB_CONTROL (0x02)
    Packet Data Length: 8
    [Response in: 4544]
    Control transfer stage: Setup (0)
    [bInterfaceClass: Unknown (0xffff)]
Setup Data

No.     Time           Source                Destination           Protocol Length Info
   4544 13.413675      2.10.0                host                  USB      35     URB_CONTROL in

Frame 4544: Packet, 35 bytes on wire (280 bits), 35 bytes captured (280 bits) on interface \\.\USBPcap2, id 0
USB URB
    [Source: 2.10.0]
    [Destination: host]
    USBPcap pseudoheader length: 28
    IRP ID: 0xffffb50bca92d560
    IRP USBD_STATUS: USBD_STATUS_SUCCESS (0x00000000)
    URB Function: URB_FUNCTION_CONTROL_TRANSFER (0x0008)
    IRP information: 0x01, Direction: PDO -> FDO
    URB bus id: 2
    Device address: 10
    Endpoint: 0x80, Direction: IN
    URB transfer type: URB_CONTROL (0x02)
    Packet Data Length: 7
    [Request in: 4543]
    [Time from request: 46.000 microseconds]
    Control transfer stage: Complete (3)
    [bInterfaceClass: Unknown (0xffff)]
CONTROL response data: 00c20100000008

No.     Time           Source                Destination           Protocol Length Info
   4545 13.413686      host                  2.10.0                USB      43     URB_CONTROL out

Frame 4545: Packet, 43 bytes on wire (344 bits), 43 bytes captured (344 bits) on interface \\.\USBPcap2, id 0
USB URB
    [Source: host]
    [Destination: 2.10.0]
    USBPcap pseudoheader length: 28
    IRP ID: 0xffffb50bca92d560
    IRP USBD_STATUS: USBD_STATUS_SUCCESS (0x00000000)
    URB Function: URB_FUNCTION_CONTROL_TRANSFER (0x0008)
    IRP information: 0x00, Direction: FDO -> PDO
    URB bus id: 2
    Device address: 10
    Endpoint: 0x00, Direction: OUT
    URB transfer type: URB_CONTROL (0x02)
    Packet Data Length: 15
    [Response in: 4546]
    Control transfer stage: Setup (0)
    [bInterfaceClass: Unknown (0xffff)]
Setup Data

No.     Time           Source                Destination           Protocol Length Info
   4546 13.413803      2.10.0                host                  USB      28     URB_CONTROL out

Frame 4546: Packet, 28 bytes on wire (224 bits), 28 bytes captured (224 bits) on interface \\.\USBPcap2, id 0
USB URB
    [Source: 2.10.0]
    [Destination: host]
    USBPcap pseudoheader length: 28
    IRP ID: 0xffffb50bca92d560
    IRP USBD_STATUS: USBD_STATUS_SUCCESS (0x00000000)
    URB Function: URB_FUNCTION_CONTROL_TRANSFER (0x0008)
    IRP information: 0x01, Direction: PDO -> FDO
    URB bus id: 2
    Device address: 10
    Endpoint: 0x00, Direction: OUT
    URB transfer type: URB_CONTROL (0x02)
    Packet Data Length: 0
    [Request in: 4545]
    [Time from request: 117.000 microseconds]
    Control transfer stage: Complete (3)
    [bInterfaceClass: Unknown (0xffff)]

No.     Time           Source                Destination           Protocol Length Info
   4547 13.413808      host                  2.10.0                USB      36     URB_CONTROL in

Frame 4547: Packet, 36 bytes on wire (288 bits), 36 bytes captured (288 bits) on interface \\.\USBPcap2, id 0
USB URB
    [Source: host]
    [Destination: 2.10.0]
    USBPcap pseudoheader length: 28
    IRP ID: 0xffffb50bca92d560
    IRP USBD_STATUS: USBD_STATUS_SUCCESS (0x00000000)
    URB Function: URB_FUNCTION_CONTROL_TRANSFER (0x0008)
    IRP information: 0x00, Direction: FDO -> PDO
    URB bus id: 2
    Device address: 10
    Endpoint: 0x80, Direction: IN
    URB transfer type: URB_CONTROL (0x02)
    Packet Data Length: 8
    [Response in: 4548]
    Control transfer stage: Setup (0)
    [bInterfaceClass: Unknown (0xffff)]
Setup Data

No.     Time           Source                Destination           Protocol Length Info
   4548 13.413849      2.10.0                host                  USB      35     URB_CONTROL in

Frame 4548: Packet, 35 bytes on wire (280 bits), 35 bytes captured (280 bits) on interface \\.\USBPcap2, id 0
USB URB
    [Source: 2.10.0]
    [Destination: host]
    USBPcap pseudoheader length: 28
    IRP ID: 0xffffb50bca92d560
    IRP USBD_STATUS: USBD_STATUS_SUCCESS (0x00000000)
    URB Function: URB_FUNCTION_CONTROL_TRANSFER (0x0008)
    IRP information: 0x01, Direction: PDO -> FDO
    URB bus id: 2
    Device address: 10
    Endpoint: 0x80, Direction: IN
    URB transfer type: URB_CONTROL (0x02)
    Packet Data Length: 7
    [Request in: 4547]
    [Time from request: 41.000 microseconds]
    Control transfer stage: Complete (3)
    [bInterfaceClass: Unknown (0xffff)]
CONTROL response data: 00c20100000008

No.     Time           Source                Destination           Protocol Length Info
   4549 13.413859      host                  2.10.0                USB      36     URB_CONTROL out

Frame 4549: Packet, 36 bytes on wire (288 bits), 36 bytes captured (288 bits) on interface \\.\USBPcap2, id 0
USB URB
    [Source: host]
    [Destination: 2.10.0]
    USBPcap pseudoheader length: 28
    IRP ID: 0xffffb50bca92d560
    IRP USBD_STATUS: USBD_STATUS_SUCCESS (0x00000000)
    URB Function: URB_FUNCTION_CONTROL_TRANSFER (0x0008)
    IRP information: 0x00, Direction: FDO -> PDO
    URB bus id: 2
    Device address: 10
    Endpoint: 0x00, Direction: OUT
    URB transfer type: URB_CONTROL (0x02)
    Packet Data Length: 8
    [Response in: 4550]
    Control transfer stage: Setup (0)
    [bInterfaceClass: Unknown (0xffff)]
Setup Data

No.     Time           Source                Destination           Protocol Length Info
   4550 13.413905      2.10.0                host                  USB      28     URB_CONTROL out

Frame 4550: Packet, 28 bytes on wire (224 bits), 28 bytes captured (224 bits) on interface \\.\USBPcap2, id 0
USB URB
    [Source: 2.10.0]
    [Destination: host]
    USBPcap pseudoheader length: 28
    IRP ID: 0xffffb50bca92d560
    IRP USBD_STATUS: USBD_STATUS_SUCCESS (0x00000000)
    URB Function: URB_FUNCTION_CONTROL_TRANSFER (0x0008)
    IRP information: 0x01, Direction: PDO -> FDO
    URB bus id: 2
    Device address: 10
    Endpoint: 0x00, Direction: OUT
    URB transfer type: URB_CONTROL (0x02)
    Packet Data Length: 0
    [Request in: 4549]
    [Time from request: 46.000 microseconds]
    Control transfer stage: Complete (3)
    [bInterfaceClass: Unknown (0xffff)]

No.     Time           Source                Destination           Protocol Length Info
   4551 13.413911      host                  2.10.0                USB      43     URB_CONTROL out

Frame 4551: Packet, 43 bytes on wire (344 bits), 43 bytes captured (344 bits) on interface \\.\USBPcap2, id 0
USB URB
    [Source: host]
    [Destination: 2.10.0]
    USBPcap pseudoheader length: 28
    IRP ID: 0xffffb50bca92d560
    IRP USBD_STATUS: USBD_STATUS_SUCCESS (0x00000000)
    URB Function: URB_FUNCTION_CONTROL_TRANSFER (0x0008)
    IRP information: 0x00, Direction: FDO -> PDO
    URB bus id: 2
    Device address: 10
    Endpoint: 0x00, Direction: OUT
    URB transfer type: URB_CONTROL (0x02)
    Packet Data Length: 15
    [Response in: 4552]
    Control transfer stage: Setup (0)
    [bInterfaceClass: Unknown (0xffff)]
Setup Data

No.     Time           Source                Destination           Protocol Length Info
   4552 13.414016      2.10.0                host                  USB      28     URB_CONTROL out

Frame 4552: Packet, 28 bytes on wire (224 bits), 28 bytes captured (224 bits) on interface \\.\USBPcap2, id 0
USB URB
    [Source: 2.10.0]
    [Destination: host]
    USBPcap pseudoheader length: 28
    IRP ID: 0xffffb50bca92d560
    IRP USBD_STATUS: USBD_STATUS_SUCCESS (0x00000000)
    URB Function: URB_FUNCTION_CONTROL_TRANSFER (0x0008)
    IRP information: 0x01, Direction: PDO -> FDO
    URB bus id: 2
    Device address: 10
    Endpoint: 0x00, Direction: OUT
    URB transfer type: URB_CONTROL (0x02)
    Packet Data Length: 0
    [Request in: 4551]
    [Time from request: 105.000 microseconds]
    Control transfer stage: Complete (3)
    [bInterfaceClass: Unknown (0xffff)]

No.     Time           Source                Destination           Protocol Length Info
   4553 13.414026      host                  2.10.0                USB      36     URB_CONTROL in

Frame 4553: Packet, 36 bytes on wire (288 bits), 36 bytes captured (288 bits) on interface \\.\USBPcap2, id 0
USB URB
    [Source: host]
    [Destination: 2.10.0]
    USBPcap pseudoheader length: 28
    IRP ID: 0xffffb50bca92d560
    IRP USBD_STATUS: USBD_STATUS_SUCCESS (0x00000000)
    URB Function: URB_FUNCTION_CONTROL_TRANSFER (0x0008)
    IRP information: 0x00, Direction: FDO -> PDO
    URB bus id: 2
    Device address: 10
    Endpoint: 0x80, Direction: IN
    URB transfer type: URB_CONTROL (0x02)
    Packet Data Length: 8
    [Response in: 4554]
    Control transfer stage: Setup (0)
    [bInterfaceClass: Unknown (0xffff)]
Setup Data

No.     Time           Source                Destination           Protocol Length Info
   4554 13.414067      2.10.0                host                  USB      35     URB_CONTROL in

Frame 4554: Packet, 35 bytes on wire (280 bits), 35 bytes captured (280 bits) on interface \\.\USBPcap2, id 0
USB URB
    [Source: 2.10.0]
    [Destination: host]
    USBPcap pseudoheader length: 28
    IRP ID: 0xffffb50bca92d560
    IRP USBD_STATUS: USBD_STATUS_SUCCESS (0x00000000)
    URB Function: URB_FUNCTION_CONTROL_TRANSFER (0x0008)
    IRP information: 0x01, Direction: PDO -> FDO
    URB bus id: 2
    Device address: 10
    Endpoint: 0x80, Direction: IN
    URB transfer type: URB_CONTROL (0x02)
    Packet Data Length: 7
    [Request in: 4553]
    [Time from request: 41.000 microseconds]
    Control transfer stage: Complete (3)
    [bInterfaceClass: Unknown (0xffff)]
CONTROL response data: 00c20100000008

No.     Time           Source                Destination           Protocol Length Info
   4555 13.414080      host                  2.10.0                USB      36     URB_CONTROL out

Frame 4555: Packet, 36 bytes on wire (288 bits), 36 bytes captured (288 bits) on interface \\.\USBPcap2, id 0
USB URB
    [Source: host]
    [Destination: 2.10.0]
    USBPcap pseudoheader length: 28
    IRP ID: 0xffffb50bca92d560
    IRP USBD_STATUS: USBD_STATUS_SUCCESS (0x00000000)
    URB Function: URB_FUNCTION_CONTROL_TRANSFER (0x0008)
    IRP information: 0x00, Direction: FDO -> PDO
    URB bus id: 2
    Device address: 10
    Endpoint: 0x00, Direction: OUT
    URB transfer type: URB_CONTROL (0x02)
    Packet Data Length: 8
    [Response in: 4556]
    Control transfer stage: Setup (0)
    [bInterfaceClass: Unknown (0xffff)]
Setup Data

No.     Time           Source                Destination           Protocol Length Info
   4556 13.414129      2.10.0                host                  USB      28     URB_CONTROL out

Frame 4556: Packet, 28 bytes on wire (224 bits), 28 bytes captured (224 bits) on interface \\.\USBPcap2, id 0
USB URB
    [Source: 2.10.0]
    [Destination: host]
    USBPcap pseudoheader length: 28
    IRP ID: 0xffffb50bca92d560
    IRP USBD_STATUS: USBD_STATUS_SUCCESS (0x00000000)
    URB Function: URB_FUNCTION_CONTROL_TRANSFER (0x0008)
    IRP information: 0x01, Direction: PDO -> FDO
    URB bus id: 2
    Device address: 10
    Endpoint: 0x00, Direction: OUT
    URB transfer type: URB_CONTROL (0x02)
    Packet Data Length: 0
    [Request in: 4555]
    [Time from request: 49.000 microseconds]
    Control transfer stage: Complete (3)
    [bInterfaceClass: Unknown (0xffff)]

No.     Time           Source                Destination           Protocol Length Info
   4557 13.414136      host                  2.10.0                USB      36     URB_CONTROL in

Frame 4557: Packet, 36 bytes on wire (288 bits), 36 bytes captured (288 bits) on interface \\.\USBPcap2, id 0
USB URB
    [Source: host]
    [Destination: 2.10.0]
    USBPcap pseudoheader length: 28
    IRP ID: 0xffffb50bca92d560
    IRP USBD_STATUS: USBD_STATUS_SUCCESS (0x00000000)
    URB Function: URB_FUNCTION_CONTROL_TRANSFER (0x0008)
    IRP information: 0x00, Direction: FDO -> PDO
    URB bus id: 2
    Device address: 10
    Endpoint: 0x80, Direction: IN
    URB transfer type: URB_CONTROL (0x02)
    Packet Data Length: 8
    [Response in: 4558]
    Control transfer stage: Setup (0)
    [bInterfaceClass: Unknown (0xffff)]
Setup Data

No.     Time           Source                Destination           Protocol Length Info
   4558 13.414176      2.10.0                host                  USB      35     URB_CONTROL in

Frame 4558: Packet, 35 bytes on wire (280 bits), 35 bytes captured (280 bits) on interface \\.\USBPcap2, id 0
USB URB
    [Source: 2.10.0]
    [Destination: host]
    USBPcap pseudoheader length: 28
    IRP ID: 0xffffb50bca92d560
    IRP USBD_STATUS: USBD_STATUS_SUCCESS (0x00000000)
    URB Function: URB_FUNCTION_CONTROL_TRANSFER (0x0008)
    IRP information: 0x01, Direction: PDO -> FDO
    URB bus id: 2
    Device address: 10
    Endpoint: 0x80, Direction: IN
    URB transfer type: URB_CONTROL (0x02)
    Packet Data Length: 7
    [Request in: 4557]
    [Time from request: 40.000 microseconds]
    Control transfer stage: Complete (3)
    [bInterfaceClass: Unknown (0xffff)]
CONTROL response data: 00c20100000008

No.     Time           Source                Destination           Protocol Length Info
   4559 13.414179      host                  2.10.0                USB      36     URB_CONTROL in

Frame 4559: Packet, 36 bytes on wire (288 bits), 36 bytes captured (288 bits) on interface \\.\USBPcap2, id 0
USB URB
    [Source: host]
    [Destination: 2.10.0]
    USBPcap pseudoheader length: 28
    IRP ID: 0xffffb50bca92d560
    IRP USBD_STATUS: USBD_STATUS_SUCCESS (0x00000000)
    URB Function: URB_FUNCTION_CONTROL_TRANSFER (0x0008)
    IRP information: 0x00, Direction: FDO -> PDO
    URB bus id: 2
    Device address: 10
    Endpoint: 0x80, Direction: IN
    URB transfer type: URB_CONTROL (0x02)
    Packet Data Length: 8
    [Response in: 4560]
    Control transfer stage: Setup (0)
    [bInterfaceClass: Unknown (0xffff)]
Setup Data

No.     Time           Source                Destination           Protocol Length Info
   4560 13.414225      2.10.0                host                  USB      35     URB_CONTROL in

Frame 4560: Packet, 35 bytes on wire (280 bits), 35 bytes captured (280 bits) on interface \\.\USBPcap2, id 0
USB URB
    [Source: 2.10.0]
    [Destination: host]
    USBPcap pseudoheader length: 28
    IRP ID: 0xffffb50bca92d560
    IRP USBD_STATUS: USBD_STATUS_SUCCESS (0x00000000)
    URB Function: URB_FUNCTION_CONTROL_TRANSFER (0x0008)
    IRP information: 0x01, Direction: PDO -> FDO
    URB bus id: 2
    Device address: 10
    Endpoint: 0x80, Direction: IN
    URB transfer type: URB_CONTROL (0x02)
    Packet Data Length: 7
    [Request in: 4559]
    [Time from request: 46.000 microseconds]
    Control transfer stage: Complete (3)
    [bInterfaceClass: Unknown (0xffff)]
CONTROL response data: 00c20100000008

No.     Time           Source                Destination           Protocol Length Info
   4561 13.414631      host                  2.10.1                USB      277    URB_BULK out

Frame 4561: Packet, 277 bytes on wire (2216 bits), 277 bytes captured (2216 bits) on interface \\.\USBPcap2, id 0
USB URB
    [Source: host]
    [Destination: 2.10.1]
    USBPcap pseudoheader length: 27
    IRP ID: 0xffffb50bc6c08010
    IRP USBD_STATUS: USBD_STATUS_SUCCESS (0x00000000)
    URB Function: URB_FUNCTION_BULK_OR_INTERRUPT_TRANSFER (0x0009)
    IRP information: 0x00, Direction: FDO -> PDO
    URB bus id: 2
    Device address: 10
    Endpoint: 0x01, Direction: OUT
    URB transfer type: URB_BULK (0x03)
    Packet Data Length: 250
    [Response in: 4562]
    [bInterfaceClass: Unknown (0xffff)]
Leftover Capture Data […]: 01ef6900000001000000c5d3000000000000000000000000000000000000000000000000000000000000000000000000000000000000000000000000000000000000000000000000000000000000000000000000000000000000000000000000000000000000000000

No.     Time           Source                Destination           Protocol Length Info
   4562 13.414685      2.10.1                host                  USB      27     URB_BULK out

Frame 4562: Packet, 27 bytes on wire (216 bits), 27 bytes captured (216 bits) on interface \\.\USBPcap2, id 0
USB URB
    [Source: 2.10.1]
    [Destination: host]
    USBPcap pseudoheader length: 27
    IRP ID: 0xffffb50bc6c08010
    IRP USBD_STATUS: USBD_STATUS_SUCCESS (0x00000000)
    URB Function: URB_FUNCTION_BULK_OR_INTERRUPT_TRANSFER (0x0009)
    IRP information: 0x01, Direction: PDO -> FDO
    URB bus id: 2
    Device address: 10
    Endpoint: 0x01, Direction: OUT
    URB transfer type: URB_BULK (0x03)
    Packet Data Length: 0
    [Request in: 4561]
    [Time from request: 54.000 microseconds]
    [bInterfaceClass: Unknown (0xffff)]

No.     Time           Source                Destination           Protocol Length Info
   4573 13.446164      host                  2.10.1                USB      277    URB_BULK out

Frame 4573: Packet, 277 bytes on wire (2216 bits), 277 bytes captured (2216 bits) on interface \\.\USBPcap2, id 0
USB URB
    [Source: host]
    [Destination: 2.10.1]
    USBPcap pseudoheader length: 27
    IRP ID: 0xffffb50bc6bdc010
    IRP USBD_STATUS: USBD_STATUS_SUCCESS (0x00000000)
    URB Function: URB_FUNCTION_BULK_OR_INTERRUPT_TRANSFER (0x0009)
    IRP information: 0x00, Direction: FDO -> PDO
    URB bus id: 2
    Device address: 10
    Endpoint: 0x01, Direction: OUT
    URB transfer type: URB_BULK (0x03)
    Packet Data Length: 250
    [Response in: 4574]
    [bInterfaceClass: Unknown (0xffff)]
Leftover Capture Data […]: 6eef690000001a0000002f6d6e742f5344434152442f766964656f2f415331352e6d7034000000000000000000000000000000000000000000000000000000000000000000000000000000000000000000000000000000000000000000000000000000000000000000

No.     Time           Source                Destination           Protocol Length Info
   4574 13.446235      2.10.1                host                  USB      27     URB_BULK out

Frame 4574: Packet, 27 bytes on wire (216 bits), 27 bytes captured (216 bits) on interface \\.\USBPcap2, id 0
USB URB
    [Source: 2.10.1]
    [Destination: host]
    USBPcap pseudoheader length: 27
    IRP ID: 0xffffb50bc6bdc010
    IRP USBD_STATUS: USBD_STATUS_SUCCESS (0x00000000)
    URB Function: URB_FUNCTION_BULK_OR_INTERRUPT_TRANSFER (0x0009)
    IRP information: 0x01, Direction: PDO -> FDO
    URB bus id: 2
    Device address: 10
    Endpoint: 0x01, Direction: OUT
    URB transfer type: URB_BULK (0x03)
    Packet Data Length: 0
    [Request in: 4573]
    [Time from request: 71.000 microseconds]
    [bInterfaceClass: Unknown (0xffff)]

No.     Time           Source                Destination           Protocol Length Info
   4581 13.458972      host                  2.10.1                USB      277    URB_BULK out

Frame 4581: Packet, 277 bytes on wire (2216 bits), 277 bytes captured (2216 bits) on interface \\.\USBPcap2, id 0
USB URB
    [Source: host]
    [Destination: 2.10.1]
    USBPcap pseudoheader length: 27
    IRP ID: 0xffffb50bc6bdc010
    IRP USBD_STATUS: USBD_STATUS_SUCCESS (0x00000000)
    URB Function: URB_FUNCTION_BULK_OR_INTERRUPT_TRANSFER (0x0009)
    IRP information: 0x00, Direction: FDO -> PDO
    URB bus id: 2
    Device address: 10
    Endpoint: 0x01, Direction: OUT
    URB transfer type: URB_BULK (0x03)
    Packet Data Length: 250
    [Response in: 4582]
    [bInterfaceClass: Unknown (0xffff)]
Leftover Capture Data […]: 78ef690000001a0100002f6d6e742f5344434152442f766964656f2f415331352e6d7034000000000000000000000000000000000000000000000000000000000000000000000000000000000000000000000000000000000000000000000000000000000000000000

No.     Time           Source                Destination           Protocol Length Info
   4582 13.459023      2.10.1                host                  USB      27     URB_BULK out

Frame 4582: Packet, 27 bytes on wire (216 bits), 27 bytes captured (216 bits) on interface \\.\USBPcap2, id 0
USB URB
    [Source: 2.10.1]
    [Destination: host]
    USBPcap pseudoheader length: 27
    IRP ID: 0xffffb50bc6bdc010
    IRP USBD_STATUS: USBD_STATUS_SUCCESS (0x00000000)
    URB Function: URB_FUNCTION_BULK_OR_INTERRUPT_TRANSFER (0x0009)
    IRP information: 0x01, Direction: PDO -> FDO
    URB bus id: 2
    Device address: 10
    Endpoint: 0x01, Direction: OUT
    URB transfer type: URB_BULK (0x03)
    Packet Data Length: 0
    [Request in: 4581]
    [Time from request: 51.000 microseconds]
    [bInterfaceClass: Unknown (0xffff)]

No.     Time           Source                Destination           Protocol Length Info
   4609 13.520947      host                  2.10.1                USB      277    URB_BULK out

Frame 4609: Packet, 277 bytes on wire (2216 bits), 277 bytes captured (2216 bits) on interface \\.\USBPcap2, id 0
USB URB
    [Source: host]
    [Destination: 2.10.1]
    USBPcap pseudoheader length: 27
    IRP ID: 0xffffb50bc6c08010
    IRP USBD_STATUS: USBD_STATUS_SUCCESS (0x00000000)
    URB Function: URB_FUNCTION_BULK_OR_INTERRUPT_TRANSFER (0x0009)
    IRP information: 0x00, Direction: FDO -> PDO
    URB bus id: 2
    Device address: 10
    Endpoint: 0x01, Direction: OUT
    URB transfer type: URB_BULK (0x03)
    Packet Data Length: 250
    [Response in: 4610]
    [bInterfaceClass: Unknown (0xffff)]
Leftover Capture Data […]: 86ef69000000010000000000000000000000000000000000000000000000000000000000000000000000000000000000000000000000000000000000000000000000000000000000000000000000000000000000000000000000000000000000000000000000000000

No.     Time           Source                Destination           Protocol Length Info
   4610 13.521018      2.10.1                host                  USB      27     URB_BULK out

Frame 4610: Packet, 27 bytes on wire (216 bits), 27 bytes captured (216 bits) on interface \\.\USBPcap2, id 0
USB URB
    [Source: 2.10.1]
    [Destination: host]
    USBPcap pseudoheader length: 27
    IRP ID: 0xffffb50bc6c08010
    IRP USBD_STATUS: USBD_STATUS_SUCCESS (0x00000000)
    URB Function: URB_FUNCTION_BULK_OR_INTERRUPT_TRANSFER (0x0009)
    IRP information: 0x01, Direction: PDO -> FDO
    URB bus id: 2
    Device address: 10
    Endpoint: 0x01, Direction: OUT
    URB transfer type: URB_BULK (0x03)
    Packet Data Length: 0
    [Request in: 4609]
    [Time from request: 71.000 microseconds]
    [bInterfaceClass: Unknown (0xffff)]

No.     Time           Source                Destination           Protocol Length Info
   4647 13.630308      host                  2.10.1                USB      277    URB_BULK out

Frame 4647: Packet, 277 bytes on wire (2216 bits), 277 bytes captured (2216 bits) on interface \\.\USBPcap2, id 0
USB URB
    [Source: host]
    [Destination: 2.10.1]
    USBPcap pseudoheader length: 27
    IRP ID: 0xffffb50bc6c08010
    IRP USBD_STATUS: USBD_STATUS_SUCCESS (0x00000000)
    URB Function: URB_FUNCTION_BULK_OR_INTERRUPT_TRANSFER (0x0009)
    IRP information: 0x00, Direction: FDO -> PDO
    URB bus id: 2
    Device address: 10
    Endpoint: 0x01, Direction: OUT
    URB transfer type: URB_BULK (0x03)
    Packet Data Length: 250
    [Response in: 4648]
    [bInterfaceClass: Unknown (0xffff)]
Leftover Capture Data […]: 2c2c2c2c2c2c2c2c2c2c2c2c2c2c2c2c2c2c2c2c2c2c2c2c2c2c2c2c2c2c2c2c2c2c2c2c2c2c2c2c2c2c2c2c2c2c2c2c2c2c2c2c2c2c2c2c2c2c2c2c2c2c2c2c2c2c2c2c2c2c2c2c2c2c2c2c2c2c2c2c2c2c2c2c2c2c2c2c2c2c2c2c2c2c2c2c2c2c2c2c2c2c2c2c2c

No.     Time           Source                Destination           Protocol Length Info
   4648 13.630358      2.10.1                host                  USB      27     URB_BULK out

Frame 4648: Packet, 27 bytes on wire (216 bits), 27 bytes captured (216 bits) on interface \\.\USBPcap2, id 0
USB URB
    [Source: 2.10.1]
    [Destination: host]
    USBPcap pseudoheader length: 27
    IRP ID: 0xffffb50bc6c08010
    IRP USBD_STATUS: USBD_STATUS_SUCCESS (0x00000000)
    URB Function: URB_FUNCTION_BULK_OR_INTERRUPT_TRANSFER (0x0009)
    IRP information: 0x01, Direction: PDO -> FDO
    URB bus id: 2
    Device address: 10
    Endpoint: 0x01, Direction: OUT
    URB transfer type: URB_BULK (0x03)
    Packet Data Length: 0
    [Request in: 4647]
    [Time from request: 50.000 microseconds]
    [bInterfaceClass: Unknown (0xffff)]

No.     Time           Source                Destination           Protocol Length Info
   4653 13.640958      host                  2.10.1                USB      277    URB_BULK out

Frame 4653: Packet, 277 bytes on wire (2216 bits), 277 bytes captured (2216 bits) on interface \\.\USBPcap2, id 0
USB URB
    [Source: host]
    [Destination: 2.10.1]
    USBPcap pseudoheader length: 27
    IRP ID: 0xffffb50bc6c0a010
    IRP USBD_STATUS: USBD_STATUS_SUCCESS (0x00000000)
    URB Function: URB_FUNCTION_BULK_OR_INTERRUPT_TRANSFER (0x0009)
    IRP information: 0x00, Direction: FDO -> PDO
    URB bus id: 2
    Device address: 10
    Endpoint: 0x01, Direction: OUT
    URB transfer type: URB_BULK (0x03)
    Packet Data Length: 250
    [Response in: 4654]
    [bInterfaceClass: Unknown (0xffff)]
Leftover Capture Data […]: 7bef69000000010000008000000000000000000000000000000000000000000000000000000000000000000000000000000000000000000000000000000000000000000000000000000000000000000000000000000000000000000000000000000000000000000000

No.     Time           Source                Destination           Protocol Length Info
   4654 13.641025      2.10.1                host                  USB      27     URB_BULK out

Frame 4654: Packet, 27 bytes on wire (216 bits), 27 bytes captured (216 bits) on interface \\.\USBPcap2, id 0
USB URB
    [Source: 2.10.1]
    [Destination: host]
    USBPcap pseudoheader length: 27
    IRP ID: 0xffffb50bc6c0a010
    IRP USBD_STATUS: USBD_STATUS_SUCCESS (0x00000000)
    URB Function: URB_FUNCTION_BULK_OR_INTERRUPT_TRANSFER (0x0009)
    IRP information: 0x01, Direction: PDO -> FDO
    URB bus id: 2
    Device address: 10
    Endpoint: 0x01, Direction: OUT
    URB transfer type: URB_BULK (0x03)
    Packet Data Length: 0
    [Request in: 4653]
    [Time from request: 67.000 microseconds]
    [bInterfaceClass: Unknown (0xffff)]

No.     Time           Source                Destination           Protocol Length Info
   4691 13.748958      host                  2.10.1                USB      4527   URB_BULK out

Frame 4691: Packet, 4527 bytes on wire (36216 bits), 4527 bytes captured (36216 bits) on interface \\.\USBPcap2, id 0
USB URB
    [Source: host]
    [Destination: 2.10.1]
    USBPcap pseudoheader length: 27
    IRP ID: 0xffffb50bc6c0a010
    IRP USBD_STATUS: USBD_STATUS_SUCCESS (0x00000000)
    URB Function: URB_FUNCTION_BULK_OR_INTERRUPT_TRANSFER (0x0009)
    IRP information: 0x00, Direction: FDO -> PDO
    URB bus id: 2
    Device address: 10
    Endpoint: 0x01, Direction: OUT
    URB transfer type: URB_BULK (0x03)
    Packet Data Length: 4500
    [Response in: 4692]
    [bInterfaceClass: Unknown (0xffff)]
Leftover Capture Data […]: caef69000e10000000000000000000000000000000000000000000000000000000000000000000000000000000000000000000000000000000000000000000000000000000000000000000000000000000000000000000000000000000000000000000000000000000

No.     Time           Source                Destination           Protocol Length Info
   4692 13.749458      2.10.1                host                  USB      27     URB_BULK out

Frame 4692: Packet, 27 bytes on wire (216 bits), 27 bytes captured (216 bits) on interface \\.\USBPcap2, id 0
USB URB
    [Source: 2.10.1]
    [Destination: host]
    USBPcap pseudoheader length: 27
    IRP ID: 0xffffb50bc6c0a010
    IRP USBD_STATUS: USBD_STATUS_SUCCESS (0x00000000)
    URB Function: URB_FUNCTION_BULK_OR_INTERRUPT_TRANSFER (0x0009)
    IRP information: 0x01, Direction: PDO -> FDO
    URB bus id: 2
    Device address: 10
    Endpoint: 0x01, Direction: OUT
    URB transfer type: URB_BULK (0x03)
    Packet Data Length: 0
    [Request in: 4691]
    [Time from request: 500.000 microseconds]
    [bInterfaceClass: Unknown (0xffff)]

No.     Time           Source                Destination           Protocol Length Info
   4693 13.749502      host                  2.10.1                USB      125099 URB_BULK out

Frame 4693: Packet, 125099 bytes on wire (1000792 bits), 65535 bytes captured (524280 bits) on interface \\.\USBPcap2, id 0
USB URB
    [Source: host]
    [Destination: 2.10.1]
    USBPcap pseudoheader length: 27
    IRP ID: 0xffffb50bc6c0a010
    IRP USBD_STATUS: USBD_STATUS_SUCCESS (0x00000000)
    URB Function: URB_FUNCTION_BULK_OR_INTERRUPT_TRANSFER (0x0009)
    IRP information: 0x00, Direction: FDO -> PDO
    URB bus id: 2
    Device address: 10
    Endpoint: 0x01, Direction: OUT
    URB transfer type: URB_BULK (0x03)
    Packet Data Length: 125072
    [Response in: 4718]
    [bInterfaceClass: Unknown (0xffff)]
Leftover Capture Data […]: 000000000000000000000000000000000000000000000000000000000000000000000000000000000000000000000000000000000000000000000000000000000000000000000000000000000000000000000000000000000000000000000000000000000000000000

No.     Time           Source                Destination           Protocol Length Info
   4718 13.831090      2.10.1                host                  USB      27     URB_BULK out

Frame 4718: Packet, 27 bytes on wire (216 bits), 27 bytes captured (216 bits) on interface \\.\USBPcap2, id 0
USB URB
    [Source: 2.10.1]
    [Destination: host]
    USBPcap pseudoheader length: 27
    IRP ID: 0xffffb50bc6c0a010
    IRP USBD_STATUS: USBD_STATUS_SUCCESS (0x00000000)
    URB Function: URB_FUNCTION_BULK_OR_INTERRUPT_TRANSFER (0x0009)
    IRP information: 0x01, Direction: PDO -> FDO
    URB bus id: 2
    Device address: 10
    Endpoint: 0x01, Direction: OUT
    URB transfer type: URB_BULK (0x03)
    Packet Data Length: 0
    [Request in: 4693]
    [Time from request: 81.588000 milliseconds]
    [bInterfaceClass: Unknown (0xffff)]

No.     Time           Source                Destination           Protocol Length Info
   4719 13.831139      host                  2.10.1                USB      5955   URB_BULK out

Frame 4719: Packet, 5955 bytes on wire (47640 bits), 5955 bytes captured (47640 bits) on interface \\.\USBPcap2, id 0
USB URB
    [Source: host]
    [Destination: 2.10.1]
    USBPcap pseudoheader length: 27
    IRP ID: 0xffffb50bc6c0a010
    IRP USBD_STATUS: USBD_STATUS_SUCCESS (0x00000000)
    URB Function: URB_FUNCTION_BULK_OR_INTERRUPT_TRANSFER (0x0009)
    IRP information: 0x00, Direction: FDO -> PDO
    URB bus id: 2
    Device address: 10
    Endpoint: 0x01, Direction: OUT
    URB transfer type: URB_BULK (0x03)
    Packet Data Length: 5928
    [Response in: 4724]
    [bInterfaceClass: Unknown (0xffff)]
Leftover Capture Data […]: 000000000000000000000000000000000000000000000000000000000000000000000000000000000000000000000000000000000000000000000000000000000000000000000000000000000000000000000000000000000000000000000000000000000000000000

No.     Time           Source                Destination           Protocol Length Info
   4724 13.835363      2.10.1                host                  USB      27     URB_BULK out

Frame 4724: Packet, 27 bytes on wire (216 bits), 27 bytes captured (216 bits) on interface \\.\USBPcap2, id 0
USB URB
    [Source: 2.10.1]
    [Destination: host]
    USBPcap pseudoheader length: 27
    IRP ID: 0xffffb50bc6c0a010
    IRP USBD_STATUS: USBD_STATUS_SUCCESS (0x00000000)
    URB Function: URB_FUNCTION_BULK_OR_INTERRUPT_TRANSFER (0x0009)
    IRP information: 0x01, Direction: PDO -> FDO
    URB bus id: 2
    Device address: 10
    Endpoint: 0x01, Direction: OUT
    URB transfer type: URB_BULK (0x03)
    Packet Data Length: 0
    [Request in: 4719]
    [Time from request: 4.224000 milliseconds]
    [bInterfaceClass: Unknown (0xffff)]

No.     Time           Source                Destination           Protocol Length Info
   4725 13.835407      host                  2.10.1                USB      125027 URB_BULK out

Frame 4725: Packet, 125027 bytes on wire (1000216 bits), 65535 bytes captured (524280 bits) on interface \\.\USBPcap2, id 0
USB URB
    [Source: host]
    [Destination: 2.10.1]
    USBPcap pseudoheader length: 27
    IRP ID: 0xffffb50bc6c0a010
    IRP USBD_STATUS: USBD_STATUS_SUCCESS (0x00000000)
    URB Function: URB_FUNCTION_BULK_OR_INTERRUPT_TRANSFER (0x0009)
    IRP information: 0x00, Direction: FDO -> PDO
    URB bus id: 2
    Device address: 10
    Endpoint: 0x01, Direction: OUT
    URB transfer type: URB_BULK (0x03)
    Packet Data Length: 125000
    [Response in: 4754]
    [bInterfaceClass: Unknown (0xffff)]
Leftover Capture Data […]: 000000000000000000000000000000000000000000000000000000000000000000000000000000000000000000000000000000000000000000000000000000000000000000000000000000000000000000000000000000000000000000000000000000000000000000

No.     Time           Source                Destination           Protocol Length Info
   4754 13.921192      2.10.1                host                  USB      27     URB_BULK out

Frame 4754: Packet, 27 bytes on wire (216 bits), 27 bytes captured (216 bits) on interface \\.\USBPcap2, id 0
USB URB
    [Source: 2.10.1]
    [Destination: host]
    USBPcap pseudoheader length: 27
    IRP ID: 0xffffb50bc6c0a010
    IRP USBD_STATUS: USBD_STATUS_SUCCESS (0x00000000)
    URB Function: URB_FUNCTION_BULK_OR_INTERRUPT_TRANSFER (0x0009)
    IRP information: 0x01, Direction: PDO -> FDO
    URB bus id: 2
    Device address: 10
    Endpoint: 0x01, Direction: OUT
    URB transfer type: URB_BULK (0x03)
    Packet Data Length: 0
    [Request in: 4725]
    [Time from request: 85.785000 milliseconds]
    [bInterfaceClass: Unknown (0xffff)]

No.     Time           Source                Destination           Protocol Length Info
   4755 13.921238      host                  2.10.1                USB      171    URB_BULK out

Frame 4755: Packet, 171 bytes on wire (1368 bits), 171 bytes captured (1368 bits) on interface \\.\USBPcap2, id 0
USB URB
    [Source: host]
    [Destination: 2.10.1]
    USBPcap pseudoheader length: 27
    IRP ID: 0xffffb50bc6c0a010
    IRP USBD_STATUS: USBD_STATUS_SUCCESS (0x00000000)
    URB Function: URB_FUNCTION_BULK_OR_INTERRUPT_TRANSFER (0x0009)
    IRP information: 0x00, Direction: FDO -> PDO
    URB bus id: 2
    Device address: 10
    Endpoint: 0x01, Direction: OUT
    URB transfer type: URB_BULK (0x03)
    Packet Data Length: 144
    [Response in: 4756]
    [bInterfaceClass: Unknown (0xffff)]
Leftover Capture Data […]: 000000000000000000000000000000000000000000000000000000000000000000000000000000000000000000000000000000000000000000000000000000000000000000000000000000000000000000000000000000000000000000000000000000000000000000

No.     Time           Source                Destination           Protocol Length Info
   4756 13.921284      2.10.1                host                  USB      27     URB_BULK out

Frame 4756: Packet, 27 bytes on wire (216 bits), 27 bytes captured (216 bits) on interface \\.\USBPcap2, id 0
USB URB
    [Source: 2.10.1]
    [Destination: host]
    USBPcap pseudoheader length: 27
    IRP ID: 0xffffb50bc6c0a010
    IRP USBD_STATUS: USBD_STATUS_SUCCESS (0x00000000)
    URB Function: URB_FUNCTION_BULK_OR_INTERRUPT_TRANSFER (0x0009)
    IRP information: 0x01, Direction: PDO -> FDO
    URB bus id: 2
    Device address: 10
    Endpoint: 0x01, Direction: OUT
    URB transfer type: URB_BULK (0x03)
    Packet Data Length: 0
    [Request in: 4755]
    [Time from request: 46.000 microseconds]
    [bInterfaceClass: Unknown (0xffff)]

No.     Time           Source                Destination           Protocol Length Info
   4757 13.921329      host                  2.10.1                USB      35133  URB_BULK out

Frame 4757: Packet, 35133 bytes on wire (281064 bits), 35133 bytes captured (281064 bits) on interface \\.\USBPcap2, id 0
USB URB
    [Source: host]
    [Destination: 2.10.1]
    USBPcap pseudoheader length: 27
    IRP ID: 0xffffb50bc6c0a010
    IRP USBD_STATUS: USBD_STATUS_SUCCESS (0x00000000)
    URB Function: URB_FUNCTION_BULK_OR_INTERRUPT_TRANSFER (0x0009)
    IRP information: 0x00, Direction: FDO -> PDO
    URB bus id: 2
    Device address: 10
    Endpoint: 0x01, Direction: OUT
    URB transfer type: URB_BULK (0x03)
    Packet Data Length: 35106
    [Response in: 4763]
    [bInterfaceClass: Unknown (0xffff)]
Leftover Capture Data […]: 000000000000000000000000000000000000000000000000000000000000000000000000000000000000000000000000000000000000000000000000000000000000000000000000000000000000000000000000000000000000000000000000000000000000000000

No.     Time           Source                Destination           Protocol Length Info
   4763 13.940339      2.10.1                host                  USB      27     URB_BULK out

Frame 4763: Packet, 27 bytes on wire (216 bits), 27 bytes captured (216 bits) on interface \\.\USBPcap2, id 0
USB URB
    [Source: 2.10.1]
    [Destination: host]
    USBPcap pseudoheader length: 27
    IRP ID: 0xffffb50bc6c0a010
    IRP USBD_STATUS: USBD_STATUS_SUCCESS (0x00000000)
    URB Function: URB_FUNCTION_BULK_OR_INTERRUPT_TRANSFER (0x0009)
    IRP information: 0x01, Direction: PDO -> FDO
    URB bus id: 2
    Device address: 10
    Endpoint: 0x01, Direction: OUT
    URB transfer type: URB_BULK (0x03)
    Packet Data Length: 0
    [Request in: 4757]
    [Time from request: 19.010000 milliseconds]
    [bInterfaceClass: Unknown (0xffff)]

No.     Time           Source                Destination           Protocol Length Info
   4765 13.940387      host                  2.10.1                USB      95777  URB_BULK out

Frame 4765: Packet, 95777 bytes on wire (766216 bits), 65535 bytes captured (524280 bits) on interface \\.\USBPcap2, id 0
USB URB
    [Source: host]
    [Destination: 2.10.1]
    USBPcap pseudoheader length: 27
    IRP ID: 0xffffb50bc6c0a010
    IRP USBD_STATUS: USBD_STATUS_SUCCESS (0x00000000)
    URB Function: URB_FUNCTION_BULK_OR_INTERRUPT_TRANSFER (0x0009)
    IRP information: 0x00, Direction: FDO -> PDO
    URB bus id: 2
    Device address: 10
    Endpoint: 0x01, Direction: OUT
    URB transfer type: URB_BULK (0x03)
    Packet Data Length: 95750
    [Response in: 4788]
    [bInterfaceClass: Unknown (0xffff)]
Leftover Capture Data […]: 000000000000000000000000000000000000000000000000000000000000000000000000000000000000000000000000000000000000000000000000000000000000000000000000000000000000000000000000000000000000000000000000000000000000000000

No.     Time           Source                Destination           Protocol Length Info
   4788 14.005804      2.10.1                host                  USB      27     URB_BULK out

Frame 4788: Packet, 27 bytes on wire (216 bits), 27 bytes captured (216 bits) on interface \\.\USBPcap2, id 0
USB URB
    [Source: 2.10.1]
    [Destination: host]
    USBPcap pseudoheader length: 27
    IRP ID: 0xffffb50bc6c0a010
    IRP USBD_STATUS: USBD_STATUS_SUCCESS (0x00000000)
    URB Function: URB_FUNCTION_BULK_OR_INTERRUPT_TRANSFER (0x0009)
    IRP information: 0x01, Direction: PDO -> FDO
    URB bus id: 2
    Device address: 10
    Endpoint: 0x01, Direction: OUT
    URB transfer type: URB_BULK (0x03)
    Packet Data Length: 0
    [Request in: 4765]
    [Time from request: 65.417000 milliseconds]
    [bInterfaceClass: Unknown (0xffff)]

No.     Time           Source                Destination           Protocol Length Info
   4789 14.005845      host                  2.10.1                USB      243    URB_BULK out

Frame 4789: Packet, 243 bytes on wire (1944 bits), 243 bytes captured (1944 bits) on interface \\.\USBPcap2, id 0
USB URB
    [Source: host]
    [Destination: 2.10.1]
    USBPcap pseudoheader length: 27
    IRP ID: 0xffffb50bc6c0a010
    IRP USBD_STATUS: USBD_STATUS_SUCCESS (0x00000000)
    URB Function: URB_FUNCTION_BULK_OR_INTERRUPT_TRANSFER (0x0009)
    IRP information: 0x00, Direction: FDO -> PDO
    URB bus id: 2
    Device address: 10
    Endpoint: 0x01, Direction: OUT
    URB transfer type: URB_BULK (0x03)
    Packet Data Length: 216
    [Response in: 4790]
    [bInterfaceClass: Unknown (0xffff)]
Leftover Capture Data […]: 000000000000000000000000000000000000000000000000000000000000000000000000000000000000000000000000000000000000000000000000000000000000000000000000000000000000000000000000000000000000000000000000000000000000000000

No.     Time           Source                Destination           Protocol Length Info
   4790 14.005885      2.10.1                host                  USB      27     URB_BULK out

Frame 4790: Packet, 27 bytes on wire (216 bits), 27 bytes captured (216 bits) on interface \\.\USBPcap2, id 0
USB URB
    [Source: 2.10.1]
    [Destination: host]
    USBPcap pseudoheader length: 27
    IRP ID: 0xffffb50bc6c0a010
    IRP USBD_STATUS: USBD_STATUS_SUCCESS (0x00000000)
    URB Function: URB_FUNCTION_BULK_OR_INTERRUPT_TRANSFER (0x0009)
    IRP information: 0x01, Direction: PDO -> FDO
    URB bus id: 2
    Device address: 10
    Endpoint: 0x01, Direction: OUT
    URB transfer type: URB_BULK (0x03)
    Packet Data Length: 0
    [Request in: 4789]
    [Time from request: 40.000 microseconds]
    [bInterfaceClass: Unknown (0xffff)]

No.     Time           Source                Destination           Protocol Length Info
   4791 14.005927      host                  2.10.1                USB      65561  URB_BULK out

Frame 4791: Packet, 65561 bytes on wire (524488 bits), 65535 bytes captured (524280 bits) on interface \\.\USBPcap2, id 0
USB URB
    [Source: host]
    [Destination: 2.10.1]
    USBPcap pseudoheader length: 27
    IRP ID: 0xffffb50bc6c0a010
    IRP USBD_STATUS: USBD_STATUS_SUCCESS (0x00000000)
    URB Function: URB_FUNCTION_BULK_OR_INTERRUPT_TRANSFER (0x0009)
    IRP information: 0x00, Direction: FDO -> PDO
    URB bus id: 2
    Device address: 10
    Endpoint: 0x01, Direction: OUT
    URB transfer type: URB_BULK (0x03)
    Packet Data Length: 65534
    [Response in: 4804]
    [bInterfaceClass: Unknown (0xffff)]
Leftover Capture Data […]: 0000000000000000000000000000000000000000000000d2d2d2bfd3d3d3ffd3d300d3ffd3d3d3ffd3d3d3ffd3d3d3ffd3d3d3ffd3d3d3ffd3d3d3ffd3d3d3ffd3d3d3ffd3d3d3ffd3d3d3ffd3d3d3ffd3d3d3ffd3d3d3970000000000000000000000000000000000

No.     Time           Source                Destination           Protocol Length Info
   4804 14.042392      2.10.1                host                  USB      27     URB_BULK out

Frame 4804: Packet, 27 bytes on wire (216 bits), 27 bytes captured (216 bits) on interface \\.\USBPcap2, id 0
USB URB
    [Source: 2.10.1]
    [Destination: host]
    USBPcap pseudoheader length: 27
    IRP ID: 0xffffb50bc6c0a010
    IRP USBD_STATUS: USBD_STATUS_SUCCESS (0x00000000)
    URB Function: URB_FUNCTION_BULK_OR_INTERRUPT_TRANSFER (0x0009)
    IRP information: 0x01, Direction: PDO -> FDO
    URB bus id: 2
    Device address: 10
    Endpoint: 0x01, Direction: OUT
    URB transfer type: URB_BULK (0x03)
    Packet Data Length: 0
    [Request in: 4791]
    [Time from request: 36.465000 milliseconds]
    [bInterfaceClass: Unknown (0xffff)]

No.     Time           Source                Destination           Protocol Length Info
   4805 14.042437      host                  2.10.1                USB      65527  URB_BULK out

Frame 4805: Packet, 65527 bytes on wire (524216 bits), 65527 bytes captured (524216 bits) on interface \\.\USBPcap2, id 0
USB URB
    [Source: host]
    [Destination: 2.10.1]
    USBPcap pseudoheader length: 27
    IRP ID: 0xffffb50bc6c0a010
    IRP USBD_STATUS: USBD_STATUS_SUCCESS (0x00000000)
    URB Function: URB_FUNCTION_BULK_OR_INTERRUPT_TRANSFER (0x0009)
    IRP information: 0x00, Direction: FDO -> PDO
    URB bus id: 2
    Device address: 10
    Endpoint: 0x01, Direction: OUT
    URB transfer type: URB_BULK (0x03)
    Packet Data Length: 65500
    [Response in: 4818]
    [bInterfaceClass: Unknown (0xffff)]
Leftover Capture Data […]: 00000000000000000000000000000000f6238df1ff0080ffff0080ffff0080ffff0080ffff0080ffff0080ffff0080ffff0080ffff0080ffff0080ffff0080ffff0080ffff0080ffff0080fff7278fa300000000000000000000000000000000000000000000000000

No.     Time           Source                Destination           Protocol Length Info
   4818 14.073486      2.10.1                host                  USB      27     URB_BULK out

Frame 4818: Packet, 27 bytes on wire (216 bits), 27 bytes captured (216 bits) on interface \\.\USBPcap2, id 0
USB URB
    [Source: 2.10.1]
    [Destination: host]
    USBPcap pseudoheader length: 27
    IRP ID: 0xffffb50bc6c0a010
    IRP USBD_STATUS: USBD_STATUS_SUCCESS (0x00000000)
    URB Function: URB_FUNCTION_BULK_OR_INTERRUPT_TRANSFER (0x0009)
    IRP information: 0x01, Direction: PDO -> FDO
    URB bus id: 2
    Device address: 10
    Endpoint: 0x01, Direction: OUT
    URB transfer type: URB_BULK (0x03)
    Packet Data Length: 0
    [Request in: 4805]
    [Time from request: 31.049000 milliseconds]
    [bInterfaceClass: Unknown (0xffff)]

No.     Time           Source                Destination           Protocol Length Info
   4819 14.073517      host                  2.10.1                USB      65     URB_BULK out

Frame 4819: Packet, 65 bytes on wire (520 bits), 65 bytes captured (520 bits) on interface \\.\USBPcap2, id 0
USB URB
    [Source: host]
    [Destination: 2.10.1]
    USBPcap pseudoheader length: 27
    IRP ID: 0xffffb50bc6c0a010
    IRP USBD_STATUS: USBD_STATUS_SUCCESS (0x00000000)
    URB Function: URB_FUNCTION_BULK_OR_INTERRUPT_TRANSFER (0x0009)
    IRP information: 0x00, Direction: FDO -> PDO
    URB bus id: 2
    Device address: 10
    Endpoint: 0x01, Direction: OUT
    URB transfer type: URB_BULK (0x03)
    Packet Data Length: 38
    [Response in: 4820]
    [bInterfaceClass: Unknown (0xffff)]
Leftover Capture Data: 0000000000000000000000000000000000000000000000000000000000000000000000000000

No.     Time           Source                Destination           Protocol Length Info
   4820 14.073537      2.10.1                host                  USB      27     URB_BULK out

Frame 4820: Packet, 27 bytes on wire (216 bits), 27 bytes captured (216 bits) on interface \\.\USBPcap2, id 0
USB URB
    [Source: 2.10.1]
    [Destination: host]
    USBPcap pseudoheader length: 27
    IRP ID: 0xffffb50bc6c0a010
    IRP USBD_STATUS: USBD_STATUS_SUCCESS (0x00000000)
    URB Function: URB_FUNCTION_BULK_OR_INTERRUPT_TRANSFER (0x0009)
    IRP information: 0x01, Direction: PDO -> FDO
    URB bus id: 2
    Device address: 10
    Endpoint: 0x01, Direction: OUT
    URB transfer type: URB_BULK (0x03)
    Packet Data Length: 0
    [Request in: 4819]
    [Time from request: 20.000 microseconds]
    [bInterfaceClass: Unknown (0xffff)]

No.     Time           Source                Destination           Protocol Length Info
   4821 14.073583      host                  2.10.1                USB      90489  URB_BULK out

Frame 4821: Packet, 90489 bytes on wire (723912 bits), 65535 bytes captured (524280 bits) on interface \\.\USBPcap2, id 0
USB URB
    [Source: host]
    [Destination: 2.10.1]
    USBPcap pseudoheader length: 27
    IRP ID: 0xffffb50bc6c0a010
    IRP USBD_STATUS: USBD_STATUS_SUCCESS (0x00000000)
    URB Function: URB_FUNCTION_BULK_OR_INTERRUPT_TRANSFER (0x0009)
    IRP information: 0x00, Direction: FDO -> PDO
    URB bus id: 2
    Device address: 10
    Endpoint: 0x01, Direction: OUT
    URB transfer type: URB_BULK (0x03)
    Packet Data Length: 90462
    [Response in: 4834]
    [bInterfaceClass: Unknown (0xffff)]
Leftover Capture Data […]: 00000000000000000000000000000000000000000000000000000000fb0c84feff0080ffff0080ffff0080ffff0080ffff0080ffff0080ffff0080ffff0080ffff0080ffff0080ffff0080ffff0080ffff0080ffff0080ffea60a54a00000000000000000000000000

No.     Time           Source                Destination           Protocol Length Info
   4834 14.119938      2.10.1                host                  USB      27     URB_BULK out

Frame 4834: Packet, 27 bytes on wire (216 bits), 27 bytes captured (216 bits) on interface \\.\USBPcap2, id 0
USB URB
    [Source: 2.10.1]
    [Destination: host]
    USBPcap pseudoheader length: 27
    IRP ID: 0xffffb50bc6c0a010
    IRP USBD_STATUS: USBD_STATUS_SUCCESS (0x00000000)
    URB Function: URB_FUNCTION_BULK_OR_INTERRUPT_TRANSFER (0x0009)
    IRP information: 0x01, Direction: PDO -> FDO
    URB bus id: 2
    Device address: 10
    Endpoint: 0x01, Direction: OUT
    URB transfer type: URB_BULK (0x03)
    Packet Data Length: 0
    [Request in: 4821]
    [Time from request: 46.355000 milliseconds]
    [bInterfaceClass: Unknown (0xffff)]

No.     Time           Source                Destination           Protocol Length Info
   4836 14.120004      host                  2.10.1                USB      40637  URB_BULK out

Frame 4836: Packet, 40637 bytes on wire (325096 bits), 40637 bytes captured (325096 bits) on interface \\.\USBPcap2, id 0
USB URB
    [Source: host]
    [Destination: 2.10.1]
    USBPcap pseudoheader length: 27
    IRP ID: 0xffffb50bc6c0a010
    IRP USBD_STATUS: USBD_STATUS_SUCCESS (0x00000000)
    URB Function: URB_FUNCTION_BULK_OR_INTERRUPT_TRANSFER (0x0009)
    IRP information: 0x00, Direction: FDO -> PDO
    URB bus id: 2
    Device address: 10
    Endpoint: 0x01, Direction: OUT
    URB transfer type: URB_BULK (0x03)
    Packet Data Length: 40610
    [Response in: 4848]
    [bInterfaceClass: Unknown (0xffff)]
Leftover Capture Data […]: 000000000000000000000000000000000000000000000000000000000000000000000000000000000000000000000000000000000000000000000000000000000000000000000000000000000000000000000000000000000000000000000000000000000000000000

No.     Time           Source                Destination           Protocol Length Info
   4848 14.145358      2.10.1                host                  USB      27     URB_BULK out

Frame 4848: Packet, 27 bytes on wire (216 bits), 27 bytes captured (216 bits) on interface \\.\USBPcap2, id 0
USB URB
    [Source: 2.10.1]
    [Destination: host]
    USBPcap pseudoheader length: 27
    IRP ID: 0xffffb50bc6c0a010
    IRP USBD_STATUS: USBD_STATUS_SUCCESS (0x00000000)
    URB Function: URB_FUNCTION_BULK_OR_INTERRUPT_TRANSFER (0x0009)
    IRP information: 0x01, Direction: PDO -> FDO
    URB bus id: 2
    Device address: 10
    Endpoint: 0x01, Direction: OUT
    URB transfer type: URB_BULK (0x03)
    Packet Data Length: 0
    [Request in: 4836]
    [Time from request: 25.354000 milliseconds]
    [bInterfaceClass: Unknown (0xffff)]

No.     Time           Source                Destination           Protocol Length Info
   4849 14.145408      host                  2.10.1                USB      90417  URB_BULK out

Frame 4849: Packet, 90417 bytes on wire (723336 bits), 65535 bytes captured (524280 bits) on interface \\.\USBPcap2, id 0
USB URB
    [Source: host]
    [Destination: 2.10.1]
    USBPcap pseudoheader length: 27
    IRP ID: 0xffffb50bc6c0a010
    IRP USBD_STATUS: USBD_STATUS_SUCCESS (0x00000000)
    URB Function: URB_FUNCTION_BULK_OR_INTERRUPT_TRANSFER (0x0009)
    IRP information: 0x00, Direction: FDO -> PDO
    URB bus id: 2
    Device address: 10
    Endpoint: 0x01, Direction: OUT
    URB transfer type: URB_BULK (0x03)
    Packet Data Length: 90390
    [Response in: 4862]
    [bInterfaceClass: Unknown (0xffff)]
Leftover Capture Data […]: 000000000000000000000000000000000000000000000000000000000000000000000000000000000000000000000000000000000000000000000000000000000000000000000000000000000000000000000000000000000000000000000000000000000000000000

No.     Time           Source                Destination           Protocol Length Info
   4862 14.191438      2.10.1                host                  USB      27     URB_BULK out

Frame 4862: Packet, 27 bytes on wire (216 bits), 27 bytes captured (216 bits) on interface \\.\USBPcap2, id 0
USB URB
    [Source: 2.10.1]
    [Destination: host]
    USBPcap pseudoheader length: 27
    IRP ID: 0xffffb50bc6c0a010
    IRP USBD_STATUS: USBD_STATUS_SUCCESS (0x00000000)
    URB Function: URB_FUNCTION_BULK_OR_INTERRUPT_TRANSFER (0x0009)
    IRP information: 0x01, Direction: PDO -> FDO
    URB bus id: 2
    Device address: 10
    Endpoint: 0x01, Direction: OUT
    URB transfer type: URB_BULK (0x03)
    Packet Data Length: 0
    [Request in: 4849]
    [Time from request: 46.030000 milliseconds]
    [bInterfaceClass: Unknown (0xffff)]

No.     Time           Source                Destination           Protocol Length Info
   4863 14.191475      host                  2.10.1                USB      40527  URB_BULK out

Frame 4863: Packet, 40527 bytes on wire (324216 bits), 40527 bytes captured (324216 bits) on interface \\.\USBPcap2, id 0
USB URB
    [Source: host]
    [Destination: 2.10.1]
    USBPcap pseudoheader length: 27
    IRP ID: 0xffffb50bc6c0a010
    IRP USBD_STATUS: USBD_STATUS_SUCCESS (0x00000000)
    URB Function: URB_FUNCTION_BULK_OR_INTERRUPT_TRANSFER (0x0009)
    IRP information: 0x00, Direction: FDO -> PDO
    URB bus id: 2
    Device address: 10
    Endpoint: 0x01, Direction: OUT
    URB transfer type: URB_BULK (0x03)
    Packet Data Length: 40500
    [Response in: 4876]
    [bInterfaceClass: Unknown (0xffff)]
Leftover Capture Data […]: 000000000000000000000000000000000000000000000000000000000000000000000000000000000000000000000000000000000000000000000000000000000000000000000000000000000000000000000000000000000000000000000000000000000000000000

No.     Time           Source                Destination           Protocol Length Info
   4876 14.220867      2.10.1                host                  USB      27     URB_BULK out

Frame 4876: Packet, 27 bytes on wire (216 bits), 27 bytes captured (216 bits) on interface \\.\USBPcap2, id 0
USB URB
    [Source: 2.10.1]
    [Destination: host]
    USBPcap pseudoheader length: 27
    IRP ID: 0xffffb50bc6c0a010
    IRP USBD_STATUS: USBD_STATUS_SUCCESS (0x00000000)
    URB Function: URB_FUNCTION_BULK_OR_INTERRUPT_TRANSFER (0x0009)
    IRP information: 0x01, Direction: PDO -> FDO
    URB bus id: 2
    Device address: 10
    Endpoint: 0x01, Direction: OUT
    URB transfer type: URB_BULK (0x03)
    Packet Data Length: 0
    [Request in: 4863]
    [Time from request: 29.392000 milliseconds]
    [bInterfaceClass: Unknown (0xffff)]

No.     Time           Source                Destination           Protocol Length Info
   4877 14.220895      host                  2.10.1                USB      209    URB_BULK out

Frame 4877: Packet, 209 bytes on wire (1672 bits), 209 bytes captured (1672 bits) on interface \\.\USBPcap2, id 0
USB URB
    [Source: host]
    [Destination: 2.10.1]
    USBPcap pseudoheader length: 27
    IRP ID: 0xffffb50bc6c0a010
    IRP USBD_STATUS: USBD_STATUS_SUCCESS (0x00000000)
    URB Function: URB_FUNCTION_BULK_OR_INTERRUPT_TRANSFER (0x0009)
    IRP information: 0x00, Direction: FDO -> PDO
    URB bus id: 2
    Device address: 10
    Endpoint: 0x01, Direction: OUT
    URB transfer type: URB_BULK (0x03)
    Packet Data Length: 182
    [Response in: 4878]
    [bInterfaceClass: Unknown (0xffff)]
Leftover Capture Data […]: 000000000000000000000000000000000000000000000000000000000000000000000000000000000000000000000000000000000000000000000000000000000000000000000000000000000000000000000000000000000000000000000000000000000000000000

No.     Time           Source                Destination           Protocol Length Info
   4878 14.223813      2.10.1                host                  USB      27     URB_BULK out

Frame 4878: Packet, 27 bytes on wire (216 bits), 27 bytes captured (216 bits) on interface \\.\USBPcap2, id 0
USB URB
    [Source: 2.10.1]
    [Destination: host]
    USBPcap pseudoheader length: 27
    IRP ID: 0xffffb50bc6c0a010
    IRP USBD_STATUS: USBD_STATUS_SUCCESS (0x00000000)
    URB Function: URB_FUNCTION_BULK_OR_INTERRUPT_TRANSFER (0x0009)
    IRP information: 0x01, Direction: PDO -> FDO
    URB bus id: 2
    Device address: 10
    Endpoint: 0x01, Direction: OUT
    URB transfer type: URB_BULK (0x03)
    Packet Data Length: 0
    [Request in: 4877]
    [Time from request: 2.918000 milliseconds]
    [bInterfaceClass: Unknown (0xffff)]

No.     Time           Source                Destination           Protocol Length Info
   4879 14.223865      host                  2.10.1                USB      131095 URB_BULK out

Frame 4879: Packet, 131095 bytes on wire (1048760 bits), 65535 bytes captured (524280 bits) on interface \\.\USBPcap2, id 0
USB URB
    [Source: host]
    [Destination: 2.10.1]
    USBPcap pseudoheader length: 27
    IRP ID: 0xffffb50bc6c0a010
    IRP USBD_STATUS: USBD_STATUS_SUCCESS (0x00000000)
    URB Function: URB_FUNCTION_BULK_OR_INTERRUPT_TRANSFER (0x0009)
    IRP information: 0x00, Direction: FDO -> PDO
    URB bus id: 2
    Device address: 10
    Endpoint: 0x01, Direction: OUT
    URB transfer type: URB_BULK (0x03)
    Packet Data Length: 131068
    [Response in: 4900]
    [bInterfaceClass: Unknown (0xffff)]
Leftover Capture Data […]: 000000000000000000000000000000000000000000000000000000000000000000000000000000000000000000000000000000000000000000000000000000000000000000000000000000000000000000000000000000000000000000000000000000000000000000

No.     Time           Source                Destination           Protocol Length Info
   4900 14.287891      2.10.1                host                  USB      27     URB_BULK out

Frame 4900: Packet, 27 bytes on wire (216 bits), 27 bytes captured (216 bits) on interface \\.\USBPcap2, id 0
USB URB
    [Source: 2.10.1]
    [Destination: host]
    USBPcap pseudoheader length: 27
    IRP ID: 0xffffb50bc6c0a010
    IRP USBD_STATUS: USBD_STATUS_SUCCESS (0x00000000)
    URB Function: URB_FUNCTION_BULK_OR_INTERRUPT_TRANSFER (0x0009)
    IRP information: 0x01, Direction: PDO -> FDO
    URB bus id: 2
    Device address: 10
    Endpoint: 0x01, Direction: OUT
    URB transfer type: URB_BULK (0x03)
    Packet Data Length: 0
    [Request in: 4879]
    [Time from request: 64.026000 milliseconds]
    [bInterfaceClass: Unknown (0xffff)]

No.     Time           Source                Destination           Protocol Length Info
   4901 14.287949      host                  2.10.1                USB      31     URB_BULK out

Frame 4901: Packet, 31 bytes on wire (248 bits), 31 bytes captured (248 bits) on interface \\.\USBPcap2, id 0
USB URB
    [Source: host]
    [Destination: 2.10.1]
    USBPcap pseudoheader length: 27
    IRP ID: 0xffffb50bc6c08010
    IRP USBD_STATUS: USBD_STATUS_SUCCESS (0x00000000)
    URB Function: URB_FUNCTION_BULK_OR_INTERRUPT_TRANSFER (0x0009)
    IRP information: 0x00, Direction: FDO -> PDO
    URB bus id: 2
    Device address: 10
    Endpoint: 0x01, Direction: OUT
    URB transfer type: URB_BULK (0x03)
    Packet Data Length: 4
    [Response in: 4903]
    [bInterfaceClass: Unknown (0xffff)]
Leftover Capture Data: 00000000

No.     Time           Source                Destination           Protocol Length Info
   4903 14.288041      2.10.1                host                  USB      27     URB_BULK out

Frame 4903: Packet, 27 bytes on wire (216 bits), 27 bytes captured (216 bits) on interface \\.\USBPcap2, id 0
USB URB
    [Source: 2.10.1]
    [Destination: host]
    USBPcap pseudoheader length: 27
    IRP ID: 0xffffb50bc6c08010
    IRP USBD_STATUS: USBD_STATUS_SUCCESS (0x00000000)
    URB Function: URB_FUNCTION_BULK_OR_INTERRUPT_TRANSFER (0x0009)
    IRP information: 0x01, Direction: PDO -> FDO
    URB bus id: 2
    Device address: 10
    Endpoint: 0x01, Direction: OUT
    URB transfer type: URB_BULK (0x03)
    Packet Data Length: 0
    [Request in: 4901]
    [Time from request: 92.000 microseconds]
    [bInterfaceClass: Unknown (0xffff)]

No.     Time           Source                Destination           Protocol Length Info
   4904 14.288076      host                  2.10.1                USB      9773   URB_BULK out

Frame 4904: Packet, 9773 bytes on wire (78184 bits), 9773 bytes captured (78184 bits) on interface \\.\USBPcap2, id 0
USB URB
    [Source: host]
    [Destination: 2.10.1]
    USBPcap pseudoheader length: 27
    IRP ID: 0xffffb50bc6c08010
    IRP USBD_STATUS: USBD_STATUS_SUCCESS (0x00000000)
    URB Function: URB_FUNCTION_BULK_OR_INTERRUPT_TRANSFER (0x0009)
    IRP information: 0x00, Direction: FDO -> PDO
    URB bus id: 2
    Device address: 10
    Endpoint: 0x01, Direction: OUT
    URB transfer type: URB_BULK (0x03)
    Packet Data Length: 9746
    [Response in: 4908]
    [bInterfaceClass: Unknown (0xffff)]
Leftover Capture Data […]: 000000000000000000000000000000000000000000000000000000000000000000000000000000000000000000000000000000000000000000000000000000000000000000000000000000000000000000000000000000000000000000000000000000000000000000

No.     Time           Source                Destination           Protocol Length Info
   4908 14.296103      2.10.1                host                  USB      27     URB_BULK out

Frame 4908: Packet, 27 bytes on wire (216 bits), 27 bytes captured (216 bits) on interface \\.\USBPcap2, id 0
USB URB
    [Source: 2.10.1]
    [Destination: host]
    USBPcap pseudoheader length: 27
    IRP ID: 0xffffb50bc6c08010
    IRP USBD_STATUS: USBD_STATUS_SUCCESS (0x00000000)
    URB Function: URB_FUNCTION_BULK_OR_INTERRUPT_TRANSFER (0x0009)
    IRP information: 0x01, Direction: PDO -> FDO
    URB bus id: 2
    Device address: 10
    Endpoint: 0x01, Direction: OUT
    URB transfer type: URB_BULK (0x03)
    Packet Data Length: 0
    [Request in: 4904]
    [Time from request: 8.027000 milliseconds]
    [bInterfaceClass: Unknown (0xffff)]

No.     Time           Source                Destination           Protocol Length Info
   4909 14.296136      host                  2.10.1                USB      9027   URB_BULK out

Frame 4909: Packet, 9027 bytes on wire (72216 bits), 9027 bytes captured (72216 bits) on interface \\.\USBPcap2, id 0
USB URB
    [Source: host]
    [Destination: 2.10.1]
    USBPcap pseudoheader length: 27
    IRP ID: 0xffffb50bc6c08010
    IRP USBD_STATUS: USBD_STATUS_SUCCESS (0x00000000)
    URB Function: URB_FUNCTION_BULK_OR_INTERRUPT_TRANSFER (0x0009)
    IRP information: 0x00, Direction: FDO -> PDO
    URB bus id: 2
    Device address: 10
    Endpoint: 0x01, Direction: OUT
    URB transfer type: URB_BULK (0x03)
    Packet Data Length: 9000
    [Response in: 4914]
    [bInterfaceClass: Unknown (0xffff)]
Leftover Capture Data […]: d0ef69000021db0000000000000000000000000000000000000000000000000000000000000000000000000000000000000000000000000000000000000000000000000000000000000000000000000000000000000000000000000000000000000000000000000000

No.     Time           Source                Destination           Protocol Length Info
   4914 14.301338      2.10.1                host                  USB      27     URB_BULK out

Frame 4914: Packet, 27 bytes on wire (216 bits), 27 bytes captured (216 bits) on interface \\.\USBPcap2, id 0
USB URB
    [Source: 2.10.1]
    [Destination: host]
    USBPcap pseudoheader length: 27
    IRP ID: 0xffffb50bc6c08010
    IRP USBD_STATUS: USBD_STATUS_SUCCESS (0x00000000)
    URB Function: URB_FUNCTION_BULK_OR_INTERRUPT_TRANSFER (0x0009)
    IRP information: 0x01, Direction: PDO -> FDO
    URB bus id: 2
    Device address: 10
    Endpoint: 0x01, Direction: OUT
    URB transfer type: URB_BULK (0x03)
    Packet Data Length: 0
    [Request in: 4909]
    [Time from request: 5.202000 milliseconds]
    [bInterfaceClass: Unknown (0xffff)]

No.     Time           Source                Destination           Protocol Length Info
   4945 14.389965      host                  2.10.1                USB      4277   URB_BULK out

Frame 4945: Packet, 4277 bytes on wire (34216 bits), 4277 bytes captured (34216 bits) on interface \\.\USBPcap2, id 0
USB URB
    [Source: host]
    [Destination: 2.10.1]
    USBPcap pseudoheader length: 27
    IRP ID: 0xffffb50bc6bdc010
    IRP USBD_STATUS: USBD_STATUS_SUCCESS (0x00000000)
    URB Function: URB_FUNCTION_BULK_OR_INTERRUPT_TRANSFER (0x0009)
    IRP information: 0x00, Direction: FDO -> PDO
    URB bus id: 2
    Device address: 10
    Endpoint: 0x01, Direction: OUT
    URB transfer type: URB_BULK (0x03)
    Packet Data Length: 4250
    [Response in: 4946]
    [bInterfaceClass: Unknown (0xffff)]
Leftover Capture Data […]: caef69000e10000000000000000000000000000000000000000000000000000000000000000000000000000000000000000000000000000000000000000000000000000000000000000000000000000000000000000000000000000000000000000000000000000000

No.     Time           Source                Destination           Protocol Length Info
   4946 14.390451      2.10.1                host                  USB      27     URB_BULK out

Frame 4946: Packet, 27 bytes on wire (216 bits), 27 bytes captured (216 bits) on interface \\.\USBPcap2, id 0
USB URB
    [Source: 2.10.1]
    [Destination: host]
    USBPcap pseudoheader length: 27
    IRP ID: 0xffffb50bc6bdc010
    IRP USBD_STATUS: USBD_STATUS_SUCCESS (0x00000000)
    URB Function: URB_FUNCTION_BULK_OR_INTERRUPT_TRANSFER (0x0009)
    IRP information: 0x01, Direction: PDO -> FDO
    URB bus id: 2
    Device address: 10
    Endpoint: 0x01, Direction: OUT
    URB transfer type: URB_BULK (0x03)
    Packet Data Length: 0
    [Request in: 4945]
    [Time from request: 486.000 microseconds]
    [bInterfaceClass: Unknown (0xffff)]

No.     Time           Source                Destination           Protocol Length Info
   4947 14.390490      host                  2.10.1                USB      108103 URB_BULK out

Frame 4947: Packet, 108103 bytes on wire (864824 bits), 65535 bytes captured (524280 bits) on interface \\.\USBPcap2, id 0
USB URB
    [Source: host]
    [Destination: 2.10.1]
    USBPcap pseudoheader length: 27
    IRP ID: 0xffffb50bc6bdc010
    IRP USBD_STATUS: USBD_STATUS_SUCCESS (0x00000000)
    URB Function: URB_FUNCTION_BULK_OR_INTERRUPT_TRANSFER (0x0009)
    IRP information: 0x00, Direction: FDO -> PDO
    URB bus id: 2
    Device address: 10
    Endpoint: 0x01, Direction: OUT
    URB transfer type: URB_BULK (0x03)
    Packet Data Length: 108076
    [Response in: 4968]
    [bInterfaceClass: Unknown (0xffff)]
Leftover Capture Data […]: 000000000000000000000000000000000000000000000000000000000000000000000000000000000000000000000000000000000000000000000000000000000000000000000000000000000000000000000000000000000000000000000000000000000000000000

No.     Time           Source                Destination           Protocol Length Info
   4968 14.449673      2.10.1                host                  USB      27     URB_BULK out

Frame 4968: Packet, 27 bytes on wire (216 bits), 27 bytes captured (216 bits) on interface \\.\USBPcap2, id 0
USB URB
    [Source: 2.10.1]
    [Destination: host]
    USBPcap pseudoheader length: 27
    IRP ID: 0xffffb50bc6bdc010
    IRP USBD_STATUS: USBD_STATUS_SUCCESS (0x00000000)
    URB Function: URB_FUNCTION_BULK_OR_INTERRUPT_TRANSFER (0x0009)
    IRP information: 0x01, Direction: PDO -> FDO
    URB bus id: 2
    Device address: 10
    Endpoint: 0x01, Direction: OUT
    URB transfer type: URB_BULK (0x03)
    Packet Data Length: 0
    [Request in: 4947]
    [Time from request: 59.183000 milliseconds]
    [bInterfaceClass: Unknown (0xffff)]

No.     Time           Source                Destination           Protocol Length Info
   4969 14.449731      host                  2.10.1                USB      22951  URB_BULK out

Frame 4969: Packet, 22951 bytes on wire (183608 bits), 22951 bytes captured (183608 bits) on interface \\.\USBPcap2, id 0
USB URB
    [Source: host]
    [Destination: 2.10.1]
    USBPcap pseudoheader length: 27
    IRP ID: 0xffffb50bc6bdc010
    IRP USBD_STATUS: USBD_STATUS_SUCCESS (0x00000000)
    URB Function: URB_FUNCTION_BULK_OR_INTERRUPT_TRANSFER (0x0009)
    IRP information: 0x00, Direction: FDO -> PDO
    URB bus id: 2
    Device address: 10
    Endpoint: 0x01, Direction: OUT
    URB transfer type: URB_BULK (0x03)
    Packet Data Length: 22924
    [Response in: 4978]
    [bInterfaceClass: Unknown (0xffff)]
Leftover Capture Data […]: 000000000000000000000000000000000000000000000000000000000000000000000000000000000000000000000000000000000000000000000000000000000000000000000000000000000000000000000000000000000000000000000000000000000000000000

No.     Time           Source                Destination           Protocol Length Info
   4978 14.474053      2.10.1                host                  USB      27     URB_BULK out

Frame 4978: Packet, 27 bytes on wire (216 bits), 27 bytes captured (216 bits) on interface \\.\USBPcap2, id 0
USB URB
    [Source: 2.10.1]
    [Destination: host]
    USBPcap pseudoheader length: 27
    IRP ID: 0xffffb50bc6bdc010
    IRP USBD_STATUS: USBD_STATUS_SUCCESS (0x00000000)
    URB Function: URB_FUNCTION_BULK_OR_INTERRUPT_TRANSFER (0x0009)
    IRP information: 0x01, Direction: PDO -> FDO
    URB bus id: 2
    Device address: 10
    Endpoint: 0x01, Direction: OUT
    URB transfer type: URB_BULK (0x03)
    Packet Data Length: 0
    [Request in: 4969]
    [Time from request: 24.322000 milliseconds]
    [bInterfaceClass: Unknown (0xffff)]

No.     Time           Source                Destination           Protocol Length Info
   4979 14.474104      host                  2.10.1                USB      108027 URB_BULK out

Frame 4979: Packet, 108027 bytes on wire (864216 bits), 65535 bytes captured (524280 bits) on interface \\.\USBPcap2, id 0
USB URB
    [Source: host]
    [Destination: 2.10.1]
    USBPcap pseudoheader length: 27
    IRP ID: 0xffffb50bc6bdc010
    IRP USBD_STATUS: USBD_STATUS_SUCCESS (0x00000000)
    URB Function: URB_FUNCTION_BULK_OR_INTERRUPT_TRANSFER (0x0009)
    IRP information: 0x00, Direction: FDO -> PDO
    URB bus id: 2
    Device address: 10
    Endpoint: 0x01, Direction: OUT
    URB transfer type: URB_BULK (0x03)
    Packet Data Length: 108000
    [Response in: 5000]
    [bInterfaceClass: Unknown (0xffff)]
Leftover Capture Data […]: 000000000000000000000000000000000000000000000000000000000000000000000000000000000000000000000000000000000000000000000000000000000000000000000000000000000000000000000000000000000000000000000000000000000000000000

No.     Time           Source                Destination           Protocol Length Info
   5000 14.532958      2.10.1                host                  USB      27     URB_BULK out

Frame 5000: Packet, 27 bytes on wire (216 bits), 27 bytes captured (216 bits) on interface \\.\USBPcap2, id 0
USB URB
    [Source: 2.10.1]
    [Destination: host]
    USBPcap pseudoheader length: 27
    IRP ID: 0xffffb50bc6bdc010
    IRP USBD_STATUS: USBD_STATUS_SUCCESS (0x00000000)
    URB Function: URB_FUNCTION_BULK_OR_INTERRUPT_TRANSFER (0x0009)
    IRP information: 0x01, Direction: PDO -> FDO
    URB bus id: 2
    Device address: 10
    Endpoint: 0x01, Direction: OUT
    URB transfer type: URB_BULK (0x03)
    Packet Data Length: 0
    [Request in: 4979]
    [Time from request: 58.854000 milliseconds]
    [bInterfaceClass: Unknown (0xffff)]

No.     Time           Source                Destination           Protocol Length Info
   5001 14.532991      host                  2.10.1                USB      175    URB_BULK out

Frame 5001: Packet, 175 bytes on wire (1400 bits), 175 bytes captured (1400 bits) on interface \\.\USBPcap2, id 0
USB URB
    [Source: host]
    [Destination: 2.10.1]
    USBPcap pseudoheader length: 27
    IRP ID: 0xffffb50bc6bdc010
    IRP USBD_STATUS: USBD_STATUS_SUCCESS (0x00000000)
    URB Function: URB_FUNCTION_BULK_OR_INTERRUPT_TRANSFER (0x0009)
    IRP information: 0x00, Direction: FDO -> PDO
    URB bus id: 2
    Device address: 10
    Endpoint: 0x01, Direction: OUT
    URB transfer type: URB_BULK (0x03)
    Packet Data Length: 148
    [Response in: 5002]
    [bInterfaceClass: Unknown (0xffff)]
Leftover Capture Data […]: 000000000000000000000000000000000000000000000000000000000000000000000000000000000000000000000000000000000000000000000000000000000000000000000000000000000000000000000000000000000000000000000000000000000000000000

No.     Time           Source                Destination           Protocol Length Info
   5002 14.533013      2.10.1                host                  USB      27     URB_BULK out

Frame 5002: Packet, 27 bytes on wire (216 bits), 27 bytes captured (216 bits) on interface \\.\USBPcap2, id 0
USB URB
    [Source: 2.10.1]
    [Destination: host]
    USBPcap pseudoheader length: 27
    IRP ID: 0xffffb50bc6bdc010
    IRP USBD_STATUS: USBD_STATUS_SUCCESS (0x00000000)
    URB Function: URB_FUNCTION_BULK_OR_INTERRUPT_TRANSFER (0x0009)
    IRP information: 0x01, Direction: PDO -> FDO
    URB bus id: 2
    Device address: 10
    Endpoint: 0x01, Direction: OUT
    URB transfer type: URB_BULK (0x03)
    Packet Data Length: 0
    [Request in: 5001]
    [Time from request: 22.000 microseconds]
    [bInterfaceClass: Unknown (0xffff)]

No.     Time           Source                Destination           Protocol Length Info
   5003 14.533037      host                  2.10.1                USB      38629  URB_BULK out

Frame 5003: Packet, 38629 bytes on wire (309032 bits), 38629 bytes captured (309032 bits) on interface \\.\USBPcap2, id 0
USB URB
    [Source: host]
    [Destination: 2.10.1]
    USBPcap pseudoheader length: 27
    IRP ID: 0xffffb50bc6bdc010
    IRP USBD_STATUS: USBD_STATUS_SUCCESS (0x00000000)
    URB Function: URB_FUNCTION_BULK_OR_INTERRUPT_TRANSFER (0x0009)
    IRP information: 0x00, Direction: FDO -> PDO
    URB bus id: 2
    Device address: 10
    Endpoint: 0x01, Direction: OUT
    URB transfer type: URB_BULK (0x03)
    Packet Data Length: 38602
    [Response in: 5012]
    [bInterfaceClass: Unknown (0xffff)]
Leftover Capture Data […]: 0000000000000000000000000000000000000000000000000000000000000000000000000000000000000000800180ff800080ff800080ff800080ff800080ff800080ff800080ff800080ff800080ff800080ff800080ff800080ff800080ff800080ffc900bac9ff

No.     Time           Source                Destination           Protocol Length Info
   5012 14.563396      2.10.1                host                  USB      27     URB_BULK out

Frame 5012: Packet, 27 bytes on wire (216 bits), 27 bytes captured (216 bits) on interface \\.\USBPcap2, id 0
USB URB
    [Source: 2.10.1]
    [Destination: host]
    USBPcap pseudoheader length: 27
    IRP ID: 0xffffb50bc6bdc010
    IRP USBD_STATUS: USBD_STATUS_SUCCESS (0x00000000)
    URB Function: URB_FUNCTION_BULK_OR_INTERRUPT_TRANSFER (0x0009)
    IRP information: 0x01, Direction: PDO -> FDO
    URB bus id: 2
    Device address: 10
    Endpoint: 0x01, Direction: OUT
    URB transfer type: URB_BULK (0x03)
    Packet Data Length: 0
    [Request in: 5003]
    [Time from request: 30.359000 milliseconds]
    [bInterfaceClass: Unknown (0xffff)]

No.     Time           Source                Destination           Protocol Length Info
   5013 14.563458      host                  2.10.1                USB      92497  URB_BULK out

Frame 5013: Packet, 92497 bytes on wire (739976 bits), 65535 bytes captured (524280 bits) on interface \\.\USBPcap2, id 0
USB URB
    [Source: host]
    [Destination: 2.10.1]
    USBPcap pseudoheader length: 27
    IRP ID: 0xffffb50bc6bdc010
    IRP USBD_STATUS: USBD_STATUS_SUCCESS (0x00000000)
    URB Function: URB_FUNCTION_BULK_OR_INTERRUPT_TRANSFER (0x0009)
    IRP information: 0x00, Direction: FDO -> PDO
    URB bus id: 2
    Device address: 10
    Endpoint: 0x01, Direction: OUT
    URB transfer type: URB_BULK (0x03)
    Packet Data Length: 92470
    [Response in: 5034]
    [bInterfaceClass: Unknown (0xffff)]
Leftover Capture Data […]: 000000000000000000000000000000000000000000000000000000000000000000000000000000000000000000000000000000000000000000000000000000000000000000000000000000000000000000000000000000000000000000000000000000000000000000

No.     Time           Source                Destination           Protocol Length Info
   5034 14.616874      2.10.1                host                  USB      27     URB_BULK out

Frame 5034: Packet, 27 bytes on wire (216 bits), 27 bytes captured (216 bits) on interface \\.\USBPcap2, id 0
USB URB
    [Source: 2.10.1]
    [Destination: host]
    USBPcap pseudoheader length: 27
    IRP ID: 0xffffb50bc6bdc010
    IRP USBD_STATUS: USBD_STATUS_SUCCESS (0x00000000)
    URB Function: URB_FUNCTION_BULK_OR_INTERRUPT_TRANSFER (0x0009)
    IRP information: 0x01, Direction: PDO -> FDO
    URB bus id: 2
    Device address: 10
    Endpoint: 0x01, Direction: OUT
    URB transfer type: URB_BULK (0x03)
    Packet Data Length: 0
    [Request in: 5013]
    [Time from request: 53.416000 milliseconds]
    [bInterfaceClass: Unknown (0xffff)]

No.     Time           Source                Destination           Protocol Length Info
   5035 14.616917      host                  2.10.1                USB      38557  URB_BULK out

Frame 5035: Packet, 38557 bytes on wire (308456 bits), 38557 bytes captured (308456 bits) on interface \\.\USBPcap2, id 0
USB URB
    [Source: host]
    [Destination: 2.10.1]
    USBPcap pseudoheader length: 27
    IRP ID: 0xffffb50bc6bdc010
    IRP USBD_STATUS: USBD_STATUS_SUCCESS (0x00000000)
    URB Function: URB_FUNCTION_BULK_OR_INTERRUPT_TRANSFER (0x0009)
    IRP information: 0x00, Direction: FDO -> PDO
    URB bus id: 2
    Device address: 10
    Endpoint: 0x01, Direction: OUT
    URB transfer type: URB_BULK (0x03)
    Packet Data Length: 38530
    [Response in: 5044]
    [bInterfaceClass: Unknown (0xffff)]
Leftover Capture Data […]: 000000000000000000000000000000000000000000000000000000000000000000000000000000000000000000000000000000000000000000000000000000000000000000000000000000000000000000000000000000000000000000000000000000000000000000

No.     Time           Source                Destination           Protocol Length Info
   5044 14.646459      2.10.1                host                  USB      27     URB_BULK out

Frame 5044: Packet, 27 bytes on wire (216 bits), 27 bytes captured (216 bits) on interface \\.\USBPcap2, id 0
USB URB
    [Source: 2.10.1]
    [Destination: host]
    USBPcap pseudoheader length: 27
    IRP ID: 0xffffb50bc6bdc010
    IRP USBD_STATUS: USBD_STATUS_SUCCESS (0x00000000)
    URB Function: URB_FUNCTION_BULK_OR_INTERRUPT_TRANSFER (0x0009)
    IRP information: 0x01, Direction: PDO -> FDO
    URB bus id: 2
    Device address: 10
    Endpoint: 0x01, Direction: OUT
    URB transfer type: URB_BULK (0x03)
    Packet Data Length: 0
    [Request in: 5035]
    [Time from request: 29.542000 milliseconds]
    [bInterfaceClass: Unknown (0xffff)]

No.     Time           Source                Destination           Protocol Length Info
   5045 14.646501      host                  2.10.1                USB      92527  URB_BULK out

Frame 5045: Packet, 92527 bytes on wire (740216 bits), 65535 bytes captured (524280 bits) on interface \\.\USBPcap2, id 0
USB URB
    [Source: host]
    [Destination: 2.10.1]
    USBPcap pseudoheader length: 27
    IRP ID: 0xffffb50bc6bdc010
    IRP USBD_STATUS: USBD_STATUS_SUCCESS (0x00000000)
    URB Function: URB_FUNCTION_BULK_OR_INTERRUPT_TRANSFER (0x0009)
    IRP information: 0x00, Direction: FDO -> PDO
    URB bus id: 2
    Device address: 10
    Endpoint: 0x01, Direction: OUT
    URB transfer type: URB_BULK (0x03)
    Packet Data Length: 92500
    [Response in: 5066]
    [bInterfaceClass: Unknown (0xffff)]
Leftover Capture Data […]: 870000000000000000000000000000000000000000000000000000000000000000000000000000000000000000000000000000000000000000000000000000000000000000000000000000000000000000000000000000000000000000000000000000000000000000

No.     Time           Source                Destination           Protocol Length Info
   5066 14.699177      2.10.1                host                  USB      27     URB_BULK out

Frame 5066: Packet, 27 bytes on wire (216 bits), 27 bytes captured (216 bits) on interface \\.\USBPcap2, id 0
USB URB
    [Source: 2.10.1]
    [Destination: host]
    USBPcap pseudoheader length: 27
    IRP ID: 0xffffb50bc6bdc010
    IRP USBD_STATUS: USBD_STATUS_SUCCESS (0x00000000)
    URB Function: URB_FUNCTION_BULK_OR_INTERRUPT_TRANSFER (0x0009)
    IRP information: 0x01, Direction: PDO -> FDO
    URB bus id: 2
    Device address: 10
    Endpoint: 0x01, Direction: OUT
    URB transfer type: URB_BULK (0x03)
    Packet Data Length: 0
    [Request in: 5045]
    [Time from request: 52.676000 milliseconds]
    [bInterfaceClass: Unknown (0xffff)]

No.     Time           Source                Destination           Protocol Length Info
   5067 14.699218      host                  2.10.1                USB      69     URB_BULK out

Frame 5067: Packet, 69 bytes on wire (552 bits), 69 bytes captured (552 bits) on interface \\.\USBPcap2, id 0
USB URB
    [Source: host]
    [Destination: 2.10.1]
    USBPcap pseudoheader length: 27
    IRP ID: 0xffffb50bc6bdc010
    IRP USBD_STATUS: USBD_STATUS_SUCCESS (0x00000000)
    URB Function: URB_FUNCTION_BULK_OR_INTERRUPT_TRANSFER (0x0009)
    IRP information: 0x00, Direction: FDO -> PDO
    URB bus id: 2
    Device address: 10
    Endpoint: 0x01, Direction: OUT
    URB transfer type: URB_BULK (0x03)
    Packet Data Length: 42
    [Response in: 5068]
    [bInterfaceClass: Unknown (0xffff)]
Leftover Capture Data: 0080ffff0080ffff0080ffff0080ffff0080ffff0080fff8278f27000000000000000000000000000000

No.     Time           Source                Destination           Protocol Length Info
   5068 14.699232      2.10.1                host                  USB      27     URB_BULK out

Frame 5068: Packet, 27 bytes on wire (216 bits), 27 bytes captured (216 bits) on interface \\.\USBPcap2, id 0
USB URB
    [Source: 2.10.1]
    [Destination: host]
    USBPcap pseudoheader length: 27
    IRP ID: 0xffffb50bc6bdc010
    IRP USBD_STATUS: USBD_STATUS_SUCCESS (0x00000000)
    URB Function: URB_FUNCTION_BULK_OR_INTERRUPT_TRANSFER (0x0009)
    IRP information: 0x01, Direction: PDO -> FDO
    URB bus id: 2
    Device address: 10
    Endpoint: 0x01, Direction: OUT
    URB transfer type: URB_BULK (0x03)
    Packet Data Length: 0
    [Request in: 5067]
    [Time from request: 14.000 microseconds]
    [bInterfaceClass: Unknown (0xffff)]

No.     Time           Source                Destination           Protocol Length Info
   5069 14.699265      host                  2.10.1                USB      38485  URB_BULK out

Frame 5069: Packet, 38485 bytes on wire (307880 bits), 38485 bytes captured (307880 bits) on interface \\.\USBPcap2, id 0
USB URB
    [Source: host]
    [Destination: 2.10.1]
    USBPcap pseudoheader length: 27
    IRP ID: 0xffffb50bc6bdc010
    IRP USBD_STATUS: USBD_STATUS_SUCCESS (0x00000000)
    URB Function: URB_FUNCTION_BULK_OR_INTERRUPT_TRANSFER (0x0009)
    IRP information: 0x00, Direction: FDO -> PDO
    URB bus id: 2
    Device address: 10
    Endpoint: 0x01, Direction: OUT
    URB transfer type: URB_BULK (0x03)
    Packet Data Length: 38458
    [Response in: 5078]
    [bInterfaceClass: Unknown (0xffff)]
Leftover Capture Data […]: 000000000000000000000000000000000000000000000000000000000000000000000000000000000000000000000000000000000000000000000000000000000000000000000000000000000000000000000000000000000000000000000000000000000000000000

No.     Time           Source                Destination           Protocol Length Info
   5078 14.728107      2.10.1                host                  USB      27     URB_BULK out

Frame 5078: Packet, 27 bytes on wire (216 bits), 27 bytes captured (216 bits) on interface \\.\USBPcap2, id 0
USB URB
    [Source: 2.10.1]
    [Destination: host]
    USBPcap pseudoheader length: 27
    IRP ID: 0xffffb50bc6bdc010
    IRP USBD_STATUS: USBD_STATUS_SUCCESS (0x00000000)
    URB Function: URB_FUNCTION_BULK_OR_INTERRUPT_TRANSFER (0x0009)
    IRP information: 0x01, Direction: PDO -> FDO
    URB bus id: 2
    Device address: 10
    Endpoint: 0x01, Direction: OUT
    URB transfer type: URB_BULK (0x03)
    Packet Data Length: 0
    [Request in: 5069]
    [Time from request: 28.842000 milliseconds]
    [bInterfaceClass: Unknown (0xffff)]

No.     Time           Source                Destination           Protocol Length Info
   5079 14.728146      host                  2.10.1                USB      92527  URB_BULK out

Frame 5079: Packet, 92527 bytes on wire (740216 bits), 65535 bytes captured (524280 bits) on interface \\.\USBPcap2, id 0
USB URB
    [Source: host]
    [Destination: 2.10.1]
    USBPcap pseudoheader length: 27
    IRP ID: 0xffffb50bc6bdc010
    IRP USBD_STATUS: USBD_STATUS_SUCCESS (0x00000000)
    URB Function: URB_FUNCTION_BULK_OR_INTERRUPT_TRANSFER (0x0009)
    IRP information: 0x00, Direction: FDO -> PDO
    URB bus id: 2
    Device address: 10
    Endpoint: 0x01, Direction: OUT
    URB transfer type: URB_BULK (0x03)
    Packet Data Length: 92500
    [Response in: 5100]
    [bInterfaceClass: Unknown (0xffff)]
Leftover Capture Data […]: 00000000000000000000000000000000000000000000000000eb6cac50ff0080ffff0080ffff0080ffff0080ffff0080ffff0080ffff0080ffff0080ffff0080ffff0080ffff0080ffff0080ffff0080ffff0080ffff0080fff5349535000000000000000000000000

No.     Time           Source                Destination           Protocol Length Info
   5100 14.784207      2.10.1                host                  USB      27     URB_BULK out

Frame 5100: Packet, 27 bytes on wire (216 bits), 27 bytes captured (216 bits) on interface \\.\USBPcap2, id 0
USB URB
    [Source: 2.10.1]
    [Destination: host]
    USBPcap pseudoheader length: 27
    IRP ID: 0xffffb50bc6bdc010
    IRP USBD_STATUS: USBD_STATUS_SUCCESS (0x00000000)
    URB Function: URB_FUNCTION_BULK_OR_INTERRUPT_TRANSFER (0x0009)
    IRP information: 0x01, Direction: PDO -> FDO
    URB bus id: 2
    Device address: 10
    Endpoint: 0x01, Direction: OUT
    URB transfer type: URB_BULK (0x03)
    Packet Data Length: 0
    [Request in: 5079]
    [Time from request: 56.061000 milliseconds]
    [bInterfaceClass: Unknown (0xffff)]

No.     Time           Source                Destination           Protocol Length Info
   5101 14.784251      host                  2.10.1                USB      141    URB_BULK out

Frame 5101: Packet, 141 bytes on wire (1128 bits), 141 bytes captured (1128 bits) on interface \\.\USBPcap2, id 0
USB URB
    [Source: host]
    [Destination: 2.10.1]
    USBPcap pseudoheader length: 27
    IRP ID: 0xffffb50bc6bdc010
    IRP USBD_STATUS: USBD_STATUS_SUCCESS (0x00000000)
    URB Function: URB_FUNCTION_BULK_OR_INTERRUPT_TRANSFER (0x0009)
    IRP information: 0x00, Direction: FDO -> PDO
    URB bus id: 2
    Device address: 10
    Endpoint: 0x01, Direction: OUT
    URB transfer type: URB_BULK (0x03)
    Packet Data Length: 114
    [Response in: 5102]
    [bInterfaceClass: Unknown (0xffff)]
Leftover Capture Data […]: 000000000000000000000000000000000000000000000000000000000000000000000000000000000000000000000000000000000000000000000000000000000000000000000000000000000000000000000000000000000000000000000000000000000000000000

No.     Time           Source                Destination           Protocol Length Info
   5102 14.784285      2.10.1                host                  USB      27     URB_BULK out

Frame 5102: Packet, 27 bytes on wire (216 bits), 27 bytes captured (216 bits) on interface \\.\USBPcap2, id 0
USB URB
    [Source: 2.10.1]
    [Destination: host]
    USBPcap pseudoheader length: 27
    IRP ID: 0xffffb50bc6bdc010
    IRP USBD_STATUS: USBD_STATUS_SUCCESS (0x00000000)
    URB Function: URB_FUNCTION_BULK_OR_INTERRUPT_TRANSFER (0x0009)
    IRP information: 0x01, Direction: PDO -> FDO
    URB bus id: 2
    Device address: 10
    Endpoint: 0x01, Direction: OUT
    URB transfer type: URB_BULK (0x03)
    Packet Data Length: 0
    [Request in: 5101]
    [Time from request: 34.000 microseconds]
    [bInterfaceClass: Unknown (0xffff)]

No.     Time           Source                Destination           Protocol Length Info
   5103 14.784343      host                  2.10.1                USB      74663  URB_BULK out

Frame 5103: Packet, 74663 bytes on wire (597304 bits), 65535 bytes captured (524280 bits) on interface \\.\USBPcap2, id 0
USB URB
    [Source: host]
    [Destination: 2.10.1]
    USBPcap pseudoheader length: 27
    IRP ID: 0xffffb50bc6bdc010
    IRP USBD_STATUS: USBD_STATUS_SUCCESS (0x00000000)
    URB Function: URB_FUNCTION_BULK_OR_INTERRUPT_TRANSFER (0x0009)
    IRP information: 0x00, Direction: FDO -> PDO
    URB bus id: 2
    Device address: 10
    Endpoint: 0x01, Direction: OUT
    URB transfer type: URB_BULK (0x03)
    Packet Data Length: 74636
    [Response in: 5120]
    [bInterfaceClass: Unknown (0xffff)]
Leftover Capture Data […]: 0000000000f23895dfff0080ffff0080ffff0080ffff0080ffff0080ffff0080ffff0080ffff0080ffff0080ffff0080ffff0080ffff0080ffff0080ffff0080ffec54a087000000000000000000000000000000000000000000000000000000000000000000000000

No.     Time           Source                Destination           Protocol Length Info
   5120 14.830890      2.10.1                host                  USB      27     URB_BULK out

Frame 5120: Packet, 27 bytes on wire (216 bits), 27 bytes captured (216 bits) on interface \\.\USBPcap2, id 0
USB URB
    [Source: 2.10.1]
    [Destination: host]
    USBPcap pseudoheader length: 27
    IRP ID: 0xffffb50bc6bdc010
    IRP USBD_STATUS: USBD_STATUS_SUCCESS (0x00000000)
    URB Function: URB_FUNCTION_BULK_OR_INTERRUPT_TRANSFER (0x0009)
    IRP information: 0x01, Direction: PDO -> FDO
    URB bus id: 2
    Device address: 10
    Endpoint: 0x01, Direction: OUT
    URB transfer type: URB_BULK (0x03)
    Packet Data Length: 0
    [Request in: 5103]
    [Time from request: 46.547000 milliseconds]
    [bInterfaceClass: Unknown (0xffff)]

No.     Time           Source                Destination           Protocol Length Info
   5121 14.830943      host                  2.10.1                USB      56277  URB_BULK out

Frame 5121: Packet, 56277 bytes on wire (450216 bits), 56277 bytes captured (450216 bits) on interface \\.\USBPcap2, id 0
USB URB
    [Source: host]
    [Destination: 2.10.1]
    USBPcap pseudoheader length: 27
    IRP ID: 0xffffb50bc6bdc010
    IRP USBD_STATUS: USBD_STATUS_SUCCESS (0x00000000)
    URB Function: URB_FUNCTION_BULK_OR_INTERRUPT_TRANSFER (0x0009)
    IRP information: 0x00, Direction: FDO -> PDO
    URB bus id: 2
    Device address: 10
    Endpoint: 0x01, Direction: OUT
    URB transfer type: URB_BULK (0x03)
    Packet Data Length: 56250
    [Response in: 5134]
    [bInterfaceClass: Unknown (0xffff)]
Leftover Capture Data […]: 000000000000000000000000000000000000000000000000000000000000000000000000000000000000000000000000000000000000000000000000000000000000000000000000000000000000000000000000000000000000000000000000000000000000000000

No.     Time           Source                Destination           Protocol Length Info
   5134 14.866860      2.10.1                host                  USB      27     URB_BULK out

Frame 5134: Packet, 27 bytes on wire (216 bits), 27 bytes captured (216 bits) on interface \\.\USBPcap2, id 0
USB URB
    [Source: 2.10.1]
    [Destination: host]
    USBPcap pseudoheader length: 27
    IRP ID: 0xffffb50bc6bdc010
    IRP USBD_STATUS: USBD_STATUS_SUCCESS (0x00000000)
    URB Function: URB_FUNCTION_BULK_OR_INTERRUPT_TRANSFER (0x0009)
    IRP information: 0x01, Direction: PDO -> FDO
    URB bus id: 2
    Device address: 10
    Endpoint: 0x01, Direction: OUT
    URB transfer type: URB_BULK (0x03)
    Packet Data Length: 0
    [Request in: 5121]
    [Time from request: 35.917000 milliseconds]
    [bInterfaceClass: Unknown (0xffff)]

No.     Time           Source                Destination           Protocol Length Info
   5135 14.866912      host                  2.10.1                USB      213    URB_BULK out

Frame 5135: Packet, 213 bytes on wire (1704 bits), 213 bytes captured (1704 bits) on interface \\.\USBPcap2, id 0
USB URB
    [Source: host]
    [Destination: 2.10.1]
    USBPcap pseudoheader length: 27
    IRP ID: 0xffffb50bc6bdc010
    IRP USBD_STATUS: USBD_STATUS_SUCCESS (0x00000000)
    URB Function: URB_FUNCTION_BULK_OR_INTERRUPT_TRANSFER (0x0009)
    IRP information: 0x00, Direction: FDO -> PDO
    URB bus id: 2
    Device address: 10
    Endpoint: 0x01, Direction: OUT
    URB transfer type: URB_BULK (0x03)
    Packet Data Length: 186
    [Response in: 5136]
    [bInterfaceClass: Unknown (0xffff)]
Leftover Capture Data […]: 000000000000000000000000000000000000000000000000000000000000000000000000000000000000000000000000000000000000000000000000000000000000000000000000000000000000000000000000000000000000000000000000000000000000000000

No.     Time           Source                Destination           Protocol Length Info
   5136 14.866936      2.10.1                host                  USB      27     URB_BULK out

Frame 5136: Packet, 27 bytes on wire (216 bits), 27 bytes captured (216 bits) on interface \\.\USBPcap2, id 0
USB URB
    [Source: 2.10.1]
    [Destination: host]
    USBPcap pseudoheader length: 27
    IRP ID: 0xffffb50bc6bdc010
    IRP USBD_STATUS: USBD_STATUS_SUCCESS (0x00000000)
    URB Function: URB_FUNCTION_BULK_OR_INTERRUPT_TRANSFER (0x0009)
    IRP information: 0x01, Direction: PDO -> FDO
    URB bus id: 2
    Device address: 10
    Endpoint: 0x01, Direction: OUT
    URB transfer type: URB_BULK (0x03)
    Packet Data Length: 0
    [Request in: 5135]
    [Time from request: 24.000 microseconds]
    [bInterfaceClass: Unknown (0xffff)]

No.     Time           Source                Destination           Protocol Length Info
   5137 14.866964      host                  2.10.1                USB      101841 URB_BULK out

Frame 5137: Packet, 101841 bytes on wire (814728 bits), 65535 bytes captured (524280 bits) on interface \\.\USBPcap2, id 0
USB URB
    [Source: host]
    [Destination: 2.10.1]
    USBPcap pseudoheader length: 27
    IRP ID: 0xffffb50bc6bdc010
    IRP USBD_STATUS: USBD_STATUS_SUCCESS (0x00000000)
    URB Function: URB_FUNCTION_BULK_OR_INTERRUPT_TRANSFER (0x0009)
    IRP information: 0x00, Direction: FDO -> PDO
    URB bus id: 2
    Device address: 10
    Endpoint: 0x01, Direction: OUT
    URB transfer type: URB_BULK (0x03)
    Packet Data Length: 101814
    [Response in: 5162]
    [bInterfaceClass: Unknown (0xffff)]
Leftover Capture Data […]: 000000000000000000000000000000000000000000000000000000000000000000000000000000000000000000000000000000000000000000000000000000000000000000000000000000000000000000000000000000000000000000000000000000000000000000

No.     Time           Source                Destination           Protocol Length Info
   5162 14.939144      2.10.1                host                  USB      27     URB_BULK out

Frame 5162: Packet, 27 bytes on wire (216 bits), 27 bytes captured (216 bits) on interface \\.\USBPcap2, id 0
USB URB
    [Source: 2.10.1]
    [Destination: host]
    USBPcap pseudoheader length: 27
    IRP ID: 0xffffb50bc6bdc010
    IRP USBD_STATUS: USBD_STATUS_SUCCESS (0x00000000)
    URB Function: URB_FUNCTION_BULK_OR_INTERRUPT_TRANSFER (0x0009)
    IRP information: 0x01, Direction: PDO -> FDO
    URB bus id: 2
    Device address: 10
    Endpoint: 0x01, Direction: OUT
    URB transfer type: URB_BULK (0x03)
    Packet Data Length: 0
    [Request in: 5137]
    [Time from request: 72.180000 milliseconds]
    [bInterfaceClass: Unknown (0xffff)]

No.     Time           Source                Destination           Protocol Length Info
   5163 14.939208      host                  2.10.1                USB      29277  URB_BULK out

Frame 5163: Packet, 29277 bytes on wire (234216 bits), 29277 bytes captured (234216 bits) on interface \\.\USBPcap2, id 0
USB URB
    [Source: host]
    [Destination: 2.10.1]
    USBPcap pseudoheader length: 27
    IRP ID: 0xffffb50bc6bdc010
    IRP USBD_STATUS: USBD_STATUS_SUCCESS (0x00000000)
    URB Function: URB_FUNCTION_BULK_OR_INTERRUPT_TRANSFER (0x0009)
    IRP information: 0x00, Direction: FDO -> PDO
    URB bus id: 2
    Device address: 10
    Endpoint: 0x01, Direction: OUT
    URB transfer type: URB_BULK (0x03)
    Packet Data Length: 29250
    [Response in: 5168]
    [bInterfaceClass: Unknown (0xffff)]
Leftover Capture Data […]: 000000000000000000000000000000000000000000000000000000000000000000000000000000000000000000000000000000000000000000000000000000000000000000000000000000000000000000000000000000000000000000000000000000000000000000

No.     Time           Source                Destination           Protocol Length Info
   5168 14.953580      2.10.1                host                  USB      27     URB_BULK out

Frame 5168: Packet, 27 bytes on wire (216 bits), 27 bytes captured (216 bits) on interface \\.\USBPcap2, id 0
USB URB
    [Source: 2.10.1]
    [Destination: host]
    USBPcap pseudoheader length: 27
    IRP ID: 0xffffb50bc6bdc010
    IRP USBD_STATUS: USBD_STATUS_SUCCESS (0x00000000)
    URB Function: URB_FUNCTION_BULK_OR_INTERRUPT_TRANSFER (0x0009)
    IRP information: 0x01, Direction: PDO -> FDO
    URB bus id: 2
    Device address: 10
    Endpoint: 0x01, Direction: OUT
    URB transfer type: URB_BULK (0x03)
    Packet Data Length: 0
    [Request in: 5163]
    [Time from request: 14.372000 milliseconds]
    [bInterfaceClass: Unknown (0xffff)]

No.     Time           Source                Destination           Protocol Length Info
   5169 14.953610      host                  2.10.1                USB      35     URB_BULK out

Frame 5169: Packet, 35 bytes on wire (280 bits), 35 bytes captured (280 bits) on interface \\.\USBPcap2, id 0
USB URB
    [Source: host]
    [Destination: 2.10.1]
    USBPcap pseudoheader length: 27
    IRP ID: 0xffffb50bc6bdc010
    IRP USBD_STATUS: USBD_STATUS_SUCCESS (0x00000000)
    URB Function: URB_FUNCTION_BULK_OR_INTERRUPT_TRANSFER (0x0009)
    IRP information: 0x00, Direction: FDO -> PDO
    URB bus id: 2
    Device address: 10
    Endpoint: 0x01, Direction: OUT
    URB transfer type: URB_BULK (0x03)
    Packet Data Length: 8
    [Response in: 5170]
    [bInterfaceClass: Unknown (0xffff)]
Leftover Capture Data: 0000000000000000

No.     Time           Source                Destination           Protocol Length Info
   5170 14.953631      2.10.1                host                  USB      27     URB_BULK out

Frame 5170: Packet, 27 bytes on wire (216 bits), 27 bytes captured (216 bits) on interface \\.\USBPcap2, id 0
USB URB
    [Source: 2.10.1]
    [Destination: host]
    USBPcap pseudoheader length: 27
    IRP ID: 0xffffb50bc6bdc010
    IRP USBD_STATUS: USBD_STATUS_SUCCESS (0x00000000)
    URB Function: URB_FUNCTION_BULK_OR_INTERRUPT_TRANSFER (0x0009)
    IRP information: 0x01, Direction: PDO -> FDO
    URB bus id: 2
    Device address: 10
    Endpoint: 0x01, Direction: OUT
    URB transfer type: URB_BULK (0x03)
    Packet Data Length: 0
    [Request in: 5169]
    [Time from request: 21.000 microseconds]
    [bInterfaceClass: Unknown (0xffff)]

No.     Time           Source                Destination           Protocol Length Info
   5171 14.953652      host                  2.10.1                USB      36019  URB_BULK out

Frame 5171: Packet, 36019 bytes on wire (288152 bits), 36019 bytes captured (288152 bits) on interface \\.\USBPcap2, id 0
USB URB
    [Source: host]
    [Destination: 2.10.1]
    USBPcap pseudoheader length: 27
    IRP ID: 0xffffb50bc6bdc010
    IRP USBD_STATUS: USBD_STATUS_SUCCESS (0x00000000)
    URB Function: URB_FUNCTION_BULK_OR_INTERRUPT_TRANSFER (0x0009)
    IRP information: 0x00, Direction: FDO -> PDO
    URB bus id: 2
    Device address: 10
    Endpoint: 0x01, Direction: OUT
    URB transfer type: URB_BULK (0x03)
    Packet Data Length: 35992
    [Response in: 5180]
    [bInterfaceClass: Unknown (0xffff)]
Leftover Capture Data […]: 000000000000000000000000000000000000000000000000000000000000000000000000000000000000000000000000000000000000000000000000000000000000000000000000000000000000000000000000000000000000000000000000000000000000000000

No.     Time           Source                Destination           Protocol Length Info
   5180 14.979830      2.10.1                host                  USB      27     URB_BULK out

Frame 5180: Packet, 27 bytes on wire (216 bits), 27 bytes captured (216 bits) on interface \\.\USBPcap2, id 0
USB URB
    [Source: 2.10.1]
    [Destination: host]
    USBPcap pseudoheader length: 27
    IRP ID: 0xffffb50bc6bdc010
    IRP USBD_STATUS: USBD_STATUS_SUCCESS (0x00000000)
    URB Function: URB_FUNCTION_BULK_OR_INTERRUPT_TRANSFER (0x0009)
    IRP information: 0x01, Direction: PDO -> FDO
    URB bus id: 2
    Device address: 10
    Endpoint: 0x01, Direction: OUT
    URB transfer type: URB_BULK (0x03)
    Packet Data Length: 0
    [Request in: 5171]
    [Time from request: 26.178000 milliseconds]
    [bInterfaceClass: Unknown (0xffff)]

No.     Time           Source                Destination           Protocol Length Info
   5193 15.016403      host                  2.10.1                USB      277    URB_BULK out

Frame 5193: Packet, 277 bytes on wire (2216 bits), 277 bytes captured (2216 bits) on interface \\.\USBPcap2, id 0
USB URB
    [Source: host]
    [Destination: 2.10.1]
    USBPcap pseudoheader length: 27
    IRP ID: 0xffffb50bc6c0a010
    IRP USBD_STATUS: USBD_STATUS_SUCCESS (0x00000000)
    URB Function: URB_FUNCTION_BULK_OR_INTERRUPT_TRANSFER (0x0009)
    IRP information: 0x00, Direction: FDO -> PDO
    URB bus id: 2
    Device address: 10
    Endpoint: 0x01, Direction: OUT
    URB transfer type: URB_BULK (0x03)
    Packet Data Length: 250
    [Response in: 5194]
    [bInterfaceClass: Unknown (0xffff)]
Leftover Capture Data […]: cfef69000000010000000000000000000000000000000000000000000000000000000000000000000000000000000000000000000000000000000000000000000000000000000000000000000000000000000000000000000000000000000000000000000000000000

No.     Time           Source                Destination           Protocol Length Info
   5194 15.016469      2.10.1                host                  USB      27     URB_BULK out

Frame 5194: Packet, 27 bytes on wire (216 bits), 27 bytes captured (216 bits) on interface \\.\USBPcap2, id 0
USB URB
    [Source: 2.10.1]
    [Destination: host]
    USBPcap pseudoheader length: 27
    IRP ID: 0xffffb50bc6c0a010
    IRP USBD_STATUS: USBD_STATUS_SUCCESS (0x00000000)
    URB Function: URB_FUNCTION_BULK_OR_INTERRUPT_TRANSFER (0x0009)
    IRP information: 0x01, Direction: PDO -> FDO
    URB bus id: 2
    Device address: 10
    Endpoint: 0x01, Direction: OUT
    URB transfer type: URB_BULK (0x03)
    Packet Data Length: 0
    [Request in: 5193]
    [Time from request: 66.000 microseconds]
    [bInterfaceClass: Unknown (0xffff)]

No.     Time           Source                Destination           Protocol Length Info
   5207 15.039217      host                  2.10.1                USB      3777   URB_BULK out

Frame 5207: Packet, 3777 bytes on wire (30216 bits), 3777 bytes captured (30216 bits) on interface \\.\USBPcap2, id 0
USB URB
    [Source: host]
    [Destination: 2.10.1]
    USBPcap pseudoheader length: 27
    IRP ID: 0xffffb50bc6c08010
    IRP USBD_STATUS: USBD_STATUS_SUCCESS (0x00000000)
    URB Function: URB_FUNCTION_BULK_OR_INTERRUPT_TRANSFER (0x0009)
    IRP information: 0x00, Direction: FDO -> PDO
    URB bus id: 2
    Device address: 10
    Endpoint: 0x01, Direction: OUT
    URB transfer type: URB_BULK (0x03)
    Packet Data Length: 3750
    [Response in: 5208]
    [bInterfaceClass: Unknown (0xffff)]
Leftover Capture Data […]: ccef69000068bc00000000000000000021f7000000000000000000000000000000000000000000000000000000000000000000000000000000000000000000000000000000000000000000000000000000000000000000000000000000000000000000000000000000

No.     Time           Source                Destination           Protocol Length Info
   5208 15.039640      2.10.1                host                  USB      27     URB_BULK out

Frame 5208: Packet, 27 bytes on wire (216 bits), 27 bytes captured (216 bits) on interface \\.\USBPcap2, id 0
USB URB
    [Source: 2.10.1]
    [Destination: host]
    USBPcap pseudoheader length: 27
    IRP ID: 0xffffb50bc6c08010
    IRP USBD_STATUS: USBD_STATUS_SUCCESS (0x00000000)
    URB Function: URB_FUNCTION_BULK_OR_INTERRUPT_TRANSFER (0x0009)
    IRP information: 0x01, Direction: PDO -> FDO
    URB bus id: 2
    Device address: 10
    Endpoint: 0x01, Direction: OUT
    URB transfer type: URB_BULK (0x03)
    Packet Data Length: 0
    [Request in: 5207]
    [Time from request: 423.000 microseconds]
    [bInterfaceClass: Unknown (0xffff)]

No.     Time           Source                Destination           Protocol Length Info
   5209 15.039675      host                  2.10.1                USB      23527  URB_BULK out

Frame 5209: Packet, 23527 bytes on wire (188216 bits), 23527 bytes captured (188216 bits) on interface \\.\USBPcap2, id 0
USB URB
    [Source: host]
    [Destination: 2.10.1]
    USBPcap pseudoheader length: 27
    IRP ID: 0xffffb50bc6c08010
    IRP USBD_STATUS: USBD_STATUS_SUCCESS (0x00000000)
    URB Function: URB_FUNCTION_BULK_OR_INTERRUPT_TRANSFER (0x0009)
    IRP information: 0x00, Direction: FDO -> PDO
    URB bus id: 2
    Device address: 10
    Endpoint: 0x01, Direction: OUT
    URB transfer type: URB_BULK (0x03)
    Packet Data Length: 23500
    [Response in: 5218]
    [bInterfaceClass: Unknown (0xffff)]
Leftover Capture Data […]: ffffffffffff0165430004000000000000000000fefefe0165500004fffffffffffffffffffcffff0165850006000000000000000000000000000000fdfdfe01658c0004fefefefcfcff0000000000000165a80002fcfdfeffffff0165b60003fffdfe000000000000

No.     Time           Source                Destination           Protocol Length Info
   5218 15.061333      2.10.1                host                  USB      27     URB_BULK out

Frame 5218: Packet, 27 bytes on wire (216 bits), 27 bytes captured (216 bits) on interface \\.\USBPcap2, id 0
USB URB
    [Source: 2.10.1]
    [Destination: host]
    USBPcap pseudoheader length: 27
    IRP ID: 0xffffb50bc6c08010
    IRP USBD_STATUS: USBD_STATUS_SUCCESS (0x00000000)
    URB Function: URB_FUNCTION_BULK_OR_INTERRUPT_TRANSFER (0x0009)
    IRP information: 0x01, Direction: PDO -> FDO
    URB bus id: 2
    Device address: 10
    Endpoint: 0x01, Direction: OUT
    URB transfer type: URB_BULK (0x03)
    Packet Data Length: 0
    [Request in: 5209]
    [Time from request: 21.658000 milliseconds]
    [bInterfaceClass: Unknown (0xffff)]

No.     Time           Source                Destination           Protocol Length Info
   5539 16.027530      host                  2.10.1                USB      277    URB_BULK out

Frame 5539: Packet, 277 bytes on wire (2216 bits), 277 bytes captured (2216 bits) on interface \\.\USBPcap2, id 0
USB URB
    [Source: host]
    [Destination: 2.10.1]
    USBPcap pseudoheader length: 27
    IRP ID: 0xffffb50bc6c08010
    IRP USBD_STATUS: USBD_STATUS_SUCCESS (0x00000000)
    URB Function: URB_FUNCTION_BULK_OR_INTERRUPT_TRANSFER (0x0009)
    IRP information: 0x00, Direction: FDO -> PDO
    URB bus id: 2
    Device address: 10
    Endpoint: 0x01, Direction: OUT
    URB transfer type: URB_BULK (0x03)
    Packet Data Length: 250
    [Response in: 5540]
    [bInterfaceClass: Unknown (0xffff)]
Leftover Capture Data […]: cfef69000000010000000000000000000000000000000000000000000000000000000000000000000000000000000000000000000000000000000000000000000000000000000000000000000000000000000000000000000000000000000000000000000000000000

No.     Time           Source                Destination           Protocol Length Info
   5540 16.027568      2.10.1                host                  USB      27     URB_BULK out

Frame 5540: Packet, 27 bytes on wire (216 bits), 27 bytes captured (216 bits) on interface \\.\USBPcap2, id 0
USB URB
    [Source: 2.10.1]
    [Destination: host]
    USBPcap pseudoheader length: 27
    IRP ID: 0xffffb50bc6c08010
    IRP USBD_STATUS: USBD_STATUS_SUCCESS (0x00000000)
    URB Function: URB_FUNCTION_BULK_OR_INTERRUPT_TRANSFER (0x0009)
    IRP information: 0x01, Direction: PDO -> FDO
    URB bus id: 2
    Device address: 10
    Endpoint: 0x01, Direction: OUT
    URB transfer type: URB_BULK (0x03)
    Packet Data Length: 0
    [Request in: 5539]
    [Time from request: 38.000 microseconds]
    [bInterfaceClass: Unknown (0xffff)]

No.     Time           Source                Destination           Protocol Length Info
   5547 16.031903      host                  2.10.1                USB      3527   URB_BULK out

Frame 5547: Packet, 3527 bytes on wire (28216 bits), 3527 bytes captured (28216 bits) on interface \\.\USBPcap2, id 0
USB URB
    [Source: host]
    [Destination: 2.10.1]
    USBPcap pseudoheader length: 27
    IRP ID: 0xffffb50bc6c0a010
    IRP USBD_STATUS: USBD_STATUS_SUCCESS (0x00000000)
    URB Function: URB_FUNCTION_BULK_OR_INTERRUPT_TRANSFER (0x0009)
    IRP information: 0x00, Direction: FDO -> PDO
    URB bus id: 2
    Device address: 10
    Endpoint: 0x01, Direction: OUT
    URB transfer type: URB_BULK (0x03)
    Packet Data Length: 3500
    [Response in: 5548]
    [bInterfaceClass: Unknown (0xffff)]
Leftover Capture Data […]: ccef69000021ff00000000000001000021f7000000000000000000000000000000000000000000000000000000000000000000000000000000000000000000000000000000000000000000000000000000000000000000000000000000000000000000000000000000

No.     Time           Source                Destination           Protocol Length Info
   5548 16.032612      2.10.1                host                  USB      27     URB_BULK out

Frame 5548: Packet, 27 bytes on wire (216 bits), 27 bytes captured (216 bits) on interface \\.\USBPcap2, id 0
USB URB
    [Source: 2.10.1]
    [Destination: host]
    USBPcap pseudoheader length: 27
    IRP ID: 0xffffb50bc6c0a010
    IRP USBD_STATUS: USBD_STATUS_SUCCESS (0x00000000)
    URB Function: URB_FUNCTION_BULK_OR_INTERRUPT_TRANSFER (0x0009)
    IRP information: 0x01, Direction: PDO -> FDO
    URB bus id: 2
    Device address: 10
    Endpoint: 0x01, Direction: OUT
    URB transfer type: URB_BULK (0x03)
    Packet Data Length: 0
    [Request in: 5547]
    [Time from request: 709.000 microseconds]
    [bInterfaceClass: Unknown (0xffff)]

No.     Time           Source                Destination           Protocol Length Info
   5549 16.032637      host                  2.10.1                USB      5527   URB_BULK out

Frame 5549: Packet, 5527 bytes on wire (44216 bits), 5527 bytes captured (44216 bits) on interface \\.\USBPcap2, id 0
USB URB
    [Source: host]
    [Destination: 2.10.1]
    USBPcap pseudoheader length: 27
    IRP ID: 0xffffb50bc6c0a010
    IRP USBD_STATUS: USBD_STATUS_SUCCESS (0x00000000)
    URB Function: URB_FUNCTION_BULK_OR_INTERRUPT_TRANSFER (0x0009)
    IRP information: 0x00, Direction: FDO -> PDO
    URB bus id: 2
    Device address: 10
    Endpoint: 0x01, Direction: OUT
    URB transfer type: URB_BULK (0x03)
    Packet Data Length: 5500
    [Response in: 5550]
    [bInterfaceClass: Unknown (0xffff)]
Leftover Capture Data […]: a19c001801a1ea001001a203000501a239000501a246001001a2ac000f01a2e5000d01a347000f01a381001401a3ca001001a3e1000501a41a000401a426001001a48b000f01a4c5000d01a528000e01a564001201a5ab001001a5bf000501a5f9000501a606001001

No.     Time           Source                Destination           Protocol Length Info
   5550 16.032999      2.10.1                host                  USB      27     URB_BULK out

Frame 5550: Packet, 27 bytes on wire (216 bits), 27 bytes captured (216 bits) on interface \\.\USBPcap2, id 0
USB URB
    [Source: 2.10.1]
    [Destination: host]
    USBPcap pseudoheader length: 27
    IRP ID: 0xffffb50bc6c0a010
    IRP USBD_STATUS: USBD_STATUS_SUCCESS (0x00000000)
    URB Function: URB_FUNCTION_BULK_OR_INTERRUPT_TRANSFER (0x0009)
    IRP information: 0x01, Direction: PDO -> FDO
    URB bus id: 2
    Device address: 10
    Endpoint: 0x01, Direction: OUT
    URB transfer type: URB_BULK (0x03)
    Packet Data Length: 0
    [Request in: 5549]
    [Time from request: 362.000 microseconds]
    [bInterfaceClass: Unknown (0xffff)]

No.     Time           Source                Destination           Protocol Length Info
   5883 17.027839      host                  2.10.1                USB      277    URB_BULK out

Frame 5883: Packet, 277 bytes on wire (2216 bits), 277 bytes captured (2216 bits) on interface \\.\USBPcap2, id 0
USB URB
    [Source: host]
    [Destination: 2.10.1]
    USBPcap pseudoheader length: 27
    IRP ID: 0xffffb50bc6bdc010
    IRP USBD_STATUS: USBD_STATUS_SUCCESS (0x00000000)
    URB Function: URB_FUNCTION_BULK_OR_INTERRUPT_TRANSFER (0x0009)
    IRP information: 0x00, Direction: FDO -> PDO
    URB bus id: 2
    Device address: 10
    Endpoint: 0x01, Direction: OUT
    URB transfer type: URB_BULK (0x03)
    Packet Data Length: 250
    [Response in: 5884]
    [bInterfaceClass: Unknown (0xffff)]
Leftover Capture Data […]: cfef69000000010000000000000000000000000000000000000000000000000000000000000000000000000000000000000000000000000000000000000000000000000000000000000000000000000000000000000000000000000000000000000000000000000000

No.     Time           Source                Destination           Protocol Length Info
   5884 17.027897      2.10.1                host                  USB      27     URB_BULK out

Frame 5884: Packet, 27 bytes on wire (216 bits), 27 bytes captured (216 bits) on interface \\.\USBPcap2, id 0
USB URB
    [Source: 2.10.1]
    [Destination: host]
    USBPcap pseudoheader length: 27
    IRP ID: 0xffffb50bc6bdc010
    IRP USBD_STATUS: USBD_STATUS_SUCCESS (0x00000000)
    URB Function: URB_FUNCTION_BULK_OR_INTERRUPT_TRANSFER (0x0009)
    IRP information: 0x01, Direction: PDO -> FDO
    URB bus id: 2
    Device address: 10
    Endpoint: 0x01, Direction: OUT
    URB transfer type: URB_BULK (0x03)
    Packet Data Length: 0
    [Request in: 5883]
    [Time from request: 58.000 microseconds]
    [bInterfaceClass: Unknown (0xffff)]

No.     Time           Source                Destination           Protocol Length Info
   5887 17.032120      host                  2.10.1                USB      2527   URB_BULK out

Frame 5887: Packet, 2527 bytes on wire (20216 bits), 2527 bytes captured (20216 bits) on interface \\.\USBPcap2, id 0
USB URB
    [Source: host]
    [Destination: 2.10.1]
    USBPcap pseudoheader length: 27
    IRP ID: 0xffffb50bc6c08010
    IRP USBD_STATUS: USBD_STATUS_SUCCESS (0x00000000)
    URB Function: URB_FUNCTION_BULK_OR_INTERRUPT_TRANSFER (0x0009)
    IRP information: 0x00, Direction: FDO -> PDO
    URB bus id: 2
    Device address: 10
    Endpoint: 0x01, Direction: OUT
    URB transfer type: URB_BULK (0x03)
    Packet Data Length: 2500
    [Response in: 5888]
    [bInterfaceClass: Unknown (0xffff)]
Leftover Capture Data […]: ccef690000284600000000000002000021f7000000000000000000000000000000000000000000000000000000000000000000000000000000000000000000000000000000000000000000000000000000000000000000000000000000000000000000000000000000

No.     Time           Source                Destination           Protocol Length Info
   5888 17.032522      2.10.1                host                  USB      27     URB_BULK out

Frame 5888: Packet, 27 bytes on wire (216 bits), 27 bytes captured (216 bits) on interface \\.\USBPcap2, id 0
USB URB
    [Source: 2.10.1]
    [Destination: host]
    USBPcap pseudoheader length: 27
    IRP ID: 0xffffb50bc6c08010
    IRP USBD_STATUS: USBD_STATUS_SUCCESS (0x00000000)
    URB Function: URB_FUNCTION_BULK_OR_INTERRUPT_TRANSFER (0x0009)
    IRP information: 0x01, Direction: PDO -> FDO
    URB bus id: 2
    Device address: 10
    Endpoint: 0x01, Direction: OUT
    URB transfer type: URB_BULK (0x03)
    Packet Data Length: 0
    [Request in: 5887]
    [Time from request: 402.000 microseconds]
    [bInterfaceClass: Unknown (0xffff)]

No.     Time           Source                Destination           Protocol Length Info
   5889 17.032547      host                  2.10.1                USB      8277   URB_BULK out

Frame 5889: Packet, 8277 bytes on wire (66216 bits), 8277 bytes captured (66216 bits) on interface \\.\USBPcap2, id 0
USB URB
    [Source: host]
    [Destination: 2.10.1]
    USBPcap pseudoheader length: 27
    IRP ID: 0xffffb50bc6c08010
    IRP USBD_STATUS: USBD_STATUS_SUCCESS (0x00000000)
    URB Function: URB_FUNCTION_BULK_OR_INTERRUPT_TRANSFER (0x0009)
    IRP information: 0x00, Direction: FDO -> PDO
    URB bus id: 2
    Device address: 10
    Endpoint: 0x01, Direction: OUT
    URB transfer type: URB_BULK (0x03)
    Packet Data Length: 8250
    [Response in: 5890]
    [bInterfaceClass: Unknown (0xffff)]
Leftover Capture Data […]: 0002007a5f0002007a620002007a6f0028007b090028007b410003007b490003007c360002007c3f0002007c420002007c4d0027007cec0027007d220002007d280003007e160003007e1e0003007e2b0026007ecf0026007f020003007f070004007ff60004007ffd

No.     Time           Source                Destination           Protocol Length Info
   5890 17.033419      2.10.1                host                  USB      27     URB_BULK out

Frame 5890: Packet, 27 bytes on wire (216 bits), 27 bytes captured (216 bits) on interface \\.\USBPcap2, id 0
USB URB
    [Source: 2.10.1]
    [Destination: host]
    USBPcap pseudoheader length: 27
    IRP ID: 0xffffb50bc6c08010
    IRP USBD_STATUS: USBD_STATUS_SUCCESS (0x00000000)
    URB Function: URB_FUNCTION_BULK_OR_INTERRUPT_TRANSFER (0x0009)
    IRP information: 0x01, Direction: PDO -> FDO
    URB bus id: 2
    Device address: 10
    Endpoint: 0x01, Direction: OUT
    URB transfer type: URB_BULK (0x03)
    Packet Data Length: 0
    [Request in: 5889]
    [Time from request: 872.000 microseconds]
    [bInterfaceClass: Unknown (0xffff)]

No.     Time           Source                Destination           Protocol Length Info
   6163 17.850733      host                  2.10.1                USB      277    URB_BULK out

Frame 6163: Packet, 277 bytes on wire (2216 bits), 277 bytes captured (2216 bits) on interface \\.\USBPcap2, id 0
USB URB
    [Source: host]
    [Destination: 2.10.1]
    USBPcap pseudoheader length: 27
    IRP ID: 0xffffb50bc6c08010
    IRP USBD_STATUS: USBD_STATUS_SUCCESS (0x00000000)
    URB Function: URB_FUNCTION_BULK_OR_INTERRUPT_TRANSFER (0x0009)
    IRP information: 0x00, Direction: FDO -> PDO
    URB bus id: 2
    Device address: 10
    Endpoint: 0x01, Direction: OUT
    URB transfer type: URB_BULK (0x03)
    Packet Data Length: 250
    [Response in: 6164]
    [bInterfaceClass: Unknown (0xffff)]
Leftover Capture Data […]: 87ef69000000010000000000000000000000000000000000000000000000000000000000000000000000000000000000000000000000000000000000000000000000000000000000000000000000000000000000000000000000000000000000000000000000000000

No.     Time           Source                Destination           Protocol Length Info
   6164 17.850768      2.10.1                host                  USB      27     URB_BULK out

Frame 6164: Packet, 27 bytes on wire (216 bits), 27 bytes captured (216 bits) on interface \\.\USBPcap2, id 0
USB URB
    [Source: 2.10.1]
    [Destination: host]
    USBPcap pseudoheader length: 27
    IRP ID: 0xffffb50bc6c08010
    IRP USBD_STATUS: USBD_STATUS_SUCCESS (0x00000000)
    URB Function: URB_FUNCTION_BULK_OR_INTERRUPT_TRANSFER (0x0009)
    IRP information: 0x01, Direction: PDO -> FDO
    URB bus id: 2
    Device address: 10
    Endpoint: 0x01, Direction: OUT
    URB transfer type: URB_BULK (0x03)
    Packet Data Length: 0
    [Request in: 6163]
    [Time from request: 35.000 microseconds]
    [bInterfaceClass: Unknown (0xffff)]
