No.     Time           Source                Destination           Protocol Length Info
     43 0.000000       host                  2.21.0                USB      36     GET DESCRIPTOR Request DEVICE

Frame 43: Packet, 36 bytes on wire (288 bits), 36 bytes captured (288 bits) on interface \\.\USBPcap2, id 0
USB URB
    [Source: host]
    [Destination: 2.21.0]
    USBPcap pseudoheader length: 28
    IRP ID: 0x0000000000000000
    IRP USBD_STATUS: USBD_STATUS_SUCCESS (0x00000000)
    URB Function: URB_FUNCTION_GET_DESCRIPTOR_FROM_DEVICE (0x000b)
    IRP information: 0x00, Direction: FDO -> PDO
    URB bus id: 2
    Device address: 21
    Endpoint: 0x80, Direction: IN
    URB transfer type: URB_CONTROL (0x02)
    Packet Data Length: 8
    [Response in: 44]
    Control transfer stage: Setup (0)
Setup Data

0000  1c 00 00 00 00 00 00 00 00 00 00 00 00 00 0b 00   ................
0010  00 02 00 15 00 80 02 08 00 00 00 00 80 06 00 01   ................
0020  00 00 12 00                                       ....

No.     Time           Source                Destination           Protocol Length Info
     44 0.000000       2.21.0                host                  USB      46     GET DESCRIPTOR Response DEVICE

Frame 44: Packet, 46 bytes on wire (368 bits), 46 bytes captured (368 bits) on interface \\.\USBPcap2, id 0
USB URB
    [Source: 2.21.0]
    [Destination: host]
    USBPcap pseudoheader length: 28
    IRP ID: 0x0000000000000000
    IRP USBD_STATUS: USBD_STATUS_SUCCESS (0x00000000)
    URB Function: URB_FUNCTION_CONTROL_TRANSFER (0x0008)
    IRP information: 0x01, Direction: PDO -> FDO
    URB bus id: 2
    Device address: 21
    Endpoint: 0x80, Direction: IN
    URB transfer type: URB_CONTROL (0x02)
    Packet Data Length: 18
    [Request in: 43]
    [Time from request: 0.000000000 seconds]
    Control transfer stage: Complete (3)
DEVICE DESCRIPTOR
    bLength: 18
    bDescriptorType: 0x01 (DEVICE)
    bcdUSB: 0x0200
    bDeviceClass: Communications and CDC Control (0x02)
    bDeviceSubClass: 0
    bDeviceProtocol: 0
    bMaxPacketSize0: 64
    idVendor: QinHeng Electronics (0x1a86)
    idProduct: Unknown (0xca21)
    bcdDevice: 0x0100
    iManufacturer: 1
    iProduct: 2
    iSerialNumber: 3
    bNumConfigurations: 1

0000  1c 00 00 00 00 00 00 00 00 00 00 00 00 00 08 00   ................
0010  01 02 00 15 00 80 02 12 00 00 00 03 12 01 00 02   ................
0020  02 00 00 40 86 1a 21 ca 00 01 01 02 03 01         ...@..!.......

No.     Time           Source                Destination           Protocol Length Info
     45 0.000000       host                  2.21.0                USB      36     GET DESCRIPTOR Request CONFIGURATION

Frame 45: Packet, 36 bytes on wire (288 bits), 36 bytes captured (288 bits) on interface \\.\USBPcap2, id 0
USB URB
    [Source: host]
    [Destination: 2.21.0]
    USBPcap pseudoheader length: 28
    IRP ID: 0x0000000000000000
    IRP USBD_STATUS: USBD_STATUS_SUCCESS (0x00000000)
    URB Function: URB_FUNCTION_GET_DESCRIPTOR_FROM_DEVICE (0x000b)
    IRP information: 0x00, Direction: FDO -> PDO
    URB bus id: 2
    Device address: 21
    Endpoint: 0x80, Direction: IN
    URB transfer type: URB_CONTROL (0x02)
    Packet Data Length: 8
    [Response in: 46]
    Control transfer stage: Setup (0)
Setup Data

0000  1c 00 00 00 00 00 00 00 00 00 00 00 00 00 0b 00   ................
0010  00 02 00 15 00 80 02 08 00 00 00 00 80 06 00 02   ................
0020  00 00 43 00                                       ..C.

No.     Time           Source                Destination           Protocol Length Info
     46 0.000000       2.21.0                host                  USB      95     GET DESCRIPTOR Response CONFIGURATION

Frame 46: Packet, 95 bytes on wire (760 bits), 95 bytes captured (760 bits) on interface \\.\USBPcap2, id 0
USB URB
    [Source: 2.21.0]
    [Destination: host]
    USBPcap pseudoheader length: 28
    IRP ID: 0x0000000000000000
    IRP USBD_STATUS: USBD_STATUS_SUCCESS (0x00000000)
    URB Function: URB_FUNCTION_CONTROL_TRANSFER (0x0008)
    IRP information: 0x01, Direction: PDO -> FDO
    URB bus id: 2
    Device address: 21
    Endpoint: 0x80, Direction: IN
    URB transfer type: URB_CONTROL (0x02)
    Packet Data Length: 67
    [Request in: 45]
    [Time from request: 0.000000000 seconds]
    Control transfer stage: Complete (3)
CONFIGURATION DESCRIPTOR
    bLength: 9
    bDescriptorType: 0x02 (CONFIGURATION)
    wTotalLength: 67
    bNumInterfaces: 2
    bConfigurationValue: 1
    iConfiguration: 0
    Configuration bmAttributes: 0xa0  NOT SELF-POWERED  REMOTE-WAKEUP
    bMaxPower: 250  (500mA)
INTERFACE DESCRIPTOR (0.0): class Communications and CDC Control
    bLength: 9
    bDescriptorType: 0x04 (INTERFACE)
    bInterfaceNumber: 0
    bAlternateSetting: 0
    bNumEndpoints: 1
    bInterfaceClass: Communications and CDC Control (0x02)
    bInterfaceSubClass: Abstract Control Model (0x02)
    bInterfaceProtocol: AT Commands: V.250 etc (0x01)
    iInterface: 0
COMMUNICATIONS DESCRIPTOR
COMMUNICATIONS DESCRIPTOR
COMMUNICATIONS DESCRIPTOR
COMMUNICATIONS DESCRIPTOR
ENDPOINT DESCRIPTOR
    bLength: 7
    bDescriptorType: 0x05 (ENDPOINT)
    bEndpointAddress: 0x81  IN  Endpoint:1
    bmAttributes: 0x03
    wMaxPacketSize: 8
    bInterval: 255
INTERFACE DESCRIPTOR (1.0): class CDC-Data
    bLength: 9
    bDescriptorType: 0x04 (INTERFACE)
    bInterfaceNumber: 1
    bAlternateSetting: 0
    bNumEndpoints: 2
    bInterfaceClass: CDC-Data (0x0a)
    bInterfaceSubClass: 0x00
    bInterfaceProtocol: No class specific protocol required (0x00)
    iInterface: 0
ENDPOINT DESCRIPTOR
    bLength: 7
    bDescriptorType: 0x05 (ENDPOINT)
    bEndpointAddress: 0x82  IN  Endpoint:2
    bmAttributes: 0x02
    wMaxPacketSize: 64
    bInterval: 0
ENDPOINT DESCRIPTOR
    bLength: 7
    bDescriptorType: 0x05 (ENDPOINT)
    bEndpointAddress: 0x03  OUT  Endpoint:3
    bmAttributes: 0x02
    wMaxPacketSize: 64
    bInterval: 0

0000  1c 00 00 00 00 00 00 00 00 00 00 00 00 00 08 00   ................
0010  01 02 00 15 00 80 02 43 00 00 00 03 09 02 43 00   .......C......C.
0020  02 01 00 a0 fa 09 04 00 00 01 02 02 01 00 05 24   ...............$
0030  00 10 01 05 24 01 00 00 04 24 02 02 05 24 06 00   ....$....$...$..
0040  01 07 05 81 03 08 00 ff 09 04 01 00 02 0a 00 00   ................
0050  00 07 05 82 02 40 00 00 07 05 03 02 40 00 00      .....@......@..

No.     Time           Source                Destination           Protocol Length Info
     47 0.000000       host                  2.21.0                USB      36     SET CONFIGURATION Request

Frame 47: Packet, 36 bytes on wire (288 bits), 36 bytes captured (288 bits) on interface \\.\USBPcap2, id 0
USB URB
    [Source: host]
    [Destination: 2.21.0]
    USBPcap pseudoheader length: 28
    IRP ID: 0x0000000000000000
    IRP USBD_STATUS: USBD_STATUS_SUCCESS (0x00000000)
    URB Function: URB_FUNCTION_SELECT_CONFIGURATION (0x0000)
    IRP information: 0x00, Direction: FDO -> PDO
    URB bus id: 2
    Device address: 21
    Endpoint: 0x00, Direction: OUT
    URB transfer type: URB_CONTROL (0x02)
    Packet Data Length: 8
    [Response in: 48]
    Control transfer stage: Setup (0)
Setup Data

0000  1c 00 00 00 00 00 00 00 00 00 00 00 00 00 00 00   ................
0010  00 02 00 15 00 00 02 08 00 00 00 00 00 09 01 00   ................
0020  00 00 00 00                                       ....

No.     Time           Source                Destination           Protocol Length Info
     48 0.000000       2.21.0                host                  USB      28     SET CONFIGURATION Response

Frame 48: Packet, 28 bytes on wire (224 bits), 28 bytes captured (224 bits) on interface \\.\USBPcap2, id 0
USB URB
    [Source: 2.21.0]
    [Destination: host]
    USBPcap pseudoheader length: 28
    IRP ID: 0x0000000000000000
    IRP USBD_STATUS: USBD_STATUS_SUCCESS (0x00000000)
    URB Function: URB_FUNCTION_SELECT_CONFIGURATION (0x0000)
    IRP information: 0x01, Direction: PDO -> FDO
    URB bus id: 2
    Device address: 21
    Endpoint: 0x00, Direction: OUT
    URB transfer type: URB_CONTROL (0x02)
    Packet Data Length: 0
    [Request in: 47]
    [Time from request: 0.000000000 seconds]
    Control transfer stage: Complete (3)

0000  1c 00 00 00 00 00 00 00 00 00 00 00 00 00 00 00   ................
0010  01 02 00 15 00 00 02 00 00 00 00 03               ............

No.     Time           Source                Destination           Protocol Length Info
  10703 15.491273      host                  2.21.2                USB      27     URB_BULK in

Frame 10703: Packet, 27 bytes on wire (216 bits), 27 bytes captured (216 bits) on interface \\.\USBPcap2, id 0
USB URB
    [Source: host]
    [Destination: 2.21.2]
    USBPcap pseudoheader length: 27
    IRP ID: 0xffffc888cf8d9740
    IRP USBD_STATUS: USBD_STATUS_SUCCESS (0x00000000)
    URB Function: URB_FUNCTION_BULK_OR_INTERRUPT_TRANSFER (0x0009)
    IRP information: 0x00, Direction: FDO -> PDO
    URB bus id: 2
    Device address: 21
    Endpoint: 0x82, Direction: IN
    URB transfer type: URB_BULK (0x03)
    Packet Data Length: 0
    [Response in: 10709]
    [bInterfaceClass: CDC-Data (0x0a)]

0000  1b 00 40 97 8d cf 88 c8 ff ff 00 00 00 00 09 00   ..@.............
0010  00 02 00 15 00 82 03 00 00 00 00                  ...........

No.     Time           Source                Destination           Protocol Length Info
  10704 15.491303      host                  2.21.1                USB      27     URB_INTERRUPT in

Frame 10704: Packet, 27 bytes on wire (216 bits), 27 bytes captured (216 bits) on interface \\.\USBPcap2, id 0
USB URB
    [Source: host]
    [Destination: 2.21.1]
    USBPcap pseudoheader length: 27
    IRP ID: 0xffffc888cfa43050
    IRP USBD_STATUS: USBD_STATUS_SUCCESS (0x00000000)
    URB Function: URB_FUNCTION_BULK_OR_INTERRUPT_TRANSFER (0x0009)
    IRP information: 0x00, Direction: FDO -> PDO
    URB bus id: 2
    Device address: 21
    Endpoint: 0x81, Direction: IN
    URB transfer type: URB_INTERRUPT (0x01)
    Packet Data Length: 0
    [Response in: 10710]
    [bInterfaceClass: Communications and CDC Control (0x02)]

0000  1b 00 50 30 a4 cf 88 c8 ff ff 00 00 00 00 09 00   ..P0............
0010  00 02 00 15 00 81 01 00 00 00 00                  ...........

No.     Time           Source                Destination           Protocol Length Info
  10705 15.491334      host                  2.21.0                USBCOM   36     GET LINE CODING Request

Frame 10705: Packet, 36 bytes on wire (288 bits), 36 bytes captured (288 bits) on interface \\.\USBPcap2, id 0
USB URB
    [Source: host]
    [Destination: 2.21.0]
    USBPcap pseudoheader length: 28
    IRP ID: 0xffffc888c6825760
    IRP USBD_STATUS: USBD_STATUS_SUCCESS (0x00000000)
    URB Function: URB_FUNCTION_CONTROL_TRANSFER (0x0008)
    IRP information: 0x00, Direction: FDO -> PDO
    URB bus id: 2
    Device address: 21
    Endpoint: 0x80, Direction: IN
    URB transfer type: URB_CONTROL (0x02)
    Packet Data Length: 8
    [Response in: 10706]
    Control transfer stage: Setup (0)
    [bInterfaceClass: Communications and CDC Control (0x02)]
Setup Data

0000  1c 00 60 57 82 c6 88 c8 ff ff 00 00 00 00 08 00   ..`W............
0010  00 02 00 15 00 80 02 08 00 00 00 00 a1 21 00 00   .............!..
0020  00 00 07 00                                       ....

No.     Time           Source                Destination           Protocol Length Info
  10706 15.491502      2.21.0                host                  USBCOM   35     GET LINE CODING Response

Frame 10706: Packet, 35 bytes on wire (280 bits), 35 bytes captured (280 bits) on interface \\.\USBPcap2, id 0
USB URB
    [Source: 2.21.0]
    [Destination: host]
    USBPcap pseudoheader length: 28
    IRP ID: 0xffffc888c6825760
    IRP USBD_STATUS: USBD_STATUS_SUCCESS (0x00000000)
    URB Function: URB_FUNCTION_CONTROL_TRANSFER (0x0008)
    IRP information: 0x01, Direction: PDO -> FDO
    URB bus id: 2
    Device address: 21
    Endpoint: 0x80, Direction: IN
    URB transfer type: URB_CONTROL (0x02)
    Packet Data Length: 7
    [Request in: 10705]
    [Time from request: 168.000 microseconds]
    Control transfer stage: Complete (3)
    [bInterfaceClass: Communications and CDC Control (0x02)]
USB Communications and CDC Control

0000  1c 00 60 57 82 c6 88 c8 ff ff 00 00 00 00 08 00   ..`W............
0010  01 02 00 15 00 80 02 07 00 00 00 03 00 00 00 06   ................
0020  00 00 08                                          ...

No.     Time           Source                Destination           Protocol Length Info
  10707 15.491524      host                  2.21.0                USBCOM   36     GET LINE CODING Request

Frame 10707: Packet, 36 bytes on wire (288 bits), 36 bytes captured (288 bits) on interface \\.\USBPcap2, id 0
USB URB
    [Source: host]
    [Destination: 2.21.0]
    USBPcap pseudoheader length: 28
    IRP ID: 0xffffc888c6825760
    IRP USBD_STATUS: USBD_STATUS_SUCCESS (0x00000000)
    URB Function: URB_FUNCTION_CONTROL_TRANSFER (0x0008)
    IRP information: 0x00, Direction: FDO -> PDO
    URB bus id: 2
    Device address: 21
    Endpoint: 0x80, Direction: IN
    URB transfer type: URB_CONTROL (0x02)
    Packet Data Length: 8
    [Response in: 10708]
    Control transfer stage: Setup (0)
    [bInterfaceClass: Communications and CDC Control (0x02)]
Setup Data

0000  1c 00 60 57 82 c6 88 c8 ff ff 00 00 00 00 08 00   ..`W............
0010  00 02 00 15 00 80 02 08 00 00 00 00 a1 21 00 00   .............!..
0020  00 00 07 00                                       ....

No.     Time           Source                Destination           Protocol Length Info
  10708 15.491680      2.21.0                host                  USBCOM   35     GET LINE CODING Response

Frame 10708: Packet, 35 bytes on wire (280 bits), 35 bytes captured (280 bits) on interface \\.\USBPcap2, id 0
USB URB
    [Source: 2.21.0]
    [Destination: host]
    USBPcap pseudoheader length: 28
    IRP ID: 0xffffc888c6825760
    IRP USBD_STATUS: USBD_STATUS_SUCCESS (0x00000000)
    URB Function: URB_FUNCTION_CONTROL_TRANSFER (0x0008)
    IRP information: 0x01, Direction: PDO -> FDO
    URB bus id: 2
    Device address: 21
    Endpoint: 0x80, Direction: IN
    URB transfer type: URB_CONTROL (0x02)
    Packet Data Length: 7
    [Request in: 10707]
    [Time from request: 156.000 microseconds]
    Control transfer stage: Complete (3)
    [bInterfaceClass: Communications and CDC Control (0x02)]
USB Communications and CDC Control

0000  1c 00 60 57 82 c6 88 c8 ff ff 00 00 00 00 08 00   ..`W............
0010  01 02 00 15 00 80 02 07 00 00 00 03 00 00 00 06   ................
0020  00 00 08                                          ...

No.     Time           Source                Destination           Protocol Length Info
  10709 15.493657      2.21.2                host                  USB      27     URB_BULK in

Frame 10709: Packet, 27 bytes on wire (216 bits), 27 bytes captured (216 bits) on interface \\.\USBPcap2, id 0
USB URB
    [Source: 2.21.2]
    [Destination: host]
    USBPcap pseudoheader length: 27
    IRP ID: 0xffffc888cf8d9740
    IRP USBD_STATUS: USBD_STATUS_CANCELED (0xc0010000)
    URB Function: URB_FUNCTION_BULK_OR_INTERRUPT_TRANSFER (0x0009)
    IRP information: 0x01, Direction: PDO -> FDO
    URB bus id: 2
    Device address: 21
    Endpoint: 0x82, Direction: IN
    URB transfer type: URB_BULK (0x03)
    Packet Data Length: 0
    [Request in: 10703]
    [Time from request: 2.384000 milliseconds]
    [bInterfaceClass: CDC-Data (0x0a)]

0000  1b 00 40 97 8d cf 88 c8 ff ff 00 00 01 c0 09 00   ..@.............
0010  01 02 00 15 00 82 03 00 00 00 00                  ...........

No.     Time           Source                Destination           Protocol Length Info
  10710 15.495709      2.21.1                host                  USB      27     URB_INTERRUPT in

Frame 10710: Packet, 27 bytes on wire (216 bits), 27 bytes captured (216 bits) on interface \\.\USBPcap2, id 0
USB URB
    [Source: 2.21.1]
    [Destination: host]
    USBPcap pseudoheader length: 27
    IRP ID: 0xffffc888cfa43050
    IRP USBD_STATUS: USBD_STATUS_CANCELED (0xc0010000)
    URB Function: URB_FUNCTION_BULK_OR_INTERRUPT_TRANSFER (0x0009)
    IRP information: 0x01, Direction: PDO -> FDO
    URB bus id: 2
    Device address: 21
    Endpoint: 0x81, Direction: IN
    URB transfer type: URB_INTERRUPT (0x01)
    Packet Data Length: 0
    [Request in: 10704]
    [Time from request: 4.406000 milliseconds]
    [bInterfaceClass: Communications and CDC Control (0x02)]

0000  1b 00 50 30 a4 cf 88 c8 ff ff 00 00 01 c0 09 00   ..P0............
0010  01 02 00 15 00 81 01 00 00 00 00                  ...........

No.     Time           Source                Destination           Protocol Length Info
  10711 15.495728      host                  2.21.0                USBCOM   36     SET CONTROL LINE STATE Request

Frame 10711: Packet, 36 bytes on wire (288 bits), 36 bytes captured (288 bits) on interface \\.\USBPcap2, id 0
USB URB
    [Source: host]
    [Destination: 2.21.0]
    USBPcap pseudoheader length: 28
    IRP ID: 0xffffc888c6825760
    IRP USBD_STATUS: USBD_STATUS_SUCCESS (0x00000000)
    URB Function: URB_FUNCTION_CONTROL_TRANSFER (0x0008)
    IRP information: 0x00, Direction: FDO -> PDO
    URB bus id: 2
    Device address: 21
    Endpoint: 0x00, Direction: OUT
    URB transfer type: URB_CONTROL (0x02)
    Packet Data Length: 8
    [Response in: 10712]
    Control transfer stage: Setup (0)
    [bInterfaceClass: Communications and CDC Control (0x02)]
Setup Data

0000  1c 00 60 57 82 c6 88 c8 ff ff 00 00 00 00 08 00   ..`W............
0010  00 02 00 15 00 00 02 08 00 00 00 00 21 22 00 00   ............!"..
0020  00 00 00 00                                       ....

No.     Time           Source                Destination           Protocol Length Info
  10712 15.495794      2.21.0                host                  USB      28     URB_CONTROL out

Frame 10712: Packet, 28 bytes on wire (224 bits), 28 bytes captured (224 bits) on interface \\.\USBPcap2, id 0
USB URB
    [Source: 2.21.0]
    [Destination: host]
    USBPcap pseudoheader length: 28
    IRP ID: 0xffffc888c6825760
    IRP USBD_STATUS: USBD_STATUS_SUCCESS (0x00000000)
    URB Function: URB_FUNCTION_CONTROL_TRANSFER (0x0008)
    IRP information: 0x01, Direction: PDO -> FDO
    URB bus id: 2
    Device address: 21
    Endpoint: 0x00, Direction: OUT
    URB transfer type: URB_CONTROL (0x02)
    Packet Data Length: 0
    [Request in: 10711]
    [Time from request: 66.000 microseconds]
    Control transfer stage: Complete (3)
    [bInterfaceClass: Communications and CDC Control (0x02)]

0000  1c 00 60 57 82 c6 88 c8 ff ff 00 00 00 00 08 00   ..`W............
0010  01 02 00 15 00 00 02 00 00 00 00 03               ............
